Claim Text,Source of Verification,url,Given Label,Filtered Label
Sophie Trudeau releases a video warning people against COVID-19,thequint.com,https://www.thequint.com/news/webqoof/canadian-pm-wife-releases-video-warning-against-covid-19-fact-check,False,false
A US biotech company has successfully created a vaccine for COVID-19,boomlive.in,https://www.boomlive.in/world/coronavirus/did-a-us-biotech-company-already-develop-a-covid-19-vaccine-7372,False,false
"Philippines' Social Security System or SSS will give P20,000 to each of its members as financial aid during COVID-19 outbreak",verafiles.org,https://verafiles.org/articles/vera-files-fact-check-story-sss-giving-members-p20k-amid-cov,False,false
Genuine graphic quoting Philippine vice president Leni Roberdo on COVID-19 response,factcheck.afp.com,https://factcheck.afp.com/graphic-purported-quote-philippine-vice-president-leni-robredo-has-been-doctored,False,false
Residents in India to stay indoors during nighttime COVID-19 disinfectant spraying,factcheck.afp.com,https://factcheck.afp.com/indian-authorities-refute-fake-advisory-which-claimed-disinfectant-would-be-sprayed-across-india,False,false
"Photos show military was drafted to maintain public order during COVID-19 outbreak in USA, South Korea, India, China, Japan, Vietnam, and Iran",verafiles.org,https://verafiles.org/articles/vera-files-fact-check-fb-post-countries-drafting-military-pu,Misleading,false
Photo shows trucks in Italy to transport COVID-19 corpses,factrakers.org,https://www.factrakers.org/post/trucks-were-in-france-not-italy-and-not-virus-related,Misleading,false
Youngsters deliberately coughing on produce in grocery stores during the COVID-19 pandemic is a nationwide trend in the U.S.,snopes.com,https://www.snopes.com/fact-check/coughing-on-produce/,False,false
WebQoof Recap: From COVID-19 Infodemic to BJP MP on Delhi Violence,thequint.com,https://www.thequint.com/news/webqoof/webqoof-coronavirus-and-bjp-lekhi-on-delhi-violence-fact-check,False,false
WHO Partners With WhatsApp to Counter Fake News Around COVID-19,thequint.com,https://www.thequint.com/news/webqoof/who-partners-with-whatsapp-to-counter-fake-news-around-covid-19,False,false
You should gargle as a prevention with salt in warm water.,fullfact.org,https://fullfact.org/online/viral-posts-sharing-symptoms-and-treatments-covid-19-contain-false-information/,There’s no evidence this will prevent or cure the virus.,false
"Covid-19 starts with a sore throat lasting 3-4 days. It then blends into a nasal fluid that enters the trachea and the lungs, causing pneumonia, which takes about 5 or 6 days. With pneumonia comes high fever and difficulty breathing. The nasal congestion makes you feel like you’re drowning.",fullfact.org,https://fullfact.org/online/viral-posts-sharing-symptoms-and-treatments-covid-19-contain-false-information/,"This is a roughly accurate description of the most common symptoms, although not everyone with Covid-19 gets pneumonia. The symptoms may not come in this order or at these times. There have been no reports of sufferers experiencing nasal congestion that makes them feel they are drowning.",false
It can survive for 6-12 hours on fabric and will be killed by normal laundry detergent .,fullfact.org,https://fullfact.org/online/viral-posts-sharing-symptoms-and-treatments-covid-19-contain-false-information/,There’s no evidence the virus can survive in clothing and be transmitted this way.,false
The new virus is not heat-resistant and will be killed by a temperature of 26/27 degrees. It hates the Sun.,fullfact.org,https://fullfact.org/online/viral-posts-sharing-symptoms-and-treatments-covid-19-contain-false-information/,"There’s no evidence for this. There’s evidence that similar viruses transmit less well in the heat, but many countries with reported Covid-19 cases are experiencing temperatures higher than this.",false
"Press Release on movement restriction for COVID-19 outbreak by National Security Council, PMO (India)",factly.in,https://factly.in/the-press-release-on-movement-restriction-for-covid-19-outbreak-was-issued-by-pmo-malaysia-not-pmo-india/,FALSE,false
Government spraying medicine to kill COVID-19,thequint.com,https://www.thequint.com/news/webqoof/govt-spraying-medicine-in-the-air-to-kill-covid-19-its-fake,False,false
Indian government distributing free face masks during COVID-19 pandemic,factcheck.afp.com,https://factcheck.afp.com/indian-government-said-there-no-free-mask-scheme-place-claim-was-published-fraudulent-website,False,false
"Duterte OKs' P20,000 aid for all SSS members amid COVID-19 lockdown",factrakers.org,https://www.factrakers.org/post/p20-000-per-sss-member-to-cope-with-covid-19-crisis-a-hoax,False,false
"""George Soros owns the WuXi PHARMA LAB located in Wuhan, China where COVID-19 was developed and conveniently Broke Out.""",politifact.com,https://www.politifact.com/factchecks/2020/mar/19/facebook-posts/conspiracy-theory-falsely-connects-george-soros-co/,False,false
“People are going door to door in Colorado Springs stating they are COVID testing so they can rob people!!!!”,politifact.com,https://www.politifact.com/factchecks/2020/mar/19/facebook-posts/no-truth-report-about-robbers-posing-coronavirus-t/,False,false
"Says ""there is no"" COVID-19 virus.",politifact.com,https://www.politifact.com/factchecks/2020/mar/19/facebook-posts/facebook-users-are-claiming-there-no-coronavirus-s/,Pants on Fire,false
Headline claims Japan 'finally' produces drug vs COVID-19,factrakers.org,https://www.factrakers.org/post/headline-on-discovery-of-covid-19-drug-false-story-needs-context,False: Drug developed in 2014 for flu,false
Candian health authority issues video on COVID-19 transmission,factcheck.afp.com,https://factcheck.afp.com/video-was-made-uk-public-hospital-trust-2010-about-infections-hospitals,False,false
Photos show people in India bathing in cow dung to prevent COVID-19 infection,factcheck.afp.com,https://factcheck.afp.com/these-photos-show-indias-annual-cow-dung-festival-october-2019-weeks-coronavirus-outbreak,False,false
Zimbabwe reported its first positive COVID-19 test on March 16.,zimfact.org,https://zimfact.org/zimbabwe-coronavirus-test/,"The claim is false. As of March 17, Zimbabwe still had no confirmed case of coronavirus.",false
Genuine Philippine Department of Health advisory states clinics will turn away people showing COVID-19 symptoms,factcheck.afp.com,https://factcheck.afp.com/philippine-department-health-says-it-did-not-issue-advisory,False,false
"According to University of Queensland (Australia) scientists, bananas are an effective defence against the COVID-19.",boomlive.in,https://www.boomlive.in/world/coronavirus/australian-news-report-edited-to-show-bananas-defend-against-covid-19-7266,False,false
Telangana: 3 Held for Peddling Fake News on COVID-19 via WhatsApp,thequint.com,https://www.thequint.com/news/webqoof/telangana-3-held-for-peddling-fake-news-on-covid-19-via-whatsapp,False,false
Video of Police in China taking into control suspected COVID-19 patients in the country,factly.in,https://factly.in/video-from-hong-kong-shared-as-police-brutality-on-suspected-covid-19-patients-in-china/,FALSE,false
People with Covid-19 should not take ibuprofen,fullfact.org,https://fullfact.org/health/covid-19-ibuprofen/,"There are concerns ibuprofen can aggravate underlying health issues. There is no strong evidence on how ibuprofen affects Covid-19 sufferers yet, but some experts suggest taking paracetamol is preferable.The NHS has changed its guidance on the new coronavirus to reflect this.",false
Parents can receive a case of baby formula during the COVID-19 pandemic by calling the number on the back of the company's product.,snopes.com,https://www.snopes.com/fact-check/free-case-of-baby-formula/,False,false
Doctor Thoranin Kongsuk has written an objective summary of COVID-19 in an easy way to read.,boomlive.in,https://www.boomlive.in/world/coronavirus/inaccurate-covid-19-details-falsely-attributed-to-thai-doctor-7217,False,false
COVID-19 found in tissue paper,vishvasnews.com,https://www.vishvasnews.com/english/health/fact-check-post-claiming-covid-19-breeds-rapidly-in-toilet-paper-is-fake/,False,false
Office memorandum regarding the declaration of holidays in four states by MOHFW due to COVID-19.,boomlive.in,https://www.boomlive.in/fast-check/fake-letter-claiming-health-ministry-declared-holidays-in-4-states-7209,False,false
"“Now, they’re doing tests on airlines — very strong tests — for getting on, getting off. They’re doing tests on trains — getting on, getting off.”",politifact.com,https://www.politifact.com/factchecks/2020/apr/06/donald-trump/donald-trump-wrong-about-covid-19-testing-airplane/,Pants on Fire,false
Most affected countries by COVID-19 are along the same 40-degree North latitude,factly.in,https://factly.in/not-all-the-countries-severely-affected-by-covid-19-are-on-the-40-degree-north-latitude/,FALSE,false
No more deaths from COVID-19 as Israel scientists have discovered a vaccine for COVID-19,factly.in,https://factly.in/as-of-today-there-is-no-vaccine-for-covid-19-the-vaccine-by-israeli-scientists-is-yet-to-be-approved/,FALSE,false
Covid-19 can be transmitted between humans and pets.,fullfact.org,https://fullfact.org/health/can-animals-catch-coronavirus-from-humans/,"There is one reported case of a pet dog in Hong Kong testing ‘weak positive’ for Covid-19. However, the dog is showing no symptoms and there is some question to whether the positive test is valid. The WHO and NHS says there is no evidence that pets can become infected or pass the virus to people.",false
Isreali scientists created a COVID-19 vaccine in February 2020.,namibiafactcheck.org.na,https://namibiafactcheck.org.na/report/false-israeli-scientists-have-not-created-a-covid-19-vaccine/,FALSE: Isreali scientists did not create a COVID-19 vaccine in February 2020.,false
Philippine authorities seize fake cigarettes spreading COVID-19,factcheck.afp.com,https://factcheck.afp.com/report-hoax-video-was-filmed-one-year-novel-coronavirus-outbreak,False,false
Chloroquine is solution to COVID19,factcheck.afp.com,https://factcheck.afp.com/chloroquine-has-not-been-approved-treatment-covid-19,Misleading,false
WebQoof Recap: From Targeting Shaheen Bagh Women to COVID-19 Scare,thequint.com,https://www.thequint.com/news/webqoof/fake-news-weekly-round-up-1-to-6-march-2020,False,false
"Humans kill 1,300 fellow humans every day.",fullfact.org,https://fullfact.org/online/coronavirus-daily-deaths/,This is broadly correct if just considering homicides and not including war or terrorism.,false
"Mosquitoes kill 2,740 people every day.",fullfact.org,https://fullfact.org/online/coronavirus-daily-deaths/,"This appears to be an overestimate. Mosquitoes are responsible for no more than around 700,000 deaths per year, or 1,900 a day.",false
Drinking Water Every 15 Minutes Save You From COVID-19,fit.thequint.com,https://fit.thequint.com/fit-webqoof/fact-check-will-drinking-water-save-you-from-coronavirus,False,false
Runny nose and coughing sputum suggest that one does not have COVID-19. They are not symptoms of COVID-19,factly.in,https://factly.in/runny-nose-and-sputum-production-are-also-symptoms-of-covid-19/,FALSE,false
Gargling with warm water and salt will prevent COVID-19,factly.in,https://factly.in/false-and-unverified-covid-19-claims-are-circulated-in-the-name-of-unicef/,FALSE,false
"“The US is charging over $3,000 per test” for patients who may have COVID-19.",factcheck.org,https://www.factcheck.org/2020/03/covid-19-tests-dont-cost-over-3000/,False,false
"“If you look at swine flu …17,000 people died.”",washingtonpost.com,https://www.washingtonpost.com/politics/2020/03/27/those-covid-19-death-toll-figures-are-incomplete/,Not the Whole Story,false
"Chloroquine has ""gone through the approval process; it's been approved. And [the FDA] took it down from many, many months to immediate. So we're going to be able to make that drug available by prescription.""",factcheck.org,https://www.factcheck.org/2020/03/trump-gets-ahead-of-himself-on-covid-19-therapies/,Misleading,false
People with black skin and African genes are resistant to COVID-19 infection.,namibiafactcheck.org.na,https://namibiafactcheck.org.na/report/false-dark-skin-and-african-genes-do-not-prevent-coronavirus-infection/,FALSE: There is no evidence that a dark skin and African genes make people resistant to novel coronavirus (COVID-19) infection.,false
"Video shows patients dancing and not maintaining physical distancing at COVID-19 care centre in Worli, Mumbai.",boomlive.in,https://www.boomlive.in/fake-news/no-video-of-patients-dancing-at-covid-19-centre-is-not-from-mumbai-8471,False,false
Video of medical professionals celebrating is from New Zealand.,thelogicalindian.com,https://thelogicalindian.com/fact-check/medical-professionals-celebrating-new-zealand-covid-19-21720,False,false
"COVID-19 is caused by bacteria, exacerbated by 5G technology and can be cured using painkillers and antibiotics.",boomlive.in,https://www.boomlive.in/world/no-covid-19-is-not-caused-by-bacteria-or-cured-by-antibiotics-8396,False,false
Dead bodies are piled up at a hospital in Delhi,thelogicalindian.com,https://thelogicalindian.com/fact-check/delhi-mumbai-kem-hospital-dead-bodies-covid-19-21444,Misleading,false
Viral video claims to be from a hospital in Delhi where wards are full of COVID-19 patients,boomlive.in,https://www.boomlive.in/video-from-covid-19-ward-in-mumbai,False,false
An article claims that a nearly $50 million United Nations humanitarian aid package to Ecuador is conditional on the South American country legalizing abortions.,boomlive.in,https://www.boomlive.in/world/did-un-demand-ecuador-to-legalise-abortions-to-get-covid-19-aid-8234,False,false
No one in the USA died of the flu in 2020.,boomlive.in,https://www.boomlive.in/world/false-posts-claim-us-recorded-no-flu-deaths-during-covid-19-crisis-8218,False,false
Facebook posts that claim that Kawasaki disease is spreading among babies during the COVID-19 pandemic.,boomlive.in,https://www.boomlive.in/world/are-babies-contracting-kawasaki-disease-during-the-covid-19-pandemic-8193,Misleading,false
Video shows a Rohingya Muslim man mistook a temperature screening device for a gun,boomlive.in,https://www.boomlive.in/fake-news/video-of-kenyan-skit-on-covid-19-peddled-with-rohingya-muslim-spin-8143,False,false
"A Facebook post claims a 5G tower ""was put up OVERNIGHT in Beaconsfield Victoria Australia under the cover of darkness"".",aap.com.au,https://www.aap.com.au/phone-tower-put-up-overnight-in-covid-19-conspiracy-claim-has-been-there-at-least-seven-months/,False - The implications of the content are factually inaccurate.,false
"A video makes a number of false and misleading claims, including that viruses cannot be caught and that a virus is a solvent.",aap.com.au,https://www.aap.com.au/false-claims-about-viruses-and-covid-19-in-facebook-video/,False - The primary claims of the content are factually incorrect.,false
Indonesian Dr Hadiyo Ali's last picture saying farewell to his pregnant wife and two childrem,altnews.in,https://www.altnews.in/an-image-from-malaysia-has-been-shared-as-indonesian-doctor-who-died-while-treating-coronavirus-patients/,False,false
"“We were slow with the testing, but very quick with the travel ban. And that's been much more critical in saving lives.”",politifact.com,https://www.politifact.com/factchecks/2020/apr/03/jesse-watters/are-covid-19-travel-restrictions-more-critical-sav/,False,false
Islamic call to prayer from the clouds,factcheck.afp.com,https://factcheck.afp.com/video-shows-berlin-mosque-broadcasting-call-prayer-during-covid-19-pandemic,False,false
Women wore nose veil during the 1918 Spanish Flu pandemic.,boomlive.in,https://www.boomlive.in/world/photo-of-1913-fashion-trend-shared-with-spanish-flu-pandemic-claim-8528,False,false
Photo shows scene during the 1918-20 influenza pandemic,factcheck.afp.com,https://factcheck.afp.com/photo-has-circulated-reports-about-fashion-1913,Misleading,false
"A post claims media coverage of US riots and the COVID-19 pandemic ""distracted"" people from a court appearance by former US secretary of state Hilary Clinton.",aap.com.au,https://www.aap.com.au/hillary-clinton-has-not-had-her-day-in-court-nor-lost-her-case/,Partly false - The claims of the content are a mixture of accurate and inaccurate.,false
"Former White House Press Secretary Sarah Huckabee Sanders tweeted that recent events like the George Floyd protests, the pandemic, the impeachment, and the Russia investigation ""happened because Hillary [Clinton] lost.""",factcheck.org,https://www.factcheck.org/2020/06/sarah-huckabee-sanders-did-not-post-conspiratorial-tweet/,False,false
Authorities planted empty body bags in ‘fake’ pandemic plot,factcheck.afp.com,https://factcheck.afp.com/empty-body-bags-were-used-protests-and-not-part-fake-pandemic-plot,False,false
Set of pictures showing people in different kinds of masks is from the Spanish flu pandemic of 1918-20.,indiatoday.in,https://www.indiatoday.in/fact-check/story/unrelated-images-go-viral-as-scenes-from-100-year-old-spanish-flu-pandemic-1686932-2020-06-08,False,false
A photo shows three men on crosses who “feel like they’re being crucified by being required to stay at home.”,politifact.com,https://www.politifact.com/factchecks/2020/may/27/viral-image/no-crucifixion-photo-doesnt-show-pandemic-proteste/,False,false
Indians are throwing away gods since they are apparently not providing protection against the pandemic.,thelogicalindian.com,https://thelogicalindian.com/fact-check/hindu-ritual-immersion-covid-19-coronavirus-21266,False,false
A post claims that the 1918 influenza bout had a deadly second wave after quarantine restrictions were lifted.,fullfact.org,https://fullfact.org/online/spanish-flu-second-wave-quarantine/,"It is true the second wave of the pandemic was the most deadly, but it did not happen due to lifting of quarantine.",false
"“It has been transpiring that the current pandemic – as I have been told and also, I watched some programs I was sent via WhatsApp yesterday – is, after all, a bluff. If this pandemic turns out to be a bluff, what would you say then? If it becomes established that this pandemic is a trick, and the world admits that it is a bluff, will that not prove the truth of what that bishop said?”",polygraph.info,https://www.polygraph.info/a/in-georgia-clerics-use-anti-vaxx-rhetoric-call-coronavirus-pandemic-a-bluff-/30614624.html,False,false
Dr. Fauci disagreed with President Trump's decision to curtail travel from China early in the pandemic.,factcheck.thedispatch.com,https://factcheck.thedispatch.com/p/did-dr-fauci-disagree-with-trumps,False,false
The Obama administration left behind no playbook for dealing with pandemics for the next administration.,snopes.com,https://www.snopes.com/fact-check/obama-pandemic-playbook/,False,false
"“Billionaire currency speculator George Soros has hailed the Covid-19 pandemic as the crisis of his lifetime, all but salivating over the chance to remake society amid the ‘revolutionary moment’ he claims preceded the virus. “",polygraph.info,https://www.polygraph.info/a/30610483.html,Misleading,false
The Obama Administration left behind no pandemic game plan.,factcheck.thedispatch.com,https://factcheck.thedispatch.com/p/did-the-obama-administration-leave,False,false
"U.S. President Donald Trump tweeted that Barack Obama ""had 8 years to prepair the next president for a pandemic and he failed.""",snopes.com,https://www.snopes.com/fact-check/trump-tweet-obama-8-years/,False,false
"Pandemic-related shutdown orders are unconstitutional, and persons arrested for violating them can collect damages.",snopes.com,https://www.snopes.com/fact-check/shutdown-orders-damages/,False,false
This photo shows produce Sri Lankan farmers failed to sell during the COVID-19 pandemic,factcheck.afp.com,https://factcheck.afp.com/2017-photo-shows-food-waste-australia-it-unrelated-covid-19-pandemic,Misleading,false
Flu vaccine makes recipients more vulnerable to infections and “the first to die” during pandemic,factcheck.afp.com,https://factcheck.afp.com/misleading-claim-circulates-flu-vaccines-make-people-more-vulnerable-infections,Misleading,false
A cleaner was the only person allowed to sit at Kaaba shrine during pandemic,factcheck.afp.com,https://factcheck.afp.com/doctored-photo-original-image-has-circulated-reports-about-saudi-policeman,False,false
US currency notes are being printed during COVID-19 pandemic.,boomlive.in,https://www.boomlive.in/world/video-from-1991-tv-show-shared-with-false-claim-during-covid-19-crisis-7967,False,false
"A letter was written by F. Scott Fitzgerald in 1920 while the author was quarantined in France during the ""Spanish influenza"" pandemic.",snopes.com,https://www.snopes.com/fact-check/fitzgerald-letter-quarantine/,False,false
COVID-19 pandemic leading to many deaths in Pakistan.,boomlive.in,https://www.boomlive.in/world/no-these-photos-do-not-show-bodies-of-covid-19-victims-in-pakistan-7952,False,false
Africans attacked in China during COVID-19 pandemic.,boomlive.in,https://www.boomlive.in/world/videos-of-africans-attacked-in-china-revived-with-covid-19-spin-7953,False,false
Landmarks in Wuhan before COVID-19 pandemic.,boomlive.in,https://www.boomlive.in/world/does-this-video-show-a-series-of-landmarks-in-wuhan-a-fact-check-7946,False,false
Video shows Koran recitation as part of the Italian government's effort to fight COVID-19 pandemic,factcheck.afp.com,https://factcheck.afp.com/video-shows-interfaith-prayer-italy-remembrance-covid-19-victims,MISLEADING,false
Donald Trump tweeted about Barack Obamas handling of the H1N1 pandemic in 2009.,boomlive.in,https://www.boomlive.in/world/did-donald-trump-tweet-about-barack-obamas-handling-of-h1n1-in-2009-7883,False,false
The last flu pandemic was in 1920,factrakers.org,https://www.factrakers.org/post/coronavirus-pandemic-is-not-a-once-in-a-century-problem,False,false
"In 1986, the founder of the Times Square Church prophesied that he saw “a plague coming on the world and the bars and church and government will shut down,” with New York City especially hard hit.",politifact.com,https://www.politifact.com/factchecks/2020/apr/24/facebook-posts/no-pastor-david-wilkerson-did-not-predict-covid-19/,False,false
Video shows people in Italy praying on the street,factcheck.afp.com,https://factcheck.afp.com/footage-shows-people-praying-brazil-during-covid-19-pandemic,False,false
Muslims are praying on the streets of New York during COVID-19 pandemic.,boomlive.in,https://www.boomlive.in/world/no-muslims-are-not-praying-on-new-york-streets-during-covid-19-7788,False,false
Trump posted this tweet about H1N1 pandemic in 2009,factcheck.afp.com,https://factcheck.afp.com/trump-did-not-post-tweet-about-h1n1-pandemic-2009,False,false
Ask doctors about MRC-5 cells or iatrogenic reactions to legally decline vaccines,factcheck.afp.com,https://factcheck.afp.com/false-advice-refusing-vaccines-circulates-during-covid-19-pandemic,False,false
"CEOs of companies like Disney, Microsoft, IBM, Uber, LinkedIn have resigned due to the COVID-19 pandemic.",boomlive.in,https://www.boomlive.in/world/did-ceos-of-these-companies-resign-due-to-covid-19-crisis-a-fact-check-7756,Misleading,false
… yet they paid off Nigeria’s entire foreign debt.,africacheck.org,https://africacheck.org/reports/covid-19-pandemic-fact-checking-former-nigeria-vp-abubakars-claims-about-economy/,Incorrect,false
N13 billion was devoted to the State House clinic in the last five years.,africacheck.org,https://africacheck.org/reports/covid-19-pandemic-fact-checking-former-nigeria-vp-abubakars-claims-about-economy/,Incorrect,false
PM Modi dressed like it is a marriage reception at the hospital while a national pandemic is important,factly.in,https://factly.in/a-photo-taken-in-2017-falsely-shared-as-pm-modi-grandly-dressed-on-his-visit-to-a-hospital-recently/,FALSE,false
"“Clearly, the Obama administration did not leave any kind of game plan for something like this.”",politifact.com,https://www.politifact.com/factchecks/2020/may/14/mitch-mcconnell/evidence-counters-mcconnell-claim-obama-team-left-/,Pants on Fire,false
"U.S. President Donald Trump tweeted in November 2009 that ""Obama's handling of this whole pandemic has been terrible!"" and that he ""would never let thousands of Americans die from a pandemic while in office.""",snopes.com,https://www.snopes.com/fact-check/2009-trump-tweet-pandemic/,False,false
Industrialist Ratan Tata speaks on the Indian economy bouncing back post COVID-19 pandemic.,thelogicalindian.com,https://thelogicalindian.com/fact-check/ratan-tata-economy-covid19-20640,False,false
Video shows Nigerians scrambling for food amid virus lockdown,factcheck.afp.com,https://factcheck.afp.com/footage-was-taken-during-electoral-campaign-months-pandemic,False,false
“’No discrimination’ against Africans amid pandemic.”,polygraph.info,https://www.polygraph.info/a/30559882.html,False,false
Presidential spox Panelo faults poor for hardship they're experiencing during pandemic lockdown,factrakers.org,https://www.factrakers.org/post/panelo-s-anti-poor-quote-concocted,False,false
A quarantine detector dog working during the COVID-19 pandemic was kicked by an uncooperative passenger. The dog fled to a staff member who comforted the animal.,boomlive.in,https://www.boomlive.in/world/coronavirus/quarantine-detector-dog-assaulted-during-coronavirus-pandemic-7687,False,false
"""This particular pandemic is one where I don’t think nationwide, there’s been a single fatality under 25.""",politifact.com,https://www.politifact.com/factchecks/2020/apr/10/ron-desantis/florida-governor-falsely-claims-novel-coronavirus-/,Pants on Fire,false
