Claim Text,Source of Verification,url,Given Label,Filtered Label
Image of COVID-19 infected person's throat,factly.in,https://factly.in/an-old-image-falsely-shared-as-image-of-covid-19-infected-persons-throat/,FALSE,false
No one under the age of 25 has died from coronavirus,factcheck.thedispatch.com,https://factcheck.thedispatch.com/p/has-anyone-younger-than-25-died-from,False,false
Seven children in Senegal died after being given a vaccine for coronavirus,factcheck.afp.com,https://factcheck.afp.com/senegalese-children-did-not-die-coronavirus-vaccine-which-does-not-yet-exist,False,false
Mustard oil can kill coronavirus,vishvasnews.com,https://www.vishvasnews.com/english/health/fact-check-no-mustard-oil-cannot-cure-coronavirus-however-it-has-certain-health-benefits/,False,false
Ratan Tata has said that human motivation and determined efforts will make experts' predictions go wrong regarding the fall of the Indian economy during the COVID-19 crisis,factly.in,https://factly.in/no-ratan-tata-hasnt-said-that-human-motivation-and-determined-efforts-will-make-experts-predictions-go-wrong-regarding-the-indian-economy/,FALSE,false
Nigeria spent 1 billion naira on COVID-19 text messages,factcheck.afp.com,https://factcheck.afp.com/claim-nigeria-spent-1-billion-naira-covid-19-text-messages-came-fabricated-tweet,False,false
South Africa's president asks foreigners to leave due to COVID-19,factcheck.afp.com,https://factcheck.afp.com/south-africa-leader-did-not-ask-foreigners-leave-country-due-covid-19,False,false
"“Mass vaccination for COVID-19 in Senegal was started yesterday (4/8) and the first 7 CHILDREN who received it DIED on the spot.""",factcheck.org,https://www.factcheck.org/2020/04/false-claim-of-deadly-coronavirus-vaccine-trial-in-africa/,False,false
Video shows a Muslim youth caught while trying to contaminate fruits with his spit,boomlive.in,https://www.boomlive.in/fake-news/video-of-youth-thrashed-in-bawana-shared-with-false-coronavirus-claims-7630,False,false
The Government of Andhra Pradesh has made Kanipakam temple a quarantine center for coronavirus suspects,factly.in,https://factly.in/the-quarantine-center-seen-in-the-video-is-not-kanipakam-temple-its-a-pilgrim-lodge-in-kanipakam/,FALSE,false
Govt Steps in As TikTok Sees Surge in Fanatical COVID-19 Fake News,thequint.com,https://www.thequint.com/news/webqoof/government-intervenes-on-religiously-charged-covid-19-fake-news-on-tiktok,False,false
Italy suffered a spike in novel coronavirus infections as a direct result of Italian citizens wearing shoes in their homes.,boomlive.in,https://www.boomlive.in/world/coronavirus/wearing-shoes-indoors-spiked-covid-19-cases-in-italy-a-factcheck-7614,False,false
Italy’s spike in novel coronavirus or COVID-19 numbers is a direct result of Italians wearing shoes at home,factcheck.afp.com,https://factcheck.afp.com/health-experts-refute-misleading-claim-wearing-shoes-indoors-main-reason-hike-covid-19-infections,Misleading,false
"A post shared hundreds of times on Facebook claims that Didier Raoult, a French specialist in infectious diseases, is urging Africans “not to take Bill Gates vaccine” against coronavirus as it contains “poison”. This is false: the institute which Raoult directs denied he ever made these claims; moreover, no vaccine yet exists against coronavirus.",factcheck.afp.com,https://factcheck.afp.com/french-doctor-did-not-urge-africans-avoid-bill-gates-vaccine,"Dr. Raoult did not urge African not to take ""Bill Gates"" vaccine",false
Inhaling hot water steam can kill coronavirus,factly.in,https://factly.in/no-scientific-evidence-to-suggest-that-inhaling-hot-water-steam-can-kill-coronavirus/,FALSE,false
Man in Italy killed self after he lost his family to coronavirus,thequint.com,https://www.thequint.com/news/webqoof/man-killed-self-after-losing-kin-to-covid-19-in-italy-fact-check,False,false
Image of a doctor who died after getting injured during a stone pelting incident that took place when she was testing members of the Muslim community for coronavirus in UP,altnews.in,https://www.altnews.in/images-of-mp-pharmacist-who-died-due-to-brain-hemorrhage-shared-with-false-communal-narrative/,False,false
This video shows a police officer being assaulted in a temple in India while trying to enforce India’s nationwide novel coronavirus lockdown,factcheck.afp.com,https://factcheck.afp.com/video-was-uploaded-indian-wrestling-themed-youtube-channel-june-2019,False,false
Video of dead bodies of COVID-19 infected persons washed ashore as they were thrown in to the seas by some countries,factly.in,https://factly.in/the-video-shows-bodies-of-african-migrants-who-died-in-a-boat-wreck-in-2014-not-of-covid-19/,FALSE,false
Man used injection filled with spit on fruits to spread coronavirus,altnews.in,https://www.altnews.in/communal-attack-in-bawan-shared-with-false-claim-of-muslim-man-injecting-fruits-with-spittle/,False,false
"Says a powder has been developed that, when mixed with water, “is being used in Germany as a mist. Health care workers go through a misting tent going into the hospital and it kills the coronavirus completely dead not only right then, but any time in the next 14 days that the virus touches anything that’s been sprayed, it is killed.”",politifact.com,https://www.politifact.com/factchecks/2020/apr/09/louie-gohmert/no-powder-germany-cant-kill-coronavirus-contact-an/,Pants on Fire,false
Video of a man spitting in the face of another man in the New York subway to spread the Coronavirus,factly.in,https://factly.in/old-video-of-a-man-spitting-on-another-man-in-new-york-subway-is-being-shared-in-the-wake-of-covid-19-outbreak/,FALSE,false
Information from a Philippine hospital shows correlation between COVID-19 and grocery shopping,factcheck.afp.com,https://factcheck.afp.com/philippine-hospital-shot-down-misleading-claims-linking-covid-19-grocery-shopping,Misleading,false
A Facebook post claims the COVID-19 crisis is the latest in a once-every-100-years historical pattern of pandemics.,aap.com.au,https://www.aap.com.au/covid-19-pandemic-not-a-case-of-history-repeating-itself/,False - The implications of the content are factually inaccurate.,false
"Shaukat Khanum hospital in Lahore gets free coronavirus testing kits from Pakistani government, but charges patients instead of doing free tests",factcheck.afp.com,https://factcheck.afp.com/non-profit-hospital-pakistan-refutes-misleading-claim-it-charged-patients-covid-19-tests,Misleading,false
Israel has no deaths from COVID-19; tea made of lemon and bicarbonate can cure coronavirus,vishvasnews.com,https://www.vishvasnews.com/english/health/fact-check-post-claiming-israel-has-no-deaths-from-covid-19-is-false-tea-made-of-lemon-and-bicarbonate-is-no-cure-for-coronavirus/,False,false
This video shows bodies of US COVID-19 victims who committed suicide,factcheck.afp.com,https://factcheck.afp.com/video-first-appeared-2014-reports-about-migrants-who-drowned-libyan-coast,False,false
Ruler of Sharjah bans burial of COVID-19 victim bodies,factcheck.afp.com,https://factcheck.afp.com/sharjah-ruler-sultan-bin-muhammad-al-qasimi-did-not-ban-burial-covid-19-victims-april-2020,False,false
900% Increase in Fact-Checks Around COVID-19 in 3 Months: Study,thequint.com,https://www.thequint.com/news/webqoof/reuters-institute-for-the-study-of-journalism-report-on-covid-19-related-misinformation,False,false
"In the wake of coronavirus outbreak, the Ministry of Tourism has issued an order for the closure of Hotels, Restaurants and Resorts in the country till 15 October 2020",factly.in,https://factly.in/ministry-of-tourism-hasnt-issued-any-order-for-the-closure-of-hotels-restaurants-and-resorts-in-the-country-till-15-october-2020/,FALSE,false
Video of a delivery boy spitting on the slices of bread by opening the packets in the truck and resealing them for sale to spread Coronavirus,factly.in,https://factly.in/old-video-of-a-delivery-boy-taking-bread-from-a-truck-is-being-shared-with-a-false-narrative/,FALSE,false
Video of a Muslim man spitting into the food packages to spread coronavirus,factly.in,https://factly.in/old-video-from-malaysia-is-falsely-shared-as-that-of-a-muslim-man-spitting-in-food-to-spread-coronavirus/,FALSE,false
"A majority of 6,200 doctors said hydroxychloroquine is the most effective coronavirus treatment.",fullfact.org,https://fullfact.org/health/covid-19-hydroxychloroquine-chloroquine-treatment/,"The poll the data comes from is not representative of all doctors. 37%, not a majority, of those involved in Covid-19 treatment worldwide said hydroxychloroquine was among the most effective treatments.",false
Coffins of coronavirus victims in Italy,factcheck.afp.com,https://factcheck.afp.com/photo-has-circulated-reports-about-coffins-earthquake-victims-italy-2009,False,false
Video Shows Kenyan Government deploying Maasai tribe for whipping those violating social distance norms to tackle Coronavirus,boomlive.in,https://www.boomlive.in/fake-news/did-kenya-rope-in-the-maasai-tribe-to-enforce-a-lockdown-a-fact-check-7594,False,false
This photo shows a 13-year-old COVID-19 victim in the UK,factcheck.afp.com,https://factcheck.afp.com/photo-has-circulated-reports-about-irish-teenager-who-died-2017,False,false
"A voice recording on WhatsApp claims there will be 900 deaths a day at the peak of the new coronavirus outbreak, one third will be children with no underlying health conditions, ambulances won’t be sent to people struggling to breathe, and all ice rinks are now being used as mortuaries.",fullfact.org,https://fullfact.org/health/viral-voice-message-ambulance-trust/,"This is incorrect. South East Coast Ambulance Service NHS Foundation Trust, where the person in the recording suggests they work, and Public Health England have confirmed the information is inaccurate.",false
A survey found 11% of workers who report having taken a financial hit from the coronavirus pandemic have been evicted.,fullfact.org,https://fullfact.org/economy/coronavirus-evictions/,"Housing charity Shelter says there has been a spike in evictions, though not nearly as large a spike as this survey found.",false
Video of stampede at a supermarket in US during the coronavirus epidemic,altnews.in,https://www.altnews.in/old-video-of-black-friday-sale-shared-as-us-consumers-violating-social-distancing-to-grab-essentials/,False,false
"“If the White House Gift Shop is going to produce $100 COVID-19 coins, Trump can sure as hell utilize the Defense Production Act to manufacture the gloves, gowns, and masks our medical workers desperately need”",bbc.com,https://www.bbc.com/news/52487960,Misleading - the White House Gift Shop is selling commemorative coins but it's a privately run online store with no direct connection to the White House or the Trump administration.,false
Disaster Management Act prohibits people from posting anything about coronavirus on social media,altnews.in,https://www.altnews.in/disaster-management-act-does-not-prohibit-coronavirus-posts-on-social-media/,False,false
Video of looting during coronavirus lockdown in the UK,factcheck.afp.com,https://factcheck.afp.com/video-shows-riots-london-2011-more-nine-years-covid-19-pandemic,False,false
Hospital lab finds COVID-19 remains on food after 12 hours,factcheck.afp.com,https://factcheck.afp.com/south-african-hospital-group-rejects-claim-lab-found-covid-19-fresh-produce,False,false
"Coronavirus gone in South Korea and under control in Japan, restrictions in Philippines are too relaxed",factcheck.afp.com,https://factcheck.afp.com/misinformation-circulates-online-about-covid-19-cases-and-lockdown-measures-asia,Misleading,false
"""The Kennedy Center launders taxpayer money for the Democrats"" and donated $5 million to the party after getting $25 million in the COVID-19 stimulus package.",factcheck.org,https://www.factcheck.org/2020/04/kennedy-center-didnt-contribute-to-democrats/,False,false
"Poem about self isolation written in 1869, reprinted during Spanish Flu Pandemic, resurfaces during novel Coronavirus pandemic in 2020.",boomlive.in,https://www.boomlive.in/world/coronavirus/1869-poem-reprinted-during-spanish-flu-pandemic-resurfaces-in-2020-7581,False,false
"This 19th century poem about isolation, reprinted during the 1918 Spanish flu, resurfaces during novel coronavirus pandemic in 2020",factcheck.afp.com,https://factcheck.afp.com/poem-was-written-2020-specifically-about-covid-19-pandemic,False,false
UK newspaper says Maulana Saad of Tablighi Jamaat donated Rs 1 crore to PM's relief fund against coronavirus.,indiatoday.in,https://www.indiatoday.in/fact-check/story/fact-check-false-claim-maulana-saad-donating-pm-cares-viral-1664466-2020-04-07,False,false
President Emmerson Mnangagwa has decreed that rentals be suspended due to COVID-19,zimfact.org,https://zimfact.org/no-the-president-hasnt-suspended-rentals-during-lockdown/,False. The statement is fabricated,false
Bill Gates lists lessons from the fight against the novel coronavirus in an open letter,factcheck.afp.com,https://factcheck.afp.com/gates-foundation-urges-netizens-stop-sharing-fake-bill-gates-coronavirus-letter,False,false
Video shows “the Chinese are destroying the 5G poles as they are aware that it is the thing triggering the corona symptoms.”,politifact.com,https://www.politifact.com/factchecks/2020/apr/07/viral-image/no-video-doesnt-show-people-china-destroying-5g-po/,False,false
Coronavirus is a result of 5G,factcheck.afp.com,https://factcheck.afp.com/experts-dismiss-claims-5g-wireless-technology-created-novel-coronavirus,False,false
The novel coronavirus can be spread through fruits and vegetables because it remains viable on them for 12 hours,factcheck.afp.com,https://factcheck.afp.com/hoax-circulates-online-hong-kong-covid-19-was-transmitted-through-fruits-and-vegetables,False,false
Photo of pastor beaten for defying coronavirus restrictions,factcheck.afp.com,https://factcheck.afp.com/afp-photo-shot-2006-during-unrelated-incident,False,false
"Video shows bodies of Coronavirus infected patients lying on the shore, as countries are throwing them in the sea",boomlive.in,https://www.boomlive.in/fake-news/video-of-migrant-shipwreck-off-libyan-coast-revived-with-coronavirus-spin-7585,False,false
This video shows Chinese people destroying 5G towers over coronavirus fears,factuel.afp.com,https://factuel.afp.com/node/8826,False,false
Orangutan washing hands is imitating its zookeepers during the novel Coronavirus pandemic.,boomlive.in,https://www.boomlive.in/world/coronavirus/video-of-orangutan-washing-hands-falsely-linked-to-covid-19-pandemic-7573,False,false
Photo Shows India From Space During Nine Minutes Lights Out To Show Solidarity During The Coronavirus Outbreak,boomlive.in,https://www.boomlive.in/fake-news/false-photo-shows-india-illuminated-during-pm-modis-9-pm-9-minutes-appeal-7562,False,false
People in America looting mall due to fear of coronavirus,altnews.in,https://www.altnews.in/old-video-from-mexico-viral-as-americans-looting-malls-due-to-fear-of-coronavirus/,False,false
Nigerian President Muhammadu Buhari tests positive for coronavirus,factcheck.afp.com,https://factcheck.afp.com/cnn-broadcast-has-been-doctored-nigerian-leader-did-not-test-positive-coronavirus,Misleading,false
Islamic jihadist spitting on a man in order to spread coronavirus,thequint.com,https://www.thequint.com/news/webqoof/video-of-man-spitting-at-subway-rider-falsely-linked-to-covid-19-fact-check,False,false
WHO issued proposal for extending lockdowns to control COVID-19,vishvasnews.com,https://www.vishvasnews.com/english/health/fact-check-who-didnt-issue-proposal-for-extending-lockdowns-to-control-covid-19-fake-post-getting-viral-2/,False,false
"Video shows Italian nationals expressing their gratitude to China for providing aid during the novel coronavirus pandemic, by singing Qinghai-Tibet Plateau in Chinese language.",boomlive.in,https://www.boomlive.in/world/coronavirus/italians-sing-chinese-song-to-thank-china-for-covid-19-aid-not-really-7570,False,false
"Prince Charles's coronavirus was cured with ayurvedic, homeopathic treatment",altnews.in,https://www.altnews.in/prince-charless-coronavirus-wasnt-cured-with-ayurvedic-homeopathic-treatment/,False,false
A Facebook post claims a South Korean drama series predicted the outbreak of COVID-19 in 2018.,aap.com.au,https://www.aap.com.au/south-korean-tv-series-high-on-drama-but-not-foresight-of-covid-19-crisis/,False - The implications of the content are factually inaccurate.,false
Does 5G Tech Spread Coronavirus? Miscreants Set UK Towers on Fire,thequint.com,https://www.thequint.com/news/webqoof/5g-towers-in-uk-set-on-fire-due-to-coronavirus-conspiracy-theories,False,false
Asymptomatic transmission of coronavirus was discovered only recently,factcheck.thedispatch.com,https://factcheck.thedispatch.com/p/was-there-evidence-of-asymptomatic,False,false
"Says fired inspector general Michael Atkinson brought a “terrible, inaccurate whistleblower report” to Congress.",politifact.com,https://www.politifact.com/factchecks/2020/apr/06/donald-trump/firing-inspector-general-donald-trump-falsely-repe/,Pants on Fire,false
"Muslims at a mosque in the town of Beruwala, Sri Lanka reacted violently after authorities told them their gathering was in violation of the novel Coronavirus curfew.",boomlive.in,https://www.boomlive.in/world/coronavirus/false-muslims-ignore-covid-19-curfew-convene-at-mosque-in-sri-lanka-7603,False,false
Man spits in tea bottle and puts it back in supermarket to spread coronavirus,altnews.in,https://www.altnews.in/old-video-of-texas-teen-spitting-in-tea-bottle-falsey-viral-as-spreading-coronavirus-infection/,False,false
"""We’ve tested more than every country combined.”",washingtonpost.com,https://www.washingtonpost.com/politics/2020/04/30/trumps-triumphant-rhetoric-coronavirus-testing/,False,false
The government has banned sharing updates or forwards around the coronavirus,boomlive.in,https://www.boomlive.in/fake-news/disaster-management-act-does-not-restrict-citizen-updates-on-c-7549,False,false
Video of Rahul and Priyanka Gandhi breaking coronavirus lockdown by stepping out,indiatoday.in,https://www.indiatoday.in/fact-check/story/fact-check-rahul-and-priyanka-gandhi-s-old-video-shared-with-coronavirus-twist-1663502-2020-04-05,False,false
These photos show patients outside Italian hospitals during the COVID-19 pandemic,factcheck.afp.com,https://factcheck.afp.com/these-photos-show-aftermath-powerful-earthquake-croatia,False,false
Images of coronavirus vaccine imported by India from USA to kill a section of the population under the garb of medication,altnews.in,https://www.altnews.in/viral-audio-false-conspiracy-theory-about-modi-govt-introducing-vaccine-to-kill-muslims/,False,false
Post shows an image of a boy crying alongside images of his parents in hospital beds who are infected with the novel Coronavirus.,boomlive.in,https://www.boomlive.in/world/coronavirus/false-images-show-boy-crying-parents-infected-with-covid-19-7532,False,false
Video shows people leaving food packets on the road for the poor and needy who cannot earn due to the novel Coronavirus lockdown.,boomlive.in,https://www.boomlive.in/world/coronavirus/no-food-donations-were-not-made-in-turkey-during-covid-19-lockdown-7528,False,false
Video claims Shah Rukh Khan donated 45 crores to Pakistan for combating Coronavirus,boomlive.in,https://www.boomlive.in/fast-check/cropped-fact-check-video-debunking-shah-rukh-khan-donating-to-pakistan-revived-7486,False,false
Zee News publishes story claiming Covid-19 vaccine is out; The vaccine is made by Bharat Biotech; The vaccine name is Corovac,thip.media,https://www.thip.media/health-news-fact-check/coronavirus-vaccine-is-the-zee-news-story-true/2439/,False,false
Video Shows Police Officer Beaten In Temple Because He Was Telling People To Follow The Coronavirus Lockdown Measures,boomlive.in,https://www.boomlive.in/fake-news/webseries-clip-viral-as-cop-beaten-in-temple-for-enforcing-lockdown-7530,False,false
Nigeria is COVID-19 free,factcheck.afp.com,https://factcheck.afp.com/false-claims-nigeria-coronavirus-free-circulate-online,False,false
Singapore has started enforcing spot fines for people who flout certain social distancing regulations during the novel Coronavirus pandemic.,boomlive.in,https://www.boomlive.in/world/coronavirus/no-singapore-is-not-fining-those-flouting-social-distancing-rules-7509,False,false
"This video shows US official announcing the arrest of a Chinese scientist who ""created"" the new coronavirus",factcheck.afp.com,https://factcheck.afp.com/facebook-posts-falsely-claim-us-arrested-chinese-scientist-who-created-coronavirus,False,false
“Joe Exotic tests positive for coronavirus in prison. It’s been confirmed.”,politifact.com,https://www.politifact.com/factchecks/2020/apr/03/blog-posting/it-has-not-been-confirmed-joe-exotic-has-covid-19/,False,false
Thieves are exploiting the coronavirus pandemic by dousing masks in chemicals that render people unconscious and then robbing them.,snopes.com,https://www.snopes.com/fact-check/thieves-masks-hoax/,False,false
"In New York, ""every contaminated corpse"" of those who died from COVID-19 ""belongs to the state"" and will be incinerated without any ""wakes or memorial services to pay your last respects.""",factcheck.org,https://www.factcheck.org/2020/04/misinformation-on-covid-19-death-protocols-in-new-york/,False,false
A Facebook post claims there is a link between New Zealand’s four-week coronavirus lockdown and the installation of 5G towers.,aap.com.au,https://www.aap.com.au/crossed-wires-over-nz-coronavirus-lockdown-and-5g-rollout-link/,False - The claims made in the content are factually inaccurate.,false
"This video shows bodies being removed from a hospital in Iran during the novel coronavirus, COVID-19, pandemic.",factcheck.afp.com,https://factcheck.afp.com/video-has-circulated-reports-about-people-who-died-during-hajj-pilgrim-saudi-arabias-grand-mosque,False,false
"“People on tractors are working, nobody is talking about the virus. There the tractors will cure everybody. The field cures everyone!”",polygraph.info,https://www.polygraph.info/a/30529145.html,False,false
Video bodies being removed from a hospital in Iran during the novel Coronavirus pandemic.,boomlive.in,https://www.boomlive.in/world/coronavirus/false-video-shows-covid-19-victims-bodies-removed-from-iran-hospital-7512,False,false
Video shows Indore Police retaliating for attack on medics who were screening for coronavirus,boomlive.in,https://www.boomlive.in/fake-news/video-from-mumbai-peddled-as-police-retaliation-for-attack-on-indore-medics-7516,False,false
A new vaccine and a new drug have been developed to prevent and treat the novel Coronavirus by scientists in Japan and Phillipines.,boomlive.in,https://www.boomlive.in/world/coronavirus/viral-posts-falsely-claim-coronavirus-vaccine-drugs-developed-in-asia-7518,False,false
"""Everyone in Israel drinks a cup of hot water with lemon and a little baking soda at night, as this is proven to kill"" coronavirus, and has prevented COVID-19 deaths in Israel.",factcheck.org,https://www.factcheck.org/2020/04/lemon-juice-tea-does-not-cure-covid-19-in-israel-or-anywhere-else/,False,false
"Italy arrested a doctor “for intentionally killing over 3,000 coronavirus patients.”",politifact.com,https://www.politifact.com/factchecks/2020/apr/02/blog-posting/no-italy-didnt-arrest-doctor-murdering-thousands-c/,Pants on Fire,false
Men licked plates to spread the novel Coronavirus,thelogicalindian.com,https://thelogicalindian.com/fact-check/muslim-lick-plates-coronavirus-covid-19-pandemic-20429,Misleading,false
Video of Muslims being trained to sneeze purposefully to spread Coronavirus,factly.in,https://factly.in/a-sufi-ritual-video-falsely-shared-as-muslims-being-trained-to-sneeze-to-spread-covid-19/,FALSE,false
“Queen Elizabeth tests positive for COVID-19.”,politifact.com,https://www.politifact.com/factchecks/2020/apr/02/blog-posting/no-reports-queen-elizabeth-tested-positive-covid-1/,False,false
A photo of a group of people holding a banner that bears the Chinese and Malaysian flags shows Chinese doctors arriving in Malaysia to combat the novel Coronavirus.,boomlive.in,https://www.boomlive.in/world/coronavirus/no-china-did-not-send-doctors-to-malaysia-to-combat-covid-19-7476,Misleading,false
"Financier George Soros owns the lab in Wuhan, China, where the COVID-19 coronavirus disease was ""developed.""",snopes.com,https://www.snopes.com/fact-check/soros-wuhan-lab/,False,false
This is genuine COVID-19 prevention advice,factcheck.afp.com,https://factcheck.afp.com/health-authorities-warn-false-covid-19-prevention-tips-online,False,false
Coronavirus lockdown in India extended till 4 May,thequint.com,https://www.thequint.com/news/webqoof/no-announcement-on-lockdown-extension-yet-fake-bulletin-goes-viral-fact-check,False,false
Nizamuddin markaz attendee spitting at cop to spread coronavirus infection,altnews.in,https://www.altnews.in/coronavirus-video-of-an-undertrial-in-mumbai-falsely-viral-as-nizamuddin-markaz-attendee-spitting-at-cop/,False,false
"A video shows overcrowding in St Mary’s Hospital, London and Covid-19 patients lying on the floor in corridors.",fullfact.org,https://fullfact.org/online/video-supposedly-showing-covid-19-patients-st-marys-hospital-london-was-actually-filmed-madrid/,"Incorrect, the clip is actually two videos filmed in hospitals in Madrid in mid-March.",false
Disaster management act will be implemented from midnight and nobody other than government department will be allowed to post any update about coronavirus pandemic,thequint.com,https://www.thequint.com/news/webqoof/fake-message-on-disaster-management-act-says-posting-on-covid-19-illegal-fact-check,False,false
