Claim Text,Source of Verification,url,Given Label,Filtered Label
“Shands Hospital of Gainesville Florida has confirmed its first case of coronavirus.”,politifact.com,https://www.politifact.com/factchecks/2020/mar/03/viral-image/shands-hospital-gainesville-florida-hasnt-confirme/,False,false
Four COVID-19 patients hospitalized in Negombo,factcheck.afp.com,https://factcheck.afp.com/sri-lankan-authorities-say-only-two-suspected-coronavirus-patients-were-hospitalised-and-both-later,Misleading,false
"""We do have 19 out of our 50 states, to be reminded, that had early cases but have persistently low level of cases and, at this point, have less than 200 cases. So that’s almost 40% of the country with extraordinarily low numbers.""",factcheck.org,https://www.factcheck.org/2020/03/birx-spins-extraordinarily-low-numbers-of-coronavirus-cases/,Misleading,false
Says the Vatican confirmed that Pope Francis and two aides tested positive for coronavirus.,politifact.com,https://www.politifact.com/factchecks/2020/mar/02/youtube-videos/false-video-says-pope-francis-has-coronavirus/,Pants on Fire,false
A Facebook post claims The Eyes of Darkness by Dean Koontz predicted the coronavirus outbreak.,aap.com.au,https://www.aap.com.au/a-novel-published-in-1981-did-not-predict-the-2019-coronavirus/,False – The primary claims of the content are factually inaccurate.,false
Alcohol kills coronavirus,vishvasnews.com,https://www.vishvasnews.com/english/health/fact-check-post-claiming-alcohol-kills-coronavirus-is-fake/,False,false
"Russian Ministry of Health confirmed in a document that the novel coronavirus, COVID-19, is man-made.",boomlive.in,https://www.boomlive.in/world/false-russias-ministry-of-health-states-that-coronavirus-is-manmade-7093,False,false
CLAIM: A traveler from the Chinese province most hit by the coronavirus was allowed into Zimbabwe,zimfact.org,https://zimfact.org/fact-check-hunan-hubei-or-wuhan-no-zimbabwe-did-not-receive-traveler-from-worst-hit-chinese-province/,"False. A traveller arrived from Hunan province, and not Wuhan, the epicentre of the coronavirus outbreak.",false
"”America has been vaccinating cattle for coronavirus for years, yet the news tells you it’s new and gunna kill you all so go buy mask.”",politifact.com,https://www.politifact.com/factchecks/2020/mar/02/facebook-posts/bovine-coronavirus-vaccine-wont-help-humans/,False,false
Man critical with novel coronavirus in Barhalganj,vishvasnews.com,https://www.vishvasnews.com/english/health/fact-check-post-claiming-man-critical-with-novel-coronavirus-in-barhalganj-is-fake-till-date-no-positive-case-reported-in-gorakhpur/,False,false
Russia confirms the novel coronavirus is man-made,factcheck.afp.com,https://factcheck.afp.com/russias-ministry-health-refutes-misleading-online-claim-it-stated-covid-19-man-made,Misleading,false
The photo shows man hospitalised after eating bat during novel coronavirus outbreak,factcheck.afp.com,https://factcheck.afp.com/photo-has-circulated-online-fundraising-page-man-lung-condition-unrelated-novel-coronavirus,Misleading,false
These masks protect against the novel coronavirus,factcheck.afp.com,https://factcheck.afp.com/coronavirus-protection-masks-hawked-misleading-video-ad-facebook,Misleading,false
A runny nose and sputum secretion are not symptoms of novel Coronavirus.,boomlive.in,https://www.boomlive.in/health/viral-posts-falsely-claim-runny-nose-is-not-a-coronavirus-symptom-7085,False,false
"""The United States has done far more 'testing' than any other nation, by far!""",bbc.co.uk,https://www.bbc.co.uk/news/world-us-canada-51818627,This requires context. The US has carried out the most tests in total by March 25 but not if you look at the number per capita by that date,false
Coughing sputum and runny nose not symptoms of novel coronavirus,factcheck.afp.com,https://factcheck.afp.com/international-health-advisories-contradict-false-claim-runny-nose-not-coronavirus-symptom,False,false
French parade pays tribute to China's efforts against the novel coronavirus,factcheck.afp.com,https://factcheck.afp.com/video-shows-parade-italy-during-annual-art-carnival,False,false
“Florida hospital reports a coronavirus ‘infestation’ with multiple confirmed patients.”,politifact.com,https://www.politifact.com/factchecks/2020/mar/02/yourcontent/false-news-site-publishes-unproven-story-about-flo/,False,false
Claim that a cure for the novel coronavirus (COVID-19) has been found.,guardian.ng,https://guardian.ng/news/fact-check-is-there-a-cure-for-coronavirus-yet/,The claim is false,false
Video shows 20 million Chinese people converting to Islam because the novel coronavirus epidemic does not affect Muslims.,boomlive.in,https://www.boomlive.in/world/video-from-saudi-arabia-shared-as-chinese-people-converting-to-islam-7072,False,false
Says the coronavirus can be slowed or stopped with the “immediate widespread use of high doses of vitamin C.”,politifact.com,https://www.politifact.com/factchecks/2020/feb/29/facebook-posts/no-vitamin-c-cannot-slow-or-stop-spread-coronaviru/,False,false
Cambodian Prime Minister Hun Sen hospitalised after contracting Coronavirus.,boomlive.in,https://www.boomlive.in/world/false-cambodian-pm-hospitalised-after-contracting-coronavirus-7051,False,false
SWAT teams take down coronavirus suspects on China highway,altnews.in,https://www.altnews.in/mock-drill-video-of-chinese-swat-team-tackling-coronavirus-victim-viral-as-real/,False,false
Coronavirus patients in China are being caught by officials on a highway,factly.in,https://factly.in/the-people-caught-by-china-swat-team-in-this-video-dont-have-coronavirus-its-a-mock-drill-video/,FALSE,false
"A photo showing snow art voicing support for China was spotted in Wuhan, the epicentre of the novel coronavirus epidemic.",boomlive.in,https://www.boomlive.in/world/was-snow-art-in-support-of-china-spotted-in-wuhan-7058,False,false
The NHS has warned people should not shake hands to prevent the spread of the Wuhan coronavirus,fullfact.org,https://fullfact.org/health/nhs-hasnt-advised-people-stop-shaking-hands-avoid-wuhan-coronavirus/,"This is incorrect. Although some doctors have suggested this may be a good idea, no advice around shaking hands has been issued by the government",false
"Says the coronavirus ""is a flu. This is like a flu.""",politifact.com,https://www.politifact.com/article/2020/feb/28/fact-checking-president-donald-trump-coronavirus/,Not the same virus,false
"“With Ebola, we were talking about it before, you disintegrated. If you got Ebola, that was it. [Coronavirus] is like a flu, and this is a much different situation than Ebola.”",washingtonpost.com,https://www.washingtonpost.com/politics/2020/02/28/fact-checking-president-trumps-coronavirus-news-conference/,False,false
Hun Sen diagnosed with novel coronavirus,factcheck.afp.com,https://factcheck.afp.com/2017-photo-cambodias-prime-minister-after-he-was-hospitalised-unrelated-health-condition,False,false
Shoppers in China force way into supermarket amid novel coronavirus epidemic,factcheck.afp.com,https://factcheck.afp.com/video-has-circulated-media-reports-least-october-2019-months-novel-coronavirus-outbreak,Misleading,false
Says the CDC recommends men shave their beards to protect against coronavirus.,politifact.com,https://www.politifact.com/factchecks/2020/feb/27/facebook-posts/no-cdc-isnt-recommending-men-shave-their-beard-pro/,False,false
Vitamin D prevents coronavirus,factcheck.afp.com,https://factcheck.afp.com/health-experts-say-there-no-evidence-vitamin-d-effective-preventing-novel-coronavirus-infection,Misleading,false
"“The coronavirus is the common cold, folks.”",politifact.com,https://www.politifact.com/factchecks/2020/feb/27/rush-limbaugh/fact-checking-rush-limbaughs-misleading-claim-new-/,False,false
"Image shows mass burial ground for tens of thousands of Coronavirus victims, since cremation furnace running 24 hours a day cannot meet demand due to the large number of bodies.",boomlive.in,https://www.boomlive.in/world/contagion-film-scene-shared-as-mass-burial-of-coronavirus-victims-7032,False,false
CLAIM: The video shows people who are sick because of the coronavirus.,teyit.org,https://teyit.org/en/does-the-video-show-people-with-the-coronavirus/,FALSE,false
“It (coronavirus) is like a strong flu.”,polygraph.info,https://www.polygraph.info/a/coronavirus-vs-flu-fact-check/30458388.html,Misleading,false
China-made Holi festival decorations infected with novel coronavirus,factcheck.afp.com,https://factcheck.afp.com/experts-india-refute-misleading-claim-china-made-holi-festival-goods-are-infected-coronavirus,False,false
"High levels of sulfur dioxide in Wuhan “may be a sign of mass cremations of victims of the coronavirus.""",politifact.com,https://www.politifact.com/factchecks/2020/feb/26/facebook-posts/china-air-quality-projections-used-promote-coronav/,Pants on Fire,false
The 2008 book “End of Days” predicted the current coronavirus outbreak.,politifact.com,https://www.politifact.com/factchecks/2020/feb/26/viral-image/book-end-days-described-illness-2020-not-wuhan-400/,False,false
This photo shows a mass burial ground for tens of thousands of virus victims amid the novel coronavirus outbreak,factcheck.afp.com,https://factcheck.afp.com/image-shows-scene-trailer-2011-disaster-movie-contagion,False,false
20 million Chinese converted to Islam after it’s proven that the coronavirus doesn’t affect Muslims.,politifact.com,https://www.politifact.com/factchecks/2020/feb/25/viral-image/no-millions-chinese-didnt-convert-islam-seeking-co/,Pants on Fire,false
Chinese SWAT Team Takes Down A Coronavirus Suspect,boomlive.in,https://www.boomlive.in/fake-news/coronavirus-mock-drill-by-chinese-police-viral-as-real-6997,False,false
Video shows shoppers scrambling to enter a supermarket in China after the novel coronavirus outbreak in the Chinese city of Wuhan.,boomlive.in,https://www.boomlive.in/world/old-video-shared-as-chaos-in-chinese-supermarkets-due-to-coronavirus-6999,False,false
Top Chinese scientist visited Wuhan doctor before he died of coronavirus,factcheck.afp.com,https://factcheck.afp.com/video-shows-chinese-medical-scientist-zhong-nanshan-visiting-hospital-2016,False,false
"The World Health Organization test for the new coronavirus ""was a bad test.""",factcheck.org,https://www.factcheck.org/2020/03/biden-trump-wrong-about-who-coronavirus-tests/,False,false
The World Health Organization “offered the [coronavirus] testing kits that they have available” but “we refused them.”,factcheck.org,https://www.factcheck.org/2020/03/biden-trump-wrong-about-who-coronavirus-tests/,False,false
Satellite images showing high levels of sulphur dioxide above China are possible evidence of mass cremations of people who have died from coronavirus,altnews.in,https://www.altnews.in/coronavirus-image-showing-sulphur-dioxide-forecasts-falsely-linked-with-mass-cremation-in-wuhan/,False,false
US patent 10130701 is for coronavirus.,fullfact.org,https://fullfact.org/health/us-patents-on-viruses/,"This number is not a patent for the new Wuhan virus, Covid-19. It’s a patent for a weakened version of a virus in the same family as Covid-19, a family which includes the common cold and SARS.",false
Man in Uttar Pradesh contracted an acute case of Coronavirus after consuming chicken and is admitted in a local hospital.,boomlive.in,https://www.boomlive.in/health/viral-post-falsely-claims-uttar-pradesh-man-critical-with-coronavirus-6985,False,false
Elderly Chinese couple hold hands in hospital after they were infected with coronavirus,factcheck.afp.com,https://factcheck.afp.com/these-images-have-previously-circulated-reports-about-elderly-chinese-couple-who-had-unrelated,Misleading,false
Map tracing movements of Wuhan residents forecasts spread of Coronavirus.,boomlive.in,https://www.boomlive.in/world/map-of-global-flight-paths-falsely-reported-as-spread-of-coronavirus-6975,False,false
Confirmed case of novel coronavirus in Uttar Pradesh town of Barhalganj,factcheck.afp.com,https://factcheck.afp.com/indian-health-authority-refutes-hoax-report-coronavirus-case-uttar-pradesh-district,False,false
Australian couple quarantined due to Coronavirus on cruise ship had wine delivered by a drone.,boomlive.in,https://www.boomlive.in/world/did-a-quarantined-australian-couple-have-wine-delivered-by-a-drone-6974,False,false
Video of China disinfecting streets for Coronavirus causes a rainbow.,boomlive.in,https://www.boomlive.in/world/did-a-street-disinfection-for-coronavirus-in-china-cause-a-rainbow-6967,False,false
Chinese rush to Vietnam after coronavirus outbreak,factcheck.afp.com,https://factcheck.afp.com/video-circulated-online-weeks-novel-coronavirus-was-first-reported,False,false
China blocking roads to contain coronavirus,thequint.com,https://www.thequint.com/news/webqoof/china-blocking-roads-to-contain-coronavirus-fake-news-fact-check,False,false
"Chloroquine has cured 12,552 coronavirus patients in China",factcheck.afp.com,https://factcheck.afp.com/anti-malaria-drug-has-proven-effective-treating-coronavirus-has-not-cured-12552-patients,Misleading,false
Social media posts imply that Harvard professor Charles Lieber was arrested in connection with the new coronavirus.,factcheck.org,https://www.factcheck.org/2020/02/no-link-between-harvard-scientist-charles-lieber-and-coronavirus/,False,false
"Several crows fly into Wuhan city, China following the rise in infected and death tolls caused by the novel Coronavirus outbreak.",boomlive.in,https://www.boomlive.in/world/did-several-crows-fly-to-wuhan-after-the-coronavirus-outbreak-6932,Misleading,false
"Australia sent a flight with medical aid in wake of Coronavirus outbreak to Guangzhou, China.",boomlive.in,https://www.boomlive.in/world/no-australia-did-not-fly-medical-aid-for-coronavirus-to-china-6948,Misleading,false
Non-Muslims offer Friday prayers in wake of Coronavirus outbreak in China.,boomlive.in,https://www.boomlive.in/world/were-chinese-non-muslims-offering-friday-prayers-to-prevent-coronavirus-6931,False,false
Corpses of coronavirus patients in Wuhan dumped on roadside,thequint.com,https://www.thequint.com/news/webqoof/corpses-of-wuhan-coronavirus-patients-dumped-on-roads-fake-news-fact-check,False,false
Watch: How to Protect Yourself From Coronavirus,fit.thequint.com,https://fit.thequint.com/health-news/coronavirus-myths-debunked-world-health-organisation,False,false
"Video shows dead bodies left on the streets of Wuhan, China after the Coronavirus outbreak.",boomlive.in,https://www.boomlive.in/world/were-dead-bodies-left-on-wuhan-streets-after-the-coronavirus-outbreak-7057,False,false
Coronavirus infected patient in Purnia denied treatment,vishvasnews.com,https://www.vishvasnews.com/english/health/fact-check-no-confirmed-case-of-coronavirus-reported-in-purnia-so-far-fake-post-getting-viral/,False,false
This video shows bodies on a Wuhan street during the new coronavirus epidemic,factcheck.afp.com,https://factcheck.afp.com/video-shows-people-sleeping-rough-chinese-city-shenzhen,False,false
There's a map that shows all the countries in the world which will be effected by coronavirus,bbc.co.uk,https://www.bbc.co.uk/news/world-51504512,"Misleading - this is an old map showing air travel routes, not the reach of coronavirus",false
Pakistan issues alert after novel coronavirus signs appear in chickens,factcheck.afp.com,https://factcheck.afp.com/pakistans-ministry-health-refutes-claim-novel-coronavirus-was-found-chickens,False,false
Novel coronavirus exposure at a doctor’s office in this Australian town,factcheck.afp.com,https://factcheck.afp.com/australian-officials-dismiss-hoax-report-coronavirus-exposure-doctors-surgery-new-south-wales-town,MISLEADING,false
Cannabis boosts immunity against coronavirus,factcheck.afp.com,https://factcheck.afp.com/sri-lankan-health-experts-stress-there-no-evidence-cannabis-boosts-immunity-against-novel,Misleading,false
"Israel sends novel coronavirus vaccine to Wuhan, China",factcheck.afp.com,https://factcheck.afp.com/world-health-organization-has-said-there-not-yet-vaccine-novel-coronavirus,False,false
Boiled ginger can help cure coronavirus,boomlive.in,https://www.boomlive.in/world/can-coronavirus-be-cured-by-drinking-boiled-ginger-6925,Misleading,false
Coronavirus cases and deaths recorded in Nigeria,factcheck.afp.com,https://factcheck.afp.com/there-are-no-known-deaths-or-confirmed-cases-novel-coronavirus-nigeria-february-18-2020,False,false
Chinese man escapes novel coronavirus quarantine in the Philippines,factcheck.afp.com,https://factcheck.afp.com/philippine-bureau-immigration-says-it-did-not-issue-coronavirus-escapee-warning,False,false
cocaine kills coronavirus,vishvasnews.com,https://www.vishvasnews.com/english/health/fact-check-post-claiming-cocaine-kills-coronavirus-is-fake/,False,false
Chinese converting to Islam to prevent coronavirus,thequint.com,https://www.thequint.com/news/webqoof/fake-news-chinese-converting-to-islam-to-prevent-coronavirus-fact-check,False,false
Car slams through Wuhan coronavirus roadblock,factcheck.afp.com,https://factcheck.afp.com/staged-car-crash-was-filmed-2018-movie-chinas-heilongjiang-province,False,false
A Sudanese minister wore a mask to protect himself from the novel coronavirus during a meeting with a Chinese diplomat,factcheck.afp.com,https://factcheck.afp.com/sudanese-minister-did-not-wear-mask-meet-chinese-diplomat,False,false
"On disbanding the White House's pandemic team: ""I didn’t do it. We have a group of people I could ask — perhaps my administration — but I could perhaps ask Tony about that because I don’t know anything about it.""",nytimes.com,https://www.nytimes.com/2020/03/13/us/politics/fact-check-trump-coronavirus.html,This is misleading.,false
"""Europe was just designated as the hot spot right now and we closed that border a while ago.""",nytimes.com,https://www.nytimes.com/2020/03/13/us/politics/fact-check-trump-coronavirus.html,This is misleading.,false
"""If you go back to the swine flu, it was nothing like this. They didn’t do testing like this.""",nytimes.com,https://www.nytimes.com/2020/03/13/us/politics/fact-check-trump-coronavirus.html,False.,false
"Coronavirus issues were because ""we were given rules, regulations, and specifications from a different time.""",nytimes.com,https://www.nytimes.com/2020/03/13/us/politics/fact-check-trump-coronavirus.html,False,false
Coronavirus: How Tech Companies Are Dealing With Fake News & Lies,thequint.com,https://www.thequint.com/news/webqoof/coronavirus-how-tech-companies-are-dealing-with-fake-news-and-lies,False,false
"Map predicting global spread of novel coronavirus, based on movements of residents from Wuhan, China",factcheck.afp.com,https://factcheck.afp.com/map-shows-flight-paths-worldwide-it-does-not-show-movement-wuhan-residents,MISLEADING,false
Scientists believe that coronavirus may have come from bats in a Chinese research facility.,fullfact.org,https://fullfact.org/health/coronavirus-government-laboratory/,"Two Chinese scientists have published an article suggesting that the 2019 coronavirus outbreak could have originated from bats in a laboratory in Wuhan. However, apart from maps showing the proximity of laboratories, they offer no evidence to prove this.",false
Australian couple quarantined on cruise due to novel coronavirus gets wine delivered by drone,factcheck.afp.com,https://factcheck.afp.com/australian-couple-quarantined-onboard-diamond-princess-cruise-reveal-wine-drone-delivery-story-was,False,false
coronavirus cure,factcheck.afp.com,https://factcheck.afp.com/thai-doctors-say-their-treatment-helped-coronavirus-patient-recover-it-was-not-cure,Misleading,false
"""To keep new cases from entering our shores, we will be suspending all travel from Europe to the United States for the next 30 days.""",factcheck.org,https://www.factcheck.org/2020/03/factchecking-trumps-coronavirus-address/,False. Not All Travel.,false
A novel coronavirus patient has been identified in eastern Indian state of Bihar's Purnea district..,factcheck.afp.com,https://factcheck.afp.com/indian-health-authorities-dismiss-hoax-report-novel-coronavirus-case-east-indian-state,False,false
A message that has gone viral on social media claims that Zimbabwe now has 118 confirmed coronavirus cases.,zimfact.org,https://zimfact.org/fact-check-coronavirus-in-zimbabwe-no-viral-social-media-message-is-false/#no-cases-of-coronavirus-have-yet-been-detected-in-zimbabwe,The social media claim is false. No cases of coronavirus have yet been detected in Zimbabwe.,false
Two passengers landing at Kolkata airport test positive for coronavirus,thequint.com,https://www.thequint.com/news/webqoof/two-cases-of-coronavirus-confirmed-in-kolkata-news-fact-check,False,false
Video of Police killing COVID-19 affected people in China.,factly.in,https://factly.in/three-unrelated-clips-joined-to-falsely-claim-that-police-are-killing-covid-19-affected-people-in-china/,FALSE,false
Chicken infected from coronavirus found in Bangalore,vishvasnews.com,https://www.vishvasnews.com/english/health/fact-check-post-claiming-chicken-infected-from-coronavirus-found-in-bangalore-is-fake/,False,false
"Video of 25,000 coronavirus patients killed in China",altnews.in,https://www.altnews.in/chinese-police-shooting-down-coronavirus-patients-manufactured-clip-viral/,False,false
WebQoof Recap: From Empty Shaheen Bagh to Weed Curing Coronavirus,thequint.com,https://www.thequint.com/news/webqoof/weekly-round-up-fact-check-stories,False,false
China has killed over 25000 coronavirus infected patients,thequint.com,https://www.thequint.com/news/webqoof/is-china-killing-coronavirus-patients-no-videos-are-unrelated-fact-check,False,false
Chinese police shooting Coronavirus patients in Wuhan,boomlive.in,https://www.boomlive.in/fake-news/video-shows-chinese-policemen-killing-coronavirus-patients-factcheck-6885,False,false
Weed kills coronavirus,vishvasnews.com,https://www.vishvasnews.com/english/health/fact-check-post-claiming-weed-kills-coronavirus-is-fake/,False,false
"Crows flock to Wuhan, China, after coronavirus outbreak",factcheck.afp.com,https://factcheck.afp.com/video-shows-crows-chinese-city-xining-1000-miles-wuhan,Misleading,false
Wuhan flat fire breaks out after residents use disinfectant against novel coronavirus,factcheck.afp.com,https://factcheck.afp.com/wuhan-fire-officials-say-video-shows-apartment-fire-sparked-discarded-cigarette,Misleading,false
China created the novel coronavirus in a lab near Wuhan.,fit.thequint.com,https://fit.thequint.com/fit-webqoof/fit-webqoof-did-china-create-the-wuhan-coronavirus-in-its-lab-fact-check,False,false
Satellite images showing high levels of sulphur dioxide above China are possible evidence of mass cremations of people who have died from coronavirus.,fullfact.org,https://fullfact.org/health/satellites-wuhan-sulphur-dioxide-coronavirus/,"False. The maps are not satellite images, and do not show actual levels of sulphur dioxide. They are simply forecasts based on historical data and weather patterns.",false
"“The coronavirus pandemic can be dramatically slowed, or stopped completely, with the immediate widespread use of high doses of vitamin C.”",factcheck.org,https://www.factcheck.org/2020/02/fake-coronavirus-cures-part-3-vitamin-c-isnt-a-shield/,False,false
COVID-19 stands for “China Outbreak Virus in December 19”,factcheck.afp.com,https://factcheck.afp.com/world-health-organization-says-covid-19-means-coronavirus-disease-2019-not-china-outbreak-virus,False,false
China seeks court's approval to kill 20000 coronavirus patients,vishvasnews.com,https://www.vishvasnews.com/english/health/fact-check-post-claiming-china-seeks-courts-approval-to-kill-20000-coronavirus-patients-is-fake/,False,false
People of Wuhan City are screaming for help amid Coronavirus lockdown,thequint.com,https://www.thequint.com/news/webqoof/coronavirus-wuhan-not-shouting-for-help-but-motivating-each-other-video-fact-check,False,false
The United States Postal Service (USPS) will stop accepting items destined to China and Hong Kong amid the new coronavirus outbreak,factcheck.afp.com,https://factcheck.afp.com/novel-coronavirus-misinformation-circulates-online-about-us-postal-service-operations-mail-bound,Misleading,false
Philippines issues quarantine order for visitors from 23 countries over novel coronavirus,factcheck.afp.com,https://factcheck.afp.com/philippine-authorities-did-not-issue-warning-after-novel-coronavirus-outbreak,False,false
Says the coronavirus is “a MILITARY BIO-WEAPON Developed by China's Army.”,politifact.com,https://www.politifact.com/factchecks/2020/feb/11/hal-turner-radio-show/far-right-radio-host-hal-turner-promotes-unproven-/,False,false
"Says the 2019 coronavirus ""causes sudden death syndrome.""",politifact.com,https://www.politifact.com/factchecks/2020/feb/11/facebook-posts/no-evidence-coronavirus-causes-sudden-death-syndro/,False,false
"""MMS (chlorine dioxide), can be very effective in both preventing and eradicating the coronavirus.""",factcheck.org,https://www.factcheck.org/2020/02/fake-coronavirus-cures-part-1-mms-is-industrial-bleach/,False,false
"Bat that was responsible for Coronavirus's origination in Wuhan, China",altnews.in,https://www.altnews.in/a-video-from-florida-is-shared-as-china-where-birds-effected-by-coronavirus/,False,false
A fire broke out in Wuhan after people disinfected their home with alcholol amid coronavirus scare,factcheck.afp.com,https://factcheck.afp.com/video-shows-fire-residential-building-chongqing-different-chinese-city,False,false
Coronavirus found in chicken in Bangalore,boomlive.in,https://www.boomlive.in/fake-news/false-chicken-infected-with-coronavirus-in-bangalore-6850,False,false
