Tweet id,Tweet text,True/False?
1290655189561740000,IMPORTANT: The mask wearing suggestions probably came from the same medical establishment that vaccines came from. Now people have Corona virus. That was bad; Now they want another vaccine. Be smart,0
1290636722661780000,How much more patient do I have to be? You guys literally have my product for a much longer time than I had it with me. I think corona vaccine will come much earlier than your product. I had it with boat now. Was also looking to get some good speaker but will go for another brand,1
1290674932318440000,"He would say: “But we’re doing more testing”. Ok, we’ll go with that...so let’s use Covid-19 deaths as a metric . Are we still winning? ",0
1290676545925800000,"So for schools, a day no child (symptomatic or asymptomatic) doesn’t have covid is a good day, but every day there is any child with covid, the risk of catching it grows Steadily. With the right mindset, that is of course obvious. But it’s amazing how we confuse ourselves.",0
1290674962617870000,"Survivors of Covid-19 show increased rate of psychiatric disorders including insomnia, study finds | Medical research | The Guardian ",0
1290657646421450000,Let's move on to testing. @Daanibhai suggests testing data cant be taken seriously because the only ppl opting for tests are: - middle &amp; upper class - those with own transport He says empty corona wards are not a positive indicator because: poor people avoid hospitals &amp; women-,1
1290674500548400000,"Challenging times may require an extra pair of #informationsecurity hands. We can help. A little or a lot. Available virtually or onsite with COVID-19 restrictions strictly observed. Access to our consultants when you need it, pay only for what you use. https://www.advent-im.co.uk/consultancy/cyber-security/mysecuritymanager/",0
1290636664495310000,"@realDonaldTrump For a supposed genuis, you're not very smart. You keep touting a drug that can kill people. If I got Corona, I cant take that medication, hydroxychloroquine, why, I have only 1 kidney, and its at a limited state. Hydroxy would kill that organ.",1
1290675969129400000,"(1) I'm not asserting that the federal gov't could usefully do more to address COVID-19 as a public health threat (incidentally, it meets the CDC's epidemic guidelines only because of the arbitrary and callous edicts of blue-state governors forcing nursing homes to incubate it).",0
1290677100307860000,"you might want to stop relying on that miracle drug. for over a month its been known this doesn't help covid patients, all this has done is taken this medication away from people with lupus, malaria and rheumatoid arthritis who actually need it. stop being selfish. ",1
1290674019524430000,"“Racism essentially sets up whether you’re able to have a life in which you can protect yourself from risk for any disease, including COVID, or whether you are forced into exposing yourself to risk,” @globeandmail https://www.theglobeandmail.com/canada/article-torontos-marginalized-communities-disproportionately-affected-by/ #covid19 #cdnpoli #endracism #Toronto",1
1290675274124860000,I’m so furious about it. And it’s a reason not to search for a cause or a cure - the whole ‘you’ll be pain-free if you just think you’re pain free’ And - one of my long term effects from COVID is sometimes severe muscle pain. That’s something they’re going to have deal with,0
1290677371100490000,"Researchers recommend pregnant women take choline, a B vitamin nutrient critical to fetal brain development, finding it may mitigate negative impacts of viral respiratory infections, including COVID-19, on fetal brain development &amp; future mental health. ",0
1290640288357250000,There hasn’t been a vaccine for any previous other corona viruses. Don’t expect this to be any different. Politics has got people not listening to doctors when pediatricians overwhelming say it is safe to send kids to school.,0
1290676542947970000,How are such wide ranging opinions going to fit in a box? Will all teachers want Covid vaccines? Will it be mandatory to teach to have one? Will children be expected to have them to enter a classroom. What if parents reject. Will children be denied an education?,0
1290676762901240000,"What KTR did today is went to genome valley ,held press conference with Bharat biotech md, Bilogical E MD about possible timeline of vaccine, which they already been saying from past weeks .. While trs govt, covid 19 management is a disaster. KTR PR stunts has been success",1
1290642411375530000,Cultural diversity has never been more important than in the current Corona-situation we are living in. What shapes policies and measures in different nations is often a result of cultural biases. Learn more about our intercultural know-how: http://ow.ly/6UE130k2g61 #growculture,1
1290675190611940000,"Isn’t there a virus test that requires just 30 minutes, time to immediately track all the contacts of the POSITIVE patient, to quarantine and isolate POSITIVES, to monitor and treat POSITIVES, and to stop POSITIVE covid virus tests infecting our communities? Find the POSITIVES!! ",1
1290636380310250000,CBOs are made up of community representatives and one of their aims is to ensure that decision makers take notice of community concerns. CBO role on combatting covid-19 may include: Raise community awareness and promote community action on corona virus issues &amp; livlihood optins https://twitter.com/MubarakEkute/status/1290635766679449600,1
1290675620905720000,Australian COVID-19 vaccine candidate shows positive results in phase one human trials http://www.abc.net.au/news/2020-08-01/sa-potential-coronavirus-vaccine-passes-first-phase/12514988,1
1290668984618990000,"Maybe it's because you suggested medically unsound treatment for covid. Oh I know, we will all trust you if you inject bleach and disinfectants to prevent Corona. Be a leader by example sir, the leader we need.",0
1290676367294590000,Small businesses in Birmingham can apply now for their share of a £5 million grant fund set up to help them recover from the impact of the Covid-19 pandemic https://www.greaterbirminghamchambers.com/latest-news/news/2020/8/3/5m-birmingham-sme-grants-scheme-opens-today/? #beyourownboss #startupbusiness #startsups #entrepreneurs #intellectualproperty #IPrights,1
1290652027983460000,Catch a cold- just like they do every year. My point is why are parents being crucified for sending their kids back to school? These “teachers” can’t blame corona virus on these kids especially when they’ve already been out exposed to it doing other things. ,0
1290646642404850000,"Patients with the #coronavirus in #Georgia are exhibiting less serious symptoms and manifestations of the disease than in March and April, and that the number of severe cases has decreased #COVID19 #Covid_19 #Covid #Corona #StopCoV #Southcaucasus",0
1290675426138950000,"COVID-19 has created a real-life case study of CECL’s procyclicality &amp; has shown it wreaks havoc in a downturn. This harmful accounting standard is bad for institutions, investors, &amp; everyday Americans. It’s time we eliminate #CECL once and for all.",0
1290675249218890000,"The hidden tax implications of COVID-19 surcharges: In today’s COVID-19 world where nothing seems normal, and “new normals” are popping up in every business operation, service businesses are trying to make up for… http://dlvr.it/Rczp4X ^ @AccountingToday #Tax #Accounting #CPA",0
1290675733132700000,"Yeah, but you didn’t say “if we didn’t have nursing homes,” you said “if dem governors didn’t shove covid cases into nursing homes.” They lead to many deaths because they’re made up of at-risk people. The VAST majority of homes didn’t have positive cases quarantined inside them.",0
1290674595469620000,#ISRO is going into hibernation due to COVID-19 situation. All major launch missions have suffered substantial delays. Contract engineers and technicians at #SDSC_SHAR are being laid off. Still Work on #SSLV is going on with reduced manpower. https://www.newindianexpress.com/states/andhra-pradesh/2020/aug/04/with-covid-19-leaving-space-projects-in-hibernation-isros-contract-firms-resort-to-lay-offs-2179028.amp?__twitter_impression=true,1
1290673833368850000,"Schools and daycares were full of different sicknesses before covid and literally no steps were taken to improve that. I worked in a daycare that had 10 outbreaks of different viruses in one winter season, with all staff and kids receiving mandatory vaccines.",1
1290677245711980000,"The Transitional Support Fund will help childcare providers in the private, voluntary and not-for-profit sectors, including out-of-school care providers, meet the extra costs incurred to comply with public health guidance in response to COVID-19. /2",0
1290676633960090000,Be part of the team that directs the response to the COVID-19 Pandemic to ensure civil society organizations get the support they need to continue their work towards building more resilient societies. http://shorturl.at/nruF3. For more opportunities https://tapnetwork2030.org/membershipportal/,0
1290676375733430000,“We’ve counted deaths that were not COVID deaths!” This is so evil and deliberately going off technicalities here. It’s also not true. The nicest interpretation here is that they mean ppl who had existing complications which endangered them more towards COVID effects.,0
1290676408121950000,"#ActOnSahel #ActOnClimate “It’s eerily similar to Covid – vulnerable people are those who have pre-existing or underlying conditions. If you have a heart problem and are hammered for days by the heat, you are going to be pushed towards collapse.” ",0
1290673841413540000,"Well, one of two likely things are true, (1) the population is not accurately testing or reporting on COVID, or (2) the population genuinely does have near 0 cases and near 0 deaths. We'd use other metrics to determine whether it's 1 or 2.",0
1290649860782290000,"Blood is on their hands! Since 2005 Fauci and others have know the benefits of HCQ against many corona viruses! How many lives could of been saved if not for the negative narrative HCQ was given, after 65 yrs of being used! HCQ should be made an over the counter med! NOW! ",0
1290666741434060000,"Coronavirus India Live Updates: State-wise Corona Cases in India Latest News, Covid-19 Tracker, Covid-19 Vaccine, Lockdown Today News Update https://indianexpress.com/article/coronavirus/coronavirus-india-live-updates-total-cases-deaths-covid-tracker-covaxin-vaccine-trials-6538314/ please have some shame. Who will answer for deaths and pain.. Please give time to mourn",1
1290673706503670000,"Whatever dude, It's a new virus we don't fully understand. So just chill out. Even if it is true, people are still dieing from the disease. Even if you don't die, you can still suffer long term health effects. So I'm still going to take this seriously. And who says covid doesn't",1
1290674629262990000,"The medical industry is being affected by COVID, because the industry itself has been holding back its own progress. ",0
1290663139072190000,"What do you say about Dr. Fauci literally calling HCQ a ""miracle drug and cure"" for corona viruses in the mid 2000s? Put your head in the sand and stick with horses as you can only push what CNN tells you.",1
1290661208375400000,The spread of corona virus is increasing in a rapid rate everyday near about 50000 cases are found daily and till now we don't have any solution for it. neither vaccine nor treatment so I request you to cancel compartment exam of the students #cancelcompartment @cbseindia29,1
1290677017143380000,"It’s racist and makes those of Asian decent a target! And, it’s completely untrue. It’s SARS or Covid. This specific virus was found in sewers in other countries up to 3 years ago but for whatever reason just hadn’t affected humans yet. He’s so uneducated, so racist, so hateful.",0
1290676758144920000,"Fighting Stigma : Very low risk of students and teachers transmitting Covid-19 at school, Australian study suggests: ... on the UK and Australia, and published simultaneously in The Lancet Child ... However, school closures may have detrimental effects… http://dlvr.it/RczqDd",0
1290653849875820000,"Corona can be tackled only by taking efforts by the government. Congress states have better recovery rate as they are testing, treating an isolating , tracking.",0
1290674276807430000,"what is gr8 joke, Till today no vaccine for covid-19 then how can people recovered due to treatment by govt? it is inherent body immune systems works , nothing govt role",1
1290659786594350000,"@ICMRDELHI Efficacy of Favipiravir in sobering ferocity of corona in mild, moderate, asymptomatic patients is known 2 months ago and Glenmark, Hetero, Sun Pharma are making it. Can govt now go armed with these drugs to red zones, even treat asymptomatics?",1
1290674985959160000,Speaker Pelosi is still holding up this entire package over bizarre unrelated things like carveouts for the marijuana industry. She even claimed to the press that pot is a proven COVID-19 therapy! I hope she’s shared this breakthrough with Dr. Fauci. Can we get serious yet?,0
1290677430999490000,"Wearable health tech holds immense potential, but any potentially Covid-related insights that come from these tools must not prompt people to unnecessarily visit the ER. Hospitals were never meant to be destinations of choice – esp now. @WSJ @joannastern",1
1290677031844350000,"No, the risk of death isn’t all that important when Asking the question, how likely is a school to be overrun with covid if it opens? Children acquire and infect otherS with covid at rates Broadly similar to adults. The school this acts as a low SD incubator for commmnity spread",0
1290659023600130000,"@drharshvardhan Efficacy of Favipiravir in sobering ferocity of corona in mild, moderate, asymptomatic patients is known 2 months ago and Glenmark, Hetero, Sun Pharma are making it. Can govt go armed with these drugs to red zones, even treat asymptomatics?",0
1290675928658390000,"Yet another study suggesting long-term impacts of Covid-19, this time resulting in degraded neuro function. This is why case growth is an issue, why kids can't go back to school without protection measures, and why we need mask mandates and continued mobility restrictions. ",0
1290673796081420000,"#Fauci &amp; co. knew that Remdesivir was unlikely to work. The study's title ""Remdesivir with IV Administration Alone is Unlikely to Achieve Adequate Efficacy..."" became ""Remdesivir for Treatment of COVID-19: Combination ... May Offer Aditional Benefit"" https://pharmacy.umich.edu/sites/default/files/Sun%20COVID-19%20AAPSJ%20Accepted-4-13-2020.pdf",0
1290657650435330000,"@drbekbal Efficacy of Favipiravir in sobering ferocity of corona in mild, moderate, asymptomatic patients is known 2 months ago and Glenmark, Hetero, Sun Pharma are making it. Can govt now go armed with these drugs to red zones and even treat asymptomatics?",0
1290674657159450000,"So much focus on COVID transmission during sex is taking away from the much more real, and long-term problems of STD transmission, some of which are antibiotic resistant. You can’t scare a 20 year old into abstinence with COVID, but you could with gonorrhea",0
1290677254238820000,"The new studies are part of #NIH’s Accelerating COVID-19 Therapeutic Interventions and Vaccines (ACTIV) program, a public-private partnership to speed development of the most promising treatments and vaccine candidates. Read more about #ACTIV:",0
1290677720519780000,"Amid #COVID-19, consumers expect that business leaders will address factors that impact a community’s ability to thrive. It is important for companies to understand how to evolve their business model to meet changing expectations during the pandemic. ",0
1290673964545690000,"Now that we are living it, people aren’t willing to address a fundamental criterion of public health - individual responsibility. It’s too much for their comprehension that lots of little bad individual decisions perpetuate spread of #Covid_19 . Some indiv decisions have even 2/",0
1290672029608430000,"Even the AP found CCP's trickery but they don't connect the dots. CCP spent January and February (with the WHO's assistance), screaming to the world how ""deadly"" was this ""new Corona virus"" and ""no ordinary virus"". Their big lie? It isn't that deadly to 99.99% of the population. ",0
1290676758144920000,"I think he's trying to claim that the % dying of covid from known cases is lower than average. What this probably means in reality is other places haven't detected as many cases. But what matters is how many die and are affected badly, not how many positive tests",0
