Tweet id,Tweet text,True/False?
1290661880118350000,@PressSec @realDonaldTrump @Scavino45 @kayleighmcenany @SecPompeo I don’t trust Dr Fauci Dr Brixt ! I wonder if Dr Fauci Dr Brixt and democrats are taking HCQ and can they be tested to see if they are using this drug. Dr Fauci has known for 15 years it works to stop Corona virus,1
1290674095223440000,"#exposebillgatesday Research needs to be done between each countries infected, recovered and death rates of covid in comparison to each countries uptake of flu vaccination last year to see if there is a correlation",1
1290675101134910000,"The full @save_children ""#SaveOurEducation: Protect every child’s right to learn in the COVID-19 response and recovery"" report has more analysis, insights &amp; recommendations. It's worth checking out. ",1
1290667783500580000,"That makes sense. I had H3N2 (claimed to be the strongest influenza strain, yet), and I've probably had Corona, a few months ago, given the symptoms (dizziness, fever, migraines, joint pains, and thick, green nasal mucus, unlike anything else), but mostly recovered.",0
1290648408202570000,"I call people who refuse to wear masks in the midst of a corona virus hot spot stupid or worse. Why? Because the harm caused directly effects others not to mention the fabric of our society. I don’t perceive evangelicals much differently. In fact, they overlap considerably.",0
1290648809039710000,Why is there only people who think: “Corona is the worst thing in the world and will kill us all” or “Corona is completely harmless” It’s neither and if you would do your OWN research you would know that.,0
1290676416581950000,"As COVID has presented new challenges for everybody, clubs have been seeking creative solutions to keep athletes connected and recruited MVPCAST delivers HD-quality streaming video with an intuitive and easy to use app! See how it can improve your club: ",0
1290675464617550000,"That's true but I dont think the overwhelming majority of elective surgeries are going to fall into that category. But your original question, of how many are are covid beds vs how many arent, is still a valid question.",0
1290654018587570000,We need SARS corona free society and a culture that is willing to ask hard questions and expect the right answers and results.,0
1290650587462340000,Is there a plan how to get mental help to school children who realize at some point that it was them who gave corona to some of their loved ones? This is a rethorical question.,0
1290675957389560000,So would memory B cells to other coronavirae explain why some older folk survive covid-19 even if they have underlying conditions?,1
1290677177596470000,"surely this was to help Brazilian lupus patients, because doctors are like pretty clear that it isn't a good treatment for COVID-19 definitely doesn't have anything to do with trump having a stake in its production and sale, surely not ",1
1290675464399280000,"I love a good analogy. As Tyler mentions in his thread, it's hard to come up with a perfect analogy for COVID since it's so unusual. But he does a good job with this one. ",0
1290675530681870000,"Have your patients been watching the continuous coverage about COVID-19? Does hearing about the recent surge help them heal? In this post, get tips on alternatives to commercial TV by offering a positive and healing distraction: ",1
1290654393629650000,"@narendramodi @drharshvardhan Sir please take serious note of this.FMG,s can be included in fight against corona,it will overcome shortage of trained manpower in hospitals. Plz don’t discriminate FMG’s on the basis of an barrier called FMGE #letfmgserve #IndiaNeedsFMGDoctors",1
1290675957875930000,"places where young kids would be likely to pick up any illness, COVID or otherwise, have been closed for months in most nations (schools, daycare, sports activities, etc.) has this age group even been exposed to environments independently of their parents in this time frame?",0
1290677186370980000,Serological tests detect antibodies specific to Covid-19 (especially those with a sensitivity of 90 and upwards which is what the ministry claims will be used) They indicate whether someone has been exposed to covid 19 in the past and may therefore have immunity.,0
1290677077159660000,"I also have a vitamin deficiency, so I get you on the teeth thing, do you have the implants or just denture? Covid slowed down the process of my new ones so now debating over which style. Any tips and help appreciated",0
1290652180026990000,"Just to play devils@advocate. The cost of HQC with zinc and that other drug supposedly used in combination to fight corona, were in the couple dollars a dose range. That other new drug I don’t know how to spell or care to check is 3500 a treatment....",0
1290673900762800000,"Can’t the gift infrastructure take the load if all Pvt hospitals aren’t allowed to treat Covid ? TIMS is barely working. Compliance doesn’t mean retracting the services, compliance can be enforced in other ways. OR if that’s not possible nationalise then temporarily. ",0
1290677646423200000,"Dr. Chuck Henry, ’94, teaches chemistry along with chemical & biological engineering at Colorado State University. He & his colleagues have been working on a simple virus-detection device. Read about how his research is impacting COVID testing. Full story: https://bit.ly/3gcOBZD",0
1290674670455400000,So you know their motivations? And you can confidently say that this is because they wanted the cash rather than (a) they were afraid of COVID; or (b) they had children who were at home? And you think this anecdotal evidence can be extrapolated to millions around the country?,0
1290674399322890000,"Meanwhile, how serious is the action? Stopping from treating #Covid_19 patients is one aspect.Will hospitals be made to return the money that has been fleeced from patients?Will there be a permanent action like cancelling the license- irrespective of disease/ treatment.",0
1290675811721210000,The anxiety and unknowns of sending your kid to college have reached new levels with COVID. We’ve outlined the safety and financial questions you’ll need to consider as fall approaches. #COVIDConsiderations,0
1290677664546780000,"Learning in a Crisis: Culture and COVID-19 Organizational learning is not complicated. However, it does require leaders and teams to quickly translate what is happening around them into insights and actions. http://ow.ly/LMSh50AJrjr",1
1290676626431270000,To reach the already hard to reach courses also need to reflect more in life actions settings feel of value post Covid #pulmonaryrehab is in an unique position to evolve into a more appealing more inclusive accessible to all experience attendees and completion numbers are low,0
1290668693370930000,"Man I can’t eat barely I’ve had one solid meal in the last 3-4 days, I can’t fuckin walk and I can’t go to a doctor right now cause I’m tryna save money and I don’t wanna catch corona and the best part is the one stress reliever I have is skating which I can’t do now ",1
1290645446097090000,"Bill Gates and his boys have just upgraded Corona and are thinking of releasing it again for a more Robust attack in November December months. After that they will force you to have a vaccine, to inject their micro chip in you, so they control humanity, sources claim. ",0
1290677159992990000,We thank @SafeGraph for making the Foot traffic data available. Our paper uses the @SafeGraph data and the first study to quantitatively show that counties which had implemented policies and effectively increased social distancing have seen slowing of the spread of COVID-19.,0
1290675138271290000,Complementary therapies can help with many issues including post covid symptoms. Here we learn how Craniosacral therapy has done just that... https://healthylifeessex.co.uk/2020/07/craniosacral-therapy-for-post-covid-symptoms/ #craniosacraltherapy #complementarytherapy #postcovid,1
1290676956212660000,"According to The #Times, a sample of the virus that killed six in 2012 was housed at the #Wuhan Institute of #Virology and was described in a scientific paper cowritten by Shi that states it is a 96.2% match to the COVID-19 virus.36 The virus, called RaTG13, says The Times.",0
1290675627226350000,"Marijuana HAS been proven as a successful medical treatment for many things she doesn't say it's proven success against COVID...Your dumbass boss told us to inject bleach, so maybe sit this 1 out #MoscowMitch Regardless, I'll take funding for pot over billions more for Jets",1
1290676931810200000,"Literally none of that is true, you’re just being told these things by fake news. Only elderly people and people with severe health problems are actually suffering from covid. Stop letting the media brainwash you.",0
1290672616370340000,"How will this people get identify, they have corona positive? By preferring home isolation, will people get recover from COVID-19 without any treatment provided?",0
1290677301982690000,"Aintibiotic resistance grows more concerning, and the market for these drugs has been plummeting. This threat to infrastructure has become more omnious during COVID, but there are soultions at work. ",1
1290676990996090000,".@AdlibSolutions MD, Andy Dockerty has shared an open letter on social media, outlining the dire situation within the live events industry as a result of the Covid-19 pandemic. Read it here: https://www.tpimagazine.com/invisible-and-undervalued-adlib-md-andy-dockertys-open-letter-to-the-industry/ #WeMakeEvents #LetTheMusicPlay #LightItInRed",1
1290675836505460000,Both the emergency responses to Covid-19 and the construction of a ‘new normal’ in the criminal justice system should reflect the detailed and continuing input of people with lived experience. - Recommendation from the RR3 Covid-19 special interest group: https://www.clinks.org/community/blog-posts/what-does-recovery-look,0
1290661864595230000,"1/Countries that test less usually test only those who have serious symptoms. Hence the CFR (the ratio of Corona deaths by confirmed cases) will be unrealistically high. The more you test, the more mild/asymptomatic cases you will find&amp;the CFR will converge to its real value",0
1290666769930220000,"Is he still using the “if you tagged a cop for 10 mins he’d commit 3 felonies” logic with corona ? “The more people you test of course you’re going to find more positive cases” babes corona isn’t weed very prissy ppl love a smoke but aren’t secretly harvesting cornona, my god!",1
1290675821162650000,"The US sent Brazil millions of hydroxychloroquine doses. Months later, they're still in storage https://www.cnn.com/2020/08/04/americas/brazil-us-hydroxychloroquine-doses-intl/index.html! It might be Bolsonaro who tested positive tried it and found not effective in treatment of COVID-19",1
1290674753603130000,"When there is already significant debate and pushback of the legitimacy of certain Covid prevention methods and their effectiveness, Woke organisations like @NPR do no favours, when they come up with bullshit analogies that are on the face of it beyond stupid.",0
1290677665586970000,"A wave of illness involving children and teens is starting to raise some concern. The illness, which doctors are calling pediatric multisystem inflammatory syndrome (MIS-C), is believed to be linked to COVID-19, but there is much that is still unknown. https://cle.clinic/3f9b9Jw",1
1290661177886900000,I don’t trust Dr Fauci Dr Brixt ! I wonder if Dr Fauci Dr Brixt and democrats are taking HCQ and can they be tested to see if they are using this drug . Dr Fauci has known for 15 years it works to stop Corona virus.,1
1290674615740700000,"None was anticipating vaccine sooner & none is even now. But a 10 second Covid testing machine (biggest invention) back then, could've altered the situation. At home testing kit, wow! And the Inventor would've become an icon all over world! Before cure, of course, if any! ",1
1290661631719020000,"Corona Cultists build their arguments on the assumption that coronavirus is dangerous to healthy people. They’re wrong. We know for a fact that coronavirus is about as dangerous as the flu, that the lockdown is useless.",0
1290674998663810000,"Delhi Model - in June end, make a false projection of 5 lakh cases till July end, then claiming so called success of containing Corona. Nobody is in the world is talking about winning over Corona. Sane people are talking how to manage the patients and disease &amp; developing vaccine",1
1290645516661940000,"@a_sabo12 @macfound @ICTAdvocates in the collaboration CBOs may get new information updates on th COVID 19, capacity building on new skills that will help their community work in the corona virus period &amp; post covid 19 eg using Vitual meetings with stakeholders on combatting C 19 ",1
1290677099242620000,"If it is taking a week (in some cases) to get the results to COVID testing, then is #MAreally have the testing capacity? #DrFauci said for it to be useful it would have to be in 24 hours.",1
1290675572599740000,"something my nerd brain is struggling with: various gov’t bodies are relying on data that ‘says young children are unlikely to transmit COVID to their parents’ in these same areas, how long has this same age group been confined to their home, exposed only to family members?",1
1290675088912780000,"Just not true. ""COVID-19 may also be spread by people who are not showing symptoms (i.e., “asymptomatic”). According to the CDC, 35% of all people with COVID-19 are asymptomatic. However, those individuals are still as infectious as people with symptoms."" https://health.ucdavis.edu/coronavirus/resources/covid-19-faqs-for-health-professionals.html",1
1290674124591900000,"Few good options. COVID running wild will overrun health systems/non-starter. Need treatment/vaccine, real eradication (very draconian rules requried), or current situation long-term, i.e. slow-simmer of cases with lockdown/reopen waves and no more large gatherings.",0
1290672045093780000,Coronavirus: Can Corona Vaccine Have Side Effects? know the answers to such important questions ,0
1290676386739280000,Securing IoT as a Remote Workforce Strategy: Digital transformation with Internet of Things devices offers organizations a way forward in the era of COVID-19. Optimizing this approach for the future will need to start with security. http://dlvr.it/Rczpjx,0
1290677491468600000,"Fauci has been killing science for Big Pharma and his own profit since 1984. Plus, new research shows Covid-19 RNA camouflages itself as human RNA which increases likelihood of autoimmune disorders from any Covid-19 vaccine: ",1
1290672688265070000,If my baby is referred to a ‘corona baby’ or is sad to be a ‘product of quarantine’ by people who won’t even be lucky enough to see pictures of her let alone meet her I will straight up punch an old hag. You don’t take the time to be in my or Jts lives what makes you think you’ll,0
1290674602780190000,"With the inevitable rise in cases that will occur, how will the UCP ensure that doctors will be available to help covid cases in rural areas where doctors were forced to leave?",0
1290676835945180000,"Because you can contract COVID while taking every single precaution, it stands to reason that you should engage in high risk activity. (This line of reasoning only tracks for people who are devoid of critical thinking ability)",0
1290675174883430000,"Our one ray of hope, that the COVID-19 vaccine doing well in the trial phases thus far, is probably going to be snuffed now that it's looking like Trump will push to release it prematurely. Guaranteeing medical mishaps and giving fuel to the Anti-vaxxers. We just can't get a win",0
1290640503822840000,"With the corona era, it may be possible to shift human resources engaged in entertainment, sports, and customer service to the digital space. We present the possibilities. Please commit. Questions are accepted only on this matter ",0
1290648250303770000,This is bullshit since the original research is about Sars 1 corona viruses and coivid 19 is a Sars 2 virus. So good luck taking all this hcq looking smart with this research you think support your point but doesnt,1
1290675112186970000,Contact Tracing: Many health departments losing race to warn contacts of #COVID victims The soaring number of COVID-19 cases in the US has far outstripped many local health departments’ ability to trace the contacts of those infected https://buff.ly/30rrvZN - Reuters,1
1290675181141330000,ICYMI: Our Policy & Research Officer Chloe Minish has written about the steps the justice system can take as COVID-19 lockdown measures ease and examines some of the changes needed to better support people affected by crime in the long term ,0
1290674736532450000,"It’s a balancing act. If all women are allowed back; the chances of covid spreading are high. I do think in certain cases, exceptions should be made but one also needs to weigh various risks. I think they are trying to do that.",0
1290674692085490000,"It’s because if you get COVID you could actually not be living, meaning you’ll die. And even if I wouldn’t die I don’t want to spread it to people who could but you don’t have a heart so I don’t expect you to understand.",0
1290676635247800000,CA will soon become the 2nd state to collect sexual orientation and gender identity data for new COVID-19 cases to track how the disease is affecting the LGBT community. We need to understand these disparities and apply this data-driven approach nationwide ,0
1290676083424140000,"Least testing played big role, second role is of those cases who didnt report bcz of fear of govt treatment with Covid, third role is of irregular data etc etc...why Trump is under the belt of critics ,bcz US testing alot and patients are increasing...",1
1290677145027500000,"The only case chart I produce is the heatmap: https://twitter.com/zorinaq/status/1290029180466298880 FDOH line list date actually has, for every case: - date of onset of symptoms (EventDate) - date the case was counted on the state's COVID-19 dashboard (ChartDate) - date the person was confirmed (Case1)",0
1290666613738550000,"Daniel, I asked a question three times by now on twitter but got no reaction at all. Hereby again: would it be possible to make a function so you can actually talk to your opponent? That would be a good corona-option, don’t you think?",0
1290675230877210000,"Individuals with COVID-19 can spread it before showing symptoms. Some don't even show symptoms at all and still spread it. That ""When to use mask"" tweet from @WHO must be severely outdated. Information now is saying to always wear one in the public",0
1290648983178790000,someone explain to me why some people believe that doctors shouldn’t voice their opinions on abortion & gun control but politicians are allowed to give their opinions on the corona virus?,1
1290673671497900000,"Despite seeing a decrease in cases, contact tracers are still struggling to keep up with new cases. And our outbreak #s and case per capita rate are still too high. Some officials feel now is the time to develop an app that can tell you if you've been exposed to COVID-19. ",1
1290669641921170000,"A drug that is used worldwide and has been deemed safe for over 60 years, used specifically for a corona type virus in 2005 successfully BY fauci. I choose to live. If you want a vaccine that has no trials and no safety tests, be my guest.",0
1290673751345040000,"they’re probably emphasizing that it’s a lot better than it is. the mortality rate is supposed to be ~2%, so if it’s say, 1.7, while other counties have 2.3, they’re trying to say “it doesn’t matter if ppl get covid bc more of them survive here!”",0
1290675220580310000,"State attorneys general: Use federal law to lower cost, increase supply of COVID-19 drug remdesivir https://www.usatoday.com/story/news/health/2020/08/04/bipartisan-coalition-attorneys-general-today-asked-u-s-department-health-and-human-services-invoke-f/5580087002/ via @usatoday",1
1290675654627810000,"That’s a worldwide statistic and very bad. If you screenshot something from the CDC you should read the supporting context. Also, research further amd you’ll understand how Covid-19 is much different from H1N1.",0
1290674210197640000,"Sizeable positions in both $ONEM and $FLIR and I still like the entry point at these prices. Both of these are low-risk plays with mid-to-high upside IMO. Catalysts, COVID-relevant solutions, and with volumes below average it doesn't seem hype has set in yet.",0
1290675217241640000,"Given the surge in COVID-19 and ICUs being filled beyond capacity, ICU delirium will be increasingly seen and harder to overcome as doctors work keep up with surges in critically ill patients.",0
1290675094243530000,The same people claiming they are afraid of COVID *and* HCQ because the dangers of long term effects aren’t known are the same people who take Ibuprofin and other NSAIDS and have never even thought twice about the listed warnings on the bottle. #TrumpDerangementSyndrome,0
1290675796609300000,"The Ontario government is encouraging everyone to download the new, free COVID Alert app onto their smart phone. The app supports the efforts of public health units, allowing the province to quickly test, trace &amp; isolate cases of #COVID19 to stop the spread of the virus.",0
1290675827869220000,"Buddy: “covid” doesn’t necessarily kill someone outright. Think “aids” - it can weaken an immune system or mitigate the bodies ability to respond to other illnesses. So, comorbidiities that likely we’re survivable otherwise end up being fatal *because* of coronavirus",0
1290674942288290000,"There is Emuna, (faith) (defined by me as a perspective that makes life workable). Then there are different kinds of Emuna. The story of the Man(na) is the story of emuna as a daily exercise. I've felt for a while now that this corona test is about only handling today. Like #AA",0
1290674113967770000,"Not a ton of experience actually working in it due to Covid) I’m not entirely convinced this is where my passion lies. Therefore, there’s a sort of regret and a tinge of resentment that I’ve discovered recently. Midheaven/Mercury conjunction in synastry indicates that the—",0
1290666842785300000,"The MUZZLE Wearers The stooopidity of restricting normal breathing, using, reusing Manky face Muzzles , breathing in air flow over these materials is inviting Upper Respiratory Tract related illnesses. These will manifest in Common Cold (Corona Virus) and like Pleuralsy https://twitter.com/PoliticsPollss/status/1290654046076968965",1
1290658575652730000,"@mla_sudhakar Efficacy of Favipiravir in sobering ferocity of corona in mild, moderate, asymptomatic patients is known 2 months ago and Glenmark, Hetero, Sun Pharma are making it. Can govt now go armed with these drugs to red zones, even treat asymptomatics?",0
1290670123922010000,"Because this lockdown is so long into the corona virus the Victorian Gov has got answers to many of the most practical questions sorted out. But some answers are nonsensical. Own a dog, yes can take it out to toilet but try to combine with other activities outside. But that’s 1",0
1290674343391890000,The #COVID Urban Rural Explorer is one of the first tools that enables users to identify rural counties across the country with both limited hospital capacity and where #COVID19 cases are rapidly growing. https://news.wsu.edu/2020/07/29/wsu-scientists-develop-covid-19-tracking-tool-rural-areas/ #WSU #GoCougs,1
1290676144493160000,Sorrento therapeutics is going to cure Covid and will also have a hand in opening the country back up. Mark this post! Forget Novavax and Moderna two companies never released a drug in their career,0
1290638383635730000,Are you guys serious... lol you can’t put all death under corona and talk about death in regards to population. It’s not rocket science many just don’t analyze I guess ,1
1290659501268500000,"@ncdirindia Efficacy of Favipiravir in sobering ferocity of corona in mild, moderate, asymptomatic patients is known 2 months ago and Glenmark, Hetero, Sun Pharma are making it. Can govt now go armed with these drugs to red zones, even treat asymptomatics?",1
1290675185977360000,"Can you provide the scientific evidence that masks prevent, stop or cure COVID-19? I don't want you, or anyone else's opinion, I am asking for scientific evidence",0
1290677628131770000,Nursing homes hope new antibody trials will put them on 'offense' against COVID-19 ,0
1290645059692630000,"The world has been so propagandized by ""Project Fear"" that a recent survey in several countries - revealed that most people believe tens of millions of people have died from Covid! Is this the most successful psy-op in history? #corona #Covid_19 #لبنان http://ronpaulinstitute.org/archives/featured-articles/2020/august/02/people-have-been-so-spooked-by-the-state-sanctioned-project-fear-that-they-believe-tens-of-millions-have-died-from-covid-19/",1
1290676093578440000,Indian and International experience of use of ventilators in Covid19 patients is poor. The death rate is staggering going to 80 to 97% especially in 50 plus patients. Hyperbaric Oxygen Therapy is more effective. There r enough reports on benefits of HBOT in Covid 19. ,0
1290674362497090000,"What will post COVID-19 school look like? Whether virtual or in-person, the role of #edtech in classrooms will continue to evolve as we get #backtoschooling. There will be many challenges to juggle — but there are bright spots as well. Let's explore: https://newse.la/33iAdLP",1
