Tweet id,Tweet text,True/False?
1290676801694440000,While facing psychological depression the society expect scientists around converging in suggestion or recommendation toward COVID-19 resolution to calm down people,0
1290675781895580000,Remember when Fauci pushed AZT on AIDS patients and killed a lot of them with it? Now he’s pushing untested vaccines for Covid and repressing treatments that work. And the corporate media has millions worshipping him. ,0
1290675112258260000,"Mr. Floyd seemed to be having a really bad anxiety attack. The anxiety raised his heart rate which caused breathlessness. That, combined with a lingering Covid infection, combined with a probable lethal dose of drugs caused a heart attack. In my opinion.",0
1290674323431330000,Does anyone have an air purifier? Would y'all recommend it or is it a waste of money? Any brands in particular? I have been waking up with a really bad congested nose every morning and it's getting exhausting to keep thinking I have COVID when in reality it's just allergies.,1
1290674693813350000,Professor David Baker's audacious approach to creating new proteins may offer new options for stopping disease—including COVID-19. ,0
1290677130162910000,"Except the patent is public info, Vik, so Kennedy does have facts to back up his assertion. Also, new research shows Covid-19 RNA camouflages itself as human RNA which increases likelihood of autoimmune disorders from any Covid-19 vaccine: ",0
1290649842843290000,"I'm thinking most people are no longer creeped out by this often-used image of the corona virus so its losing it's click bait power. That begs the question, what new image will media settle on to create the requisite level of revulsion. An intubated patient? A dead body? ",0
1290677242788480000,"No different from having an annual flu shot. Count me in! In fact, they could probably combine the Covid and Flu vaccines together for a two in one shot.",0
1290674834385570000,If we continue at this rate the economy with be decimated and mental health issues will be far more rampant than covid ever was. Is anyone really looking critically at suicide rate.,1
1290659350843990000,"It would be very dangerous to open schools, colleges at this time. Government isn't showing correctly the data of Corona patients and also their tests are doubtful. So be careful to demand to open educational institutions. Will our children able to face virus attack.",0
1290673988952360000,"How should industrial manufacturing companies prepare to challenges brought by the Covid-19 pandemic? How should they leverage these trends to become more innovative, cost-effective and competitive? Find out more here: ",0
1290674215700640000,"The accounts of monthly board meetings published on the group's website are cursory, says Chen. A summary of the December meeting, for example, simply says evidence of human-to-human transmission of COVID-19 in Wuhan was ""insufficient.",0
1290675508850510000,They have vaccines for the flu. Would have had one for this Covid had this administration acted sooner! FAIL!!,0
1290677308165100000,"Covid as itself is scary enough already, but we don’t know how the long term effects will be. I think any potential long term effects are being overlooked right now.",0
1290677012970050000,"Please read my tweet again. It is about getting doctors in the UK and RoI to speak up, like Dr Gold, about Covid-19 and what they believe is best for their patients. I say nothing for or against any alleged viewpoints or associations of Dr Gold.",0
1290655073794760000,"a cure is different from a vaccine! the flu and corona are constantly evolving, so it would not be possible to find a cure. the flu vaccine is created using the most dangerous strains of it that scientists can find, they should be able to make a vaxx for corona :)",1
1290675654111950000,A doctor puts a person into a frail care home without testing that person for the virus who has now tested positive to covid-19. I say that doctor should be arrested and restricted from practicing immediately as he has now endangered the whole home!!,0
1290675456396520000,If a pregnant woman wants to give a birth in two months is somehow similar covid 19 vaccine. Listen to the chief scientist of WHO. ,1
1290673829824670000,"Here's just a sample of the many HCQ trials which have found positive results for the drug's use as a prophylactic against Covid Remember folks, BBC is 100% globalist propaganda! Also, Bill ""super painful vaccine"" Gates donates to BBC Media Action! #defundBBC #DefundTheBBC",0
1290670636243840000,#IAmKashmirAmbassador International communities must put pressure on Endia to lift this inhuman blockade so that patients can get the care and treatment they need for Corona....!!!!!!!! @TeamISF_,1
1290674692802530000,"To be more precise, the last sentence should read: This is the only prescription needed to heal oneself of mild colds&flus; which initiate the immune system to run through it's natural processes of #corona viral and bacterial generation until homeostasis is once again achieved. ",0
1290639881216060000,Governments must think alternative strategies on education delivery as Corona viruses may be with us in the long hall.E- learning is the key to our future education dispensation.,0
1290656524981940000,It is definite that more and more will be infected with corona as india population is huge. Getting more number does not indicate failure of policy. Important parameters should be cure and death rates. Cure rate going up and death rate going down are encouraging signs.,0
1290674040215080000,"Covid-19 vaccines may cause mild side effects, experts say, stressing need for education, not alarm https://www.statnews.com/2020/07/27/covid-19-vaccines-may-cause-mild-side-effects-experts-say-stressing-need-for-education-not-alarm/ via @statnews",1
1290676003795130000,Another from New England Journal of Medicine: https://www.nejm.org/doi/full/10.1056/NEJMc2025179 I tested positive for the antibody (July 2) but never had any symptoms. My wife tested negative. She &amp; every person in my household EXCEPT ME had Covid symptoms in February before they thought it was in the US,1
1290674472542860000,"""Patients admitted with COVID-19 at select hospitals may now volunteer to enroll in a clinical trial to test the safety and efficacy of a potential new treatment for the disease"" ",0
1290676768173620000,"I don't think you have done research, or you are unable to interpret the list. It is approved But, not for Covid. You really don't understand that? Insulin is approved for diabetes but not for Covid. I don't think you are ignorant. But, a blind cult follower. U r dangerous.",1
1290658082511560000,Well I don’t think the people that do all those things and still get the virus planned on getting corona in other words it’s still an accident. You can take all the preventative measures like those in a car. It’s not like their doing it on purpose. Same as an accident.,0
1290674968167150000,"However, this is also an argument for the lockdowns. If we don’t control covid, and fill hospitals and my appendix bursts, there are no resources to handle an otherwise easily handled emergency and the death toll rises from other things.",0
1290677657227660000,"@JNJNews is utilizing its full strength of its science, and expertise to help fight the pandemic, as COVID-19 continues to affect people and communities across the world. Read more of Johnson &amp; Johnson's efforts here: http://ow.ly/RsIq50AQs3C #covid19 #flattenthecurve",1
1290677650273460000,"Finally, an explanation of why test results are so delayed, and thus useless in preventing Covid spread. Great reporting from @sanjosemercury",0
1290675524193240000,"Wrong. Read the actual study and find out chloroquine was used only on cell lines, none of which were the ones that cause COVID-19, and never in humans. https://www.bbc.com/news/53601027",0
1290661713377930000,"Corona Cultists build their arguments on the assumption that coronavirus is dangerous to healthy people. They’re wrong. We know for a fact that coronavirus is about as dangerous as the flu, that the lockdown is useless. ",0
1290648181517290000,#parthsamthaan has become a covid 19 survivor who has fought the corona disease strongly... He is safer person with antibodies &amp;strong immune system also...He has inspired us to remove the stigma around covid 19&amp;spread love &amp;positivity everywhere.. He is next level human,1
1290668648181270000,"Some people have excellent brain, why they are not using there brain for the preparation of corona antidote.",0
1290676061953560000,Haven’t seen a school plan yet that identifes what to do when we put hundreds of students and staff together who have been isolating for months. Depleted immune systems will lead to thousands of colds and flus. What’s the plan to decipher COVID from colds and flus? Won’t work.,0
1290677052635410000,"#LCSM Chat discussed #COVID_19 &amp; lung cancer on 4/2. Much has changed in 4 months! The USA had ~4.5 million COVID-19 cases &amp; &gt;150,000 deaths to date. We have a better understanding now, yet much is still unknown. Read more here: https://lcsmchat.com/2020/08/03/lcsm-chat-topic-8-6-2020-update-on-covid19-and-lungcancer/ Join us this Thursday 8/6!",1
1290676220447900000,"You know, we can tell who is susceptible to fall to covid right? We know people above 50 are disproportionately affected and those with conditions are also highly susceptible. What if... We accunted for that and made a decision rather than ruin lives of people for faux conpassion",0
1290638287007120000,"Had he done the things as mentioned , May be he might have'nt contacted Corona . Since there is no remedy of Corona yet so thr is no harm trying the things which can boost immunity( Coronil ) or hv clinical proof to fight Virus ( Gaumutra) ! U need not 2 be Bhakt to try it out.",1
1290676083499690000,"Peer review (and reproducability) are key. Experts understand possible mechanisms of actions and can take a Bayesian approach to the problem. They do a prior plausibility assesment. With Covid-19, they are throwing all the spaghetti they can, but they still must 'do no harm'.",0
1290675021770370000,"Went thru a drive-thru COVID testing site in #Toronto, took about 45min start to finish, and just over 24hrs later I got my results. Negative If you want to get tested, here are all the locations in Toronto https://www.toronto.ca/home/covid-19/covid-19-what-you-should-do/covid-19-have-symptoms-or-been-exposed/covid-19-assessment-centres/ #covid19",1
1290676218321340000,"Tippy, even though this claim is easily debunked too, you'll just have another one that is also not true. People of weakened health ARE MORE LIKELY TO DIE. That is how ALL diseases often kill. It is directly related to complications that otherwise wouldn't be there due to covid.",1
1290676093737810000,"As we enter into another month of living and working in the world of Covid-19, check out this article that provides you with concrete tools and data around how you should consider moving forward, career-wise, as the global economy is shifting.…",0
1290661210724140000,Testing reducing once day by day even call for Ambulance are sad ie 1k now how come cases r reduce other state r increasing testing to get better result and delhi less in testing result cases r less This is not the solution and do u think delhi become corona free zone by ths,1
1290675653751090000,"I think some of the biggest challenges to be faced haven’t been seen yet. Such as surges of people going on to develop secondary health conditions like fibromyalgia, CFS and other chronic illnesses from covid 19 infections. Especially those who never tested + in time.",0
1290675182982520000,Businesses may be notified of potential or confirmed cases of COVID‐19 and the Government has provided guidance on the NHS Test and Trace service for employers: ,0
1290674777074480000,Bill Gates: Delays in Covid test results make them a 'complete waste' Autonomous Evolutionary Eyewear with microscopic vision 24/7 on demand in real-time for contactless testing. https://www.cnbc.com/2020/07/28/bill-gates-says-delays-in-coronavirus-test-results-make-them-a-complete-waste-insane.html https://www.researchgate.net/publication/336722064_Autonomous_Eyewear,0
1290674609092800000,"The expansion of telehealth/virtual care is the bright spot in this whole COVID debacle. The rapid expansion due to isolation needs have made patients more comfortable with it, made payers more comfortable with it, and made providers more comfortable with it.",0
1290662842279090000,"after all these months corona baba now feels so close and i'm so worried for them. i've spent a lot of time reading case histories, treatment protocols, medical journals, looking at chest x rays and ct scans and medical terminology is a lot of fun but reality is fucking scary",1
1290674433112370000,"The NFL has new maximum fines for refusing to take a COVID-19 test ($50,000) and refusing to wear a mask, tracking device or maintain social distancing ($14,650). The league has also restructured how a team can fine a player following a positive COVID-19 test, per @BenVolin.",0
1290675997587590000,Thread ... I'm seeing some evidence that Qanon is gaining some ground - in vets groups and online. They spread that all Dems support pedophelia; militia is required; covid is a hoax or medicine withheld. We need sane voices to amplify truth. @harrygod @Megawatts55 @RickPetree,1
1290644962565060000,"Please, please accept this fact ... A certain number of people have corona virus . They have it even if they are not tested . Tests let you see how many people have the virus ... a test does NOT alter the fact of how many people have it ..tests don’t make more people infected",0
1290673997684920000,"State attorneys general: Use federal law to lower cost, increase supply of COVID-19 drug remdesivir https://www.usatoday.com/story/news/health/2020/08/04/bipartisan-coalition-attorneys-general-today-asked-u-s-department-health-and-human-services-invoke-f/5580087002/ via @USATODAY",1
1290650687118930000,"Of course you won’t, you don’t even think corona is a thing, not to mention you have an American attachment to freedom and rights. Which is the opposite to me, because I do think it’s a thing, and I don’t have an American attachment to rights and freedom.",0
1290673689688590000,"Dr. Hinshaw says Canadian Association of Pediatrics, others, are clear that we must look at the overall well-being of students. Must make sure children have access to ALL supports they need. Balance of COVID-19 safety, but not just focusing on covid. All in context.",0
1290673811944170000,"$DECN disruptive technology their test is going to be huge,it has applications to far more than covid",1
1290675289673140000,"A5(4) Education is a fundamental right and the bedrock of equal societies, no child should be denied the opportunity to learn. Education systems should put strong focus on equity and inclusion to ensure no child is left behind especially in the COVID-19 context #EducationTuesday",1
1290677551313090000,Jared his immediate response was to close the boarders but he was called a racist. He found a drug Hydroxychloroquine that was very effective in reversing COVID symptoms but because it was effective they discontinued use! Even banned it in some states!,1
1290665273603820000,Actions like these are part of the reason why pandemic like the Corona virus is ravaging the world. We have become inhuman in our treatment of fellow human for whatever reason. May GOD have mercy on all of us for denigrating what is more sacred a human life!,1
1290677333016350000,"They were real! Science has proven that children's imaginations were the sole source of force fields in the world, keeping most of the virus pop. lower, which is why covid is here because we don't have enough magic of innocence detoxifying things anymore and hey r we out of pot?",1
1290642506523210000,"As conspiracy theories continue to rise in spiritual communities, I want to let anyone who needs to hear this know that I don't agree with this idea. Not all tarot readers or occultists are on this 5G / 5D / Corona-hoax bandwagon and I'm one of them.",0
1290671268644240000,"Yeah I feel like that’s the same sitch as me!! It hasn’t bothered me in years but I’ve been riding my bike (both outdoor and peloton) a lot since corona and it KILLS me after I get off. If it’s an option for you to try acupuncture, I recommend giving it a go at least once",1
1290675847062520000,"Corona was spread all over the world months before this. It has been determined that it was spread across the world in Nov - Dec 2019. A study of genetic mutations within the virus proves this. If you think that this was the source, you're delusional.",0
1290674686339230000,I honestly don’t understand that poverty statistics. How does poverty raise the likelihood of someone CONTRACTING covid. I can understand if they are more likely to not receive the treatment or have the resources to be treated but how is covid saying “I chose you cuz you’re poor”,0
1290655657042090000,"Keep up the good work! Tell the mainstream media the democrats to stop politicizing this Wu Han Chinese Corona virus! Hydroxychloroquine saves lifes, safe, and cheap 896,000 M .",0
1290674771831770000,Speaker Pelosi is still holding up this entire package over bizarre unrelated things like carveouts for the marijuana industry. She even claimed to the press that pot is a proven COVID-19 therapy! I hope she’s shared this breakthrough with Dr. Fauci. Can we get serious yet? ,0
1290676563806160000,55% of Covid-19 hosp admissions show increased rate of psychiatric disorders. &amp; thats not taking into account the huge psychological impact Covid has had on general population. The mental health pandemic is yet to peak! ,0
1290675488491530000,It’s certainly an improvement compared to the last few months. Few more weeks I reckon before I can stop taking them. GP has been on the ball and v helpful with tests/diagnosis/treatments as know not all GP are aware of long covid,0
1290642089232020000,"Mam,second para is the truth, there won't b one time vaccine, few vaccines r already available like Pneumococcal nd others, this is all market Gimmick. Only Self Hygiene and Social Distancing can avoid Corona. ",1
1290645647050380000,The gap between the reality and perception around Covid risks – almost a factor of 100 – shows how state-sanctioned “fake news” – Project Fear – has come to dominate the public imagination and is negatively impacting how we manage the crisis. #covid_19 #corona #كورونا #لبنان,1
1290676910868100000,The impact of #COVID19 on nutrition in developing contexts is long-term and extremely detrimental. Refugees in particular are at an increased risk of both malnutrition and contracting COVID-19 due to overcrowding and limited access to health care. ,0
1290665978091700000,"With so many VVIPs being infected by Corona virus the question that comes to mind is whether these people flouted norms of social distancing, wearing masks etc. or these preventive measures being prescribed are humbugs. Let our PM clarify @PMOIndia",0
1290674103872110000,"I believe we could classify her hypothetical as a red herring. Who in the media would do this? The media is a rather large varied group. The major panic that I have noticed is the HCQ stupidity that you mention. It doesn't work on covid, even if some quack in Houston says so.",1
1290671189593970000,"Is the lockdwn proper solution get ride frm corona I think no,never. How can any gov help the poor families.All gov provided only meal ,oil,salt etc.But spices,milk, medicine,green vegetables any many more.May I know how can a poor manage all.Perhaps he can't for he hasn't money",1
1290676362940900000,"SARS-CoV-2 strains show little variability, COVID-19 vaccine could be effective against all, finds study https://go.dsmenders.com/sars-cov-2-strains-show-little-variability-covid-19-vaccine-could-be-effective-against-all-finds-study/",0
1290647070416800000,"Corona was never a hoax, no one knew much about it. Trump spoke optimistically at first, but he did all the right things. Keeping hospitals from being overwhelmed.removing obstacles for researching vaccines, therapies. Increasing production of ventilators, testing.",0
1290675629403380000,Supporting your employees' mental health is important now more than ever. Here are some things that you can do as an employer: https://youtu.be/OEh8Y6eihow #mentalhealth #humanresources #workplacementalhealth #COVID,1
1290674435071010000,Anyone else notice this UK Govt messaging pivot from the Infectious Disease to the #coronavirus catch all term? ⠀⠀⠀⠀⠀⠀⠀⠀⠀ I thought the issue was the virulent virus SARS-CoV2 that caused the infectious disease called COVID-19? Read more in thread ,1
1290677264414390000," COVID-19 Planning - the second wave Many medical experts are predicting a second wave of the COVID-19 Pandemic. Although we do not want to try to predict the future, we examine a few possibilities and suggest some planning ideas on our blog: https://src-time.co.uk/covid-19-planning-the-second-wave/",1
1290675942755560000,"#RT @IncedoInc: In the backdrop of COVID-19, Pharma companies are facing various challenges. Learn how Incedo’s AI-powered COVID Control room can help assess and predict the impact of Covid-19. Read more@https://bit.ly/2PpyKLy #infographics #AI #COVI…",1
1290674726944240000,"It’s not REALLY an experiment, @joshmich. We know what the results are going to be — exponential increase in COVID cases and more deaths. It’s not like there’s an unknown result except for people too stupid to face reality: Schools opening significantly increase COVID cases.",1
1290649314189080000,"Match the serious cases of N Corona with each ones vitamin D levels. A biochemical causality exists, let's see if it is displayed in real time",0
1290674384907010000,Knowledge differs from wisdom (application of facts). There is nothing wise about this snippet in time. #COVID is a serious #publichealth concern. Please use wisdom when deciding about #SchoolReopening. ,1
1290664694450210000,"If they make a corona virus vaccine, would you get it?",0
1290675880512170000,Can someone help me with a pool? I’m seriously wondering about the correlation between having had the flu vaccine regularly every year and having being infected with COVID-19. I’d like to know if all infected got the flu vaccine and people that didn’t get infected didn’t have it.,0
1290675931108040000,"I’m wondering if flu vaccine was a step ahead to infect people with COVID-19. My English isn’t that good to make this pool look professional, that’s why I really need help! Who’d be able to? Thank you!",0
1290675784462600000,"Question, (I have no medical background), but why tout a malarial drug to kill a virus. Malaria is caused by an infected mosquito. COVID is a respiratory illness, am I missing something. Not trying to be a smart girl, truly want 2 know, so I can understand 45 &amp; his supporters.",0
1290677006095580000,Fair question. Another question: Is there a high inventory of the drug in stock (inventory = profit) and is the administration's desires to push it associated with profits that could be obtained from any potential sales (despite it not being effective for COVID).,0
1290675928318830000,$TLSA announces they have began clinical trials for Covid-19 vaccine Human trials to start first quarter of 2021. Using inhalation technology instead of traditional intravenous administration. If this works stock will go bonkers #stocks #stockmarket #RobinhoodTraders,0
1290676719217590000,"...than the west, even if the costs in mortality are lower. Rich countries are going to buy these vaccines first and basically remove COVID from their countries, while the disease becomes endemic in the Global South. The WHO has already said as much.",0
1290647050980390000,"It is also used by number of doctors to treat corona viruses, and there is data that proves it works stop cos I can see you want politician to approve so that you can approve it.",0
1290675897339690000,"As the reopening of #schools and #daycares during the pandemic continues to be a hotly debated subject, new research shows that #children are not as resilient to #COVID-19 as many previously believed. https://www.healthline.com/health-news/new-research-finds-kids-just-as-likely-as-adults-to-spread-covid-19 #happiestbaby #happiesttoddler #parenting #health",1
1290658888623290000,"Come on dude, we are famous for exporting cheap software testers to USA on h-1b who do horrible job and result in the failure and closure of the companies (like boeing) they work for. So we have an aversion to testing, be it software or corona !!! :)",1
1290675111637500000,"The recent COVID-19 (Coronavirus) pandemic magnified the need for remote interpretation services in the wake of social distancing, overcrowded hospitals, and the spread of the virus. Learn why: ",0
1290637594590680000,Provide a platform 4 the community to come togethr and discuss what is Corona Virus; Analyse the causes and solutions (Preventives Measures Communicate wit decision makers to share plannd action n obtain their endorsemnt; dailyBuild their capacity on what WHO/NCDC says on COVID19,1
1290676890319980000,"It's possible to obtain grant funding and also claim R&D tax relief, but certain grants can significantly impact the level of R&D tax relief available. Especially relevant now, with the various Covid-19 support packages. #GrantFunding #R&amp;DTaxRelief",0
