,id,tweet,label,screen_name,description,url,friend_count,follower_count,created,uid,location,verified,fav_count,tweet_count
113,1290673900762800128,"Can’t the gift infrastructure take the load if all Pvt hospitals aren’t allowed to treat Covid ? TIMS is barely working. Compliance doesn’t mean retracting the services, compliance can be enforced in other ways. OR if that’s not possible nationalise then temporarily. ",0,mahiitha24,A Policy enthusiast who attended law school |Mountains over beaches| Centrist |Individual freedom | Patriot not Nationalist | #LinguisticEquality,,477,883,2012-04-14 04:54:05,553338033,,False,53338,23581
114,1290677646423207937,"Dr. Chuck Henry, ’94, teaches chemistry along with chemical & biological engineering at Colorado State University. He & his colleagues have been working on a simple virus-detection device. Read about how his research is impacting COVID testing. Full story: https://bit.ly/3gcOBZD",0,MSSUAlumFriends,"The Alumni Association serves to connect the university's 30,000 alumni and constituents living across the world.",http://t.co/TpnlmU403m,70,712,2011-01-28 18:01:31,244179520,Ralph L. Gray Alumni Center,False,71,3551
115,1290674670455402498,So you know their motivations? And you can confidently say that this is because they wanted the cash rather than (a) they were afraid of COVID; or (b) they had children who were at home? And you think this anecdotal evidence can be extrapolated to millions around the country?,0,andrewholly2016,"Trial attorney, never Trump, currently preparing my onlyfans page so at least you've got that to look forward to",,304,55,2017-06-01 14:59:11,870293653524230145,"Minneapolis, MN",False,7817,4906
116,1290674399322898434,"Meanwhile, how serious is the action? Stopping from treating #Covid_19 patients is one aspect.Will hospitals be made to return the money that has been fleeced from patients?Will there be a permanent action like cancelling the license- irrespective of disease/ treatment.",0,revathitweets,"Journalist On Bail. Founder&Former CEO Mojo TV. Past- DC, TV9, CNNIBN, Radio Mirchi, Red FM. ప్రశ్నిద్దాం, పోరాడదాం!",,359,13905,2009-06-04 08:06:09,44572144,"Hyderabad, India",False,3718,12051
117,1290675811721216001,The anxiety and unknowns of sending your kid to college have reached new levels with COVID. We’ve outlined the safety and financial questions you’ll need to consider as fall approaches. #COVIDConsiderations,0,Jack_Hutson_,Please view guidelines and disclaimers governing this page:  https://t.co/X673ZerzSa,https://t.co/klcQwnOTlp,9,5,2009-04-17 19:31:49,32534868,"North Charleston, SC",False,1,49
118,1290677664546787328,"Learning in a Crisis: Culture and COVID-19 Organizational learning is not complicated. However, it does require leaders and teams to quickly translate what is happening around them into insights and actions. http://ow.ly/LMSh50AJrjr",1,Houston_Dynamic,"Houston Dynamic Service is a #turbine #repairshop for #refining, #powergen & #offshore drilling industries.
@HoustonDynamic is not active. Follow this account.",https://t.co/cc2GyW3Bog,83,99,2016-12-19 23:05:51,810984519385780224,"Houston, TX",False,0,1346
119,1290668693370933250,"Man I can’t eat barely I’ve had one solid meal in the last 3-4 days, I can’t fuckin walk and I can’t go to a doctor right now cause I’m tryna save money and I don’t wanna catch corona and the best part is the one stress reliever I have is skating which I can’t do now ",1,nothuntermorgan,nobody cares work harder,,132,59,2020-01-08 02:43:44,1214739374841221120,,False,2106,1179
120,1290645446097096709,"Bill Gates and his boys have just upgraded Corona and are thinking of releasing it again for a more Robust attack in November December months. After that they will force you to have a vaccine, to inject their micro chip in you, so they control humanity, sources claim. ",0,KhanWasim4444,,,476,474,2012-05-16 22:08:25,582209668,1#ALLAH 1#ISLAM 1#QURAN 1ALEEF,False,60352,41044
121,1290677159992995842,We thank @SafeGraph for making the Foot traffic data available. Our paper uses the @SafeGraph data and the first study to quantitatively show that counties which had implemented policies and effectively increased social distancing have seen slowing of the spread of COVID-19.,0,TannistaBanerje,Peace.,https://t.co/9HEY0pFJcI,15,2,2013-06-21 23:23:54,1537536146,"Georgia, USA",False,0,3
122,1290675138271293442,Complementary therapies can help with many issues including post covid symptoms. Here we learn how Craniosacral therapy has done just that... https://healthylifeessex.co.uk/2020/07/craniosacral-therapy-for-post-covid-symptoms/ #craniosacraltherapy #complementarytherapy #postcovid,1,healthylifeSX,"Healthy Life provides a wealth of information for anyone interested in maintaining a happier, healthier lifestyle. A complete mind, body and soul workout!",https://t.co/UbCItDaCtl,1234,943,2017-04-05 21:37:45,849737849025036288,"Southend-on-Sea, East",False,250,4358
123,1290676956212666369,"According to The #Times, a sample of the virus that killed six in 2012 was housed at the #Wuhan Institute of #Virology and was described in a scientific paper cowritten by Shi that states it is a 96.2% match to the COVID-19 virus.36 The virus, called RaTG13, says The Times.",0,Sciclo1,"Baron von Junker (Joh) @sciclo Blockchain, Crypto-millionaire. (Philanthropist) Content Producer english/dutch *publicaties onder voorbehoud, legal @Twitter US",https://t.co/clL3qOwq6m,285,170,2017-11-28 17:14:33,935557538157821957,"Amsterdam, Netherlands ",False,2977,18809
124,1290675627226353664,"Marijuana HAS been proven as a successful medical treatment for many things she doesn't say it's proven success against COVID...Your dumbass boss told us to inject bleach, so maybe sit this 1 out #MoscowMitch Regardless, I'll take funding for pot over billions more for Jets",1,affiliatecurve,"i don't want to hear about Republican or Democrat...the problem is Money In Politics, plain & simple",https://t.co/Wck4B2E0NF,705,534,2009-02-17 08:03:10,21072573,Seattle,False,17917,3824
125,1290676931810209805,"Literally none of that is true, you’re just being told these things by fake news. Only elderly people and people with severe health problems are actually suffering from covid. Stop letting the media brainwash you.",0,Dan48899911,Just a simple guy,,13,7,2020-03-18 12:20:29,1240251636188151808,,False,1938,200
126,1290672616370343937,"How will this people get identify, they have corona positive? By preferring home isolation, will people get recover from COVID-19 without any treatment provided?",0,Middle_wings,"I'm seeing some people are taking advantage in the name of SSR's justice for getting followers, likes and retweets on social media, why?
it's not HUMANITY",,184,35,2019-12-13 04:09:10,1205338471780368384,why do you want my location? ,False,732,2243
127,1290677301982695426,"Aintibiotic resistance grows more concerning, and the market for these drugs has been plummeting. This threat to infrastructure has become more omnious during COVID, but there are soultions at work. ",1,HeidiAndrew22,"Marketing executive, advocate for truth and science, liberal politics. Raising 3 nutty kids and 2 fierce cats.",,1027,70,2017-01-26 03:32:22,824459940064587776,"Hastings-on-Hudson, NY",False,2672,1004
128,1290676990996094977,".@AdlibSolutions MD, Andy Dockerty has shared an open letter on social media, outlining the dire situation within the live events industry as a result of the Covid-19 pandemic. Read it here: https://www.tpimagazine.com/invisible-and-undervalued-adlib-md-andy-dockertys-open-letter-to-the-industry/ #WeMakeEvents #LetTheMusicPlay #LightItInRed",1,MartinAudioLtd,Signature sound with class leading coverage and consistency to #UniteYourAudience.,https://t.co/2slpwoogix,2160,14580,2011-05-05 19:28:00,293673234,"London, UK",False,7110,13639
129,1290675836505464835,Both the emergency responses to Covid-19 and the construction of a ‘new normal’ in the criminal justice system should reflect the detailed and continuing input of people with lived experience. - Recommendation from the RR3 Covid-19 special interest group: https://www.clinks.org/community/blog-posts/what-does-recovery-look,0,Clinks_Tweets,Supporting the voluntary sector working in the criminal justice system.,http://t.co/LJBtNMwPHs,3056,15731,2010-08-10 08:06:12,176726705,"London, England",False,3487,15130
130,1290661864595238913,"1/Countries that test less usually test only those who have serious symptoms. Hence the CFR (the ratio of Corona deaths by confirmed cases) will be unrealistically high. The more you test, the more mild/asymptomatic cases you will find&amp;the CFR will converge to its real value",0,hoori_rafieian,,,275,90,2014-12-29 06:08:06,2948575875,,False,2643,389
131,1290666769930223616,"Is he still using the “if you tagged a cop for 10 mins he’d commit 3 felonies” logic with corona ? “The more people you test of course you’re going to find more positive cases” babes corona isn’t weed very prissy ppl love a smoke but aren’t secretly harvesting cornona, my god!",1,BrianW189,26 🥴 Gay as a Goose 🦆 Trying 🔊suffers from debilitating eurotophobia 👁‍🗨real housewives fanatic/aficionado 🍿 outlier 🤖 ADHD 🗣,https://t.co/AXqedXMLkw,3132,790,2009-08-23 09:59:29,68115523,Glasgow,False,48471,40112
132,1290675821162659841,"The US sent Brazil millions of hydroxychloroquine doses. Months later, they're still in storage https://www.cnn.com/2020/08/04/americas/brazil-us-hydroxychloroquine-doses-intl/index.html! It might be Bolsonaro who tested positive tried it and found not effective in treatment of COVID-19",1,ChandramoulyN,"A post-graduate in Commerce,Business administration and law graduate ! Interested in Reading,writing,music movies and current affairs-National,International",,896,218,2020-06-10 06:22:04,1270601906918838273,,False,2004,1175
133,1290674753603137536,"When there is already significant debate and pushback of the legitimacy of certain Covid prevention methods and their effectiveness, Woke organisations like @NPR do no favours, when they come up with bullshit analogies that are on the face of it beyond stupid.",0,DeejayBaj,"Lawyer, Man United Fanatic [Still Bobbins], Cameron Crazie [Go Blue Devils], Console Gamer, Trying to find answers to questions that no one asks!",https://t.co/RDa3jQTbFk,810,255,2009-07-05 19:27:30,53982766,"New Delhi, India",False,11953,22614
134,1290677665586978816,"A wave of illness involving children and teens is starting to raise some concern. The illness, which doctors are calling pediatric multisystem inflammatory syndrome (MIS-C), is believed to be linked to COVID-19, but there is much that is still unknown. https://cle.clinic/3f9b9Jw",1,CleClinicCanada,"Cleveland Clinic Canada has 2 locations- downtown and midtown Toronto. We specialize in preventing disease, treating injuries/issues and improving health.",https://t.co/fZ0w1tDwXL,822,2431,2014-03-07 15:48:26,2377307239,"Toronto, ON",False,328,5508
135,1290661177886900228,I don’t trust Dr Fauci Dr Brixt ! I wonder if Dr Fauci Dr Brixt and democrats are taking HCQ and can they be tested to see if they are using this drug . Dr Fauci has known for 15 years it works to stop Corona virus.,1,winterchill2002,,,165,60,2012-03-09 02:30:16,519102574,United States,False,3668,213
136,1290674615740702724,"None was anticipating vaccine sooner & none is even now. But a 10 second Covid testing machine (biggest invention) back then, could've altered the situation. At home testing kit, wow! And the Inventor would've become an icon all over world! Before cure, of course, if any! ",1,jpchat9,"The Poet/The Blogger/The Critical Insider/ Self-Publisher; 
© (Micro blogs aka Tweets) 
Blogs: https://t.co/sgySAiRh4S 🤔  /  E-Books 👇",https://t.co/02ORKWu1Qi,14,20,2016-07-08 15:23:06,751436453570281472,Original Indian,False,33,849
137,1290661631719022594,"Corona Cultists build their arguments on the assumption that coronavirus is dangerous to healthy people. They’re wrong. We know for a fact that coronavirus is about as dangerous as the flu, that the lockdown is useless.",0,GShoreo,Hunter,,37,2,2020-07-29 15:53:03,1288502653626904576,,False,237,121
138,1290674998663815168,"Delhi Model - in June end, make a false projection of 5 lakh cases till July end, then claiming so called success of containing Corona. Nobody is in the world is talking about winning over Corona. Sane people are talking how to manage the patients and disease &amp; developing vaccine",1,LalitSehgalDr,"Head, General &Liver Transplant Anaesthesia & Liver Critical Care, Manipal Hospital, Dwarka, New Delhi",,64,118,2016-09-01 01:13:58,771154093360447488,"New Delhi, India",False,49,86
139,1290645516661948420,"@a_sabo12 @macfound @ICTAdvocates in the collaboration CBOs may get new information updates on th COVID 19, capacity building on new skills that will help their community work in the corona virus period &amp; post covid 19 eg using Vitual meetings with stakeholders on combatting C 19 ",1,isyaku12,,http://t.co/jcKkSbDOHQ,370,716,2013-03-11 08:31:17,1258918368,Kano,False,18,2427
140,1290675572599742466,"something my nerd brain is struggling with: various gov’t bodies are relying on data that ‘says young children are unlikely to transmit COVID to their parents’ in these same areas, how long has this same age group been confined to their home, exposed only to family members?",1,purpledcake,"she/her | engineer in energy | möther of voids | powerlifter | talk a lot about mental health and brain injury recovery | an adult, allegedly",,1177,1565,2010-12-30 22:14:16,232343408,"Calgary, Alberta",False,37617,28554
141,1290675088912789504,"Just not true. ""COVID-19 may also be spread by people who are not showing symptoms (i.e., “asymptomatic”). According to the CDC, 35% of all people with COVID-19 are asymptomatic. However, those individuals are still as infectious as people with symptoms."" https://health.ucdavis.edu/coronavirus/resources/covid-19-faqs-for-health-professionals.html",1,RolandB3,Attorney & E-discovery consultant. Democrat. UH fanatic & Cougar Pride supporter. Son of an artist & a waitress. #HandMarkedPaperBallots,,1066,1069,2009-02-06 22:28:43,20278402,In front of you & to the Left,False,30168,171572
142,1290674124591902720,"Few good options. COVID running wild will overrun health systems/non-starter. Need treatment/vaccine, real eradication (very draconian rules requried), or current situation long-term, i.e. slow-simmer of cases with lockdown/reopen waves and no more large gatherings.",0,covid_reality,,,0,0,2020-05-20 12:36:20,1263086115323592705,,False,2,165
143,1290672045093785601,Coronavirus: Can Corona Vaccine Have Side Effects? know the answers to such important questions ,0,StyleUpNow2017,"https://t.co/DmOsXMg921 is a positive online site latest in beauty, fashion,l lifestyle, female empowerment, culture, relationships, friendship, careers, etc ...",https://t.co/9BlIz85c1z,4945,2615,2017-05-20 10:58:30,865884431076044801,,False,11511,56218
144,1290676386739286017,Securing IoT as a Remote Workforce Strategy: Digital transformation with Internet of Things devices offers organizations a way forward in the era of COVID-19. Optimizing this approach for the future will need to start with security. http://dlvr.it/Rczpjx,0,TLerone79,,,163,19,2012-04-16 12:06:43,555072635,,False,589,7506
145,1290677491468603393,"Fauci has been killing science for Big Pharma and his own profit since 1984. Plus, new research shows Covid-19 RNA camouflages itself as human RNA which increases likelihood of autoimmune disorders from any Covid-19 vaccine: ",1,ToplessVegas,"Complete guide to Las Vegas topless and nude strip clubs, topless pools, topless shows, burlesque; reviews, tips, articles, deals, news, pictures, video",https://t.co/XemN8tfmae,1165,5294,2009-04-21 18:29:36,33991528,Las Vegas,False,19774,20299
146,1290672688265076736,If my baby is referred to a ‘corona baby’ or is sad to be a ‘product of quarantine’ by people who won’t even be lucky enough to see pictures of her let alone meet her I will straight up punch an old hag. You don’t take the time to be in my or Jts lives what makes you think you’ll,0,ShelbyDaltonn,"{smart. kind. important.} it's not what you take when you leave this world behind you, it's what you leave behind you when you go. 🎶 11/02/2019",,549,377,2013-04-03 23:36:44,1325661948,"helldorado springs, misery",False,23573,19780
147,1290674602780192768,"With the inevitable rise in cases that will occur, how will the UCP ensure that doctors will be available to help covid cases in rural areas where doctors were forced to leave?",0,__Jonsie__,"Just trying to keep up. ❤️🌇 Support your local journalists, healthcare providers, and educators.",,68,20,2018-09-24 15:28:31,1044247211075239936,"Edmonton, Alberta",False,1966,427
148,1290676835945189377,"Because you can contract COVID while taking every single precaution, it stands to reason that you should engage in high risk activity. (This line of reasoning only tracks for people who are devoid of critical thinking ability)",0,simplysope,Omo Osun 🦚 . Anime. HP. Yoruba. A Science Bitch 🧪. Aslan's very own. ✨ 1/3 Host of @OutlawBarzPod. don’t approach me empty handed & pls leave while you can.,https://t.co/L4BFmg6gqo,499,4794,2010-08-15 16:40:20,178762871,Ravenclaw Commons,False,2887,134934
149,1290675174883430402,"Our one ray of hope, that the COVID-19 vaccine doing well in the trial phases thus far, is probably going to be snuffed now that it's looking like Trump will push to release it prematurely. Guaranteeing medical mishaps and giving fuel to the Anti-vaxxers. We just can't get a win",0,ApocalypsCowboy,"It is only by looking in the mouth of the devil that we can examine his teeth. - Roger Ebert / 
(Comic artist, sci-fi enthusiast, He/him)",https://t.co/dFXP7uaKG2,696,303,2015-09-06 04:22:01,3466713613,,False,131252,14335
150,1290640503822843907,"With the corona era, it may be possible to shift human resources engaged in entertainment, sports, and customer service to the digital space. We present the possibilities. Please commit. Questions are accepted only on this matter ",0,kanali__,Nostromo/DEBUG ROOM/役者/サウンドデザイナー/グラフィックデザイナー/xRモデル/イメージを形にすることお芝居殺陣が好き◆2020.03 idea/02 ロミオとジュリエット/靖國神社奉納演武◆https://t.co/GZVtY8HA4B,https://t.co/64MdwD63uW,155,281,2019-08-28 09:38:05,1166646046853758976,,False,3751,805
151,1290648250303774722,This is bullshit since the original research is about Sars 1 corona viruses and coivid 19 is a Sars 2 virus. So good luck taking all this hcq looking smart with this research you think support your point but doesnt,1,nappekIapper,"Soms reageer ik op dingen, maar meestal niet.",,319,61,2013-09-22 14:40:30,1893937596,"Amsterdam, The Netherlands",False,2026,1913
152,1290675112186974209,Contact Tracing: Many health departments losing race to warn contacts of #COVID victims The soaring number of COVID-19 cases in the US has far outstripped many local health departments’ ability to trace the contacts of those infected https://buff.ly/30rrvZN - Reuters,1,jmsexton_,"Democrat. Veteran. Retired Professor. Non-religious
#BlackLivesMatter #Resist #VoteBlue #Biden2020   🆘 🌊  
🚫 DMs",,50262,54185,2016-05-01 20:36:07,726872852968931328,,False,35477,81203
153,1290675181141336065,ICYMI: Our Policy & Research Officer Chloe Minish has written about the steps the justice system can take as COVID-19 lockdown measures ease and examines some of the changes needed to better support people affected by crime in the long term ,0,VSScotland,"Voluntary organisation providing emotional support, practical help & essential info to victims, witnesses and others affected by crime.",https://t.co/uRpLpd0gHf,1159,2463,2015-05-14 13:25:07,3253808535,Scotland,False,979,3966
154,1290674736532459522,"It’s a balancing act. If all women are allowed back; the chances of covid spreading are high. I do think in certain cases, exceptions should be made but one also needs to weigh various risks. I think they are trying to do that.",0,nidkirm,Feminist sociologist working on gender & urban marginality in South Asia. Tweet about politics/academia mostly. Preferred pronouns: she/her.,https://t.co/Q5iB4mm29u,2496,58710,2009-06-16 15:54:29,47658104,"Karachi, Pakistan",False,86782,24603
155,1290674692085493760,"It’s because if you get COVID you could actually not be living, meaning you’ll die. And even if I wouldn’t die I don’t want to spread it to people who could but you don’t have a heart so I don’t expect you to understand.",0,delicatenoah,hitting these trump supporters with facts and memes 😎🤠,,362,142,2018-07-23 03:56:47,1021242698634858496,,False,604,1034
156,1290676635247804416,CA will soon become the 2nd state to collect sexual orientation and gender identity data for new COVID-19 cases to track how the disease is affecting the LGBT community. We need to understand these disparities and apply this data-driven approach nationwide ,0,AccountableFor,Activists and donors dedicated to fighting for full equality and to educating the public about the concerted efforts of anti-LGBT extremists. #LGBT #Equality,https://t.co/a1aFhCtnot,61,26,2019-08-28 19:23:57,1166793439163428864,,False,1,235
157,1290676083424145410,"Least testing played big role, second role is of those cases who didnt report bcz of fear of govt treatment with Covid, third role is of irregular data etc etc...why Trump is under the belt of critics ,bcz US testing alot and patients are increasing...",1,Adnan_Akhter_,"Researcher/Financial Analyst      ■■■■■■■■



If you have any problems at all, don't hesitate to shut up.",,241,339,2013-03-25 10:49:42,1298864238,Islamabad,False,15462,3214
158,1290677145027506177,"The only case chart I produce is the heatmap: https://twitter.com/zorinaq/status/1290029180466298880 FDOH line list date actually has, for every case: - date of onset of symptoms (EventDate) - date the case was counted on the state's COVID-19 dashboard (ChartDate) - date the person was confirmed (Case1)",0,zorinaq,"Independent researcher. Multidisciplinary angel investor. Funded 8 companies.

Energy, InfoSec, biotech, cryptocurrency/Bitcoin, IoT...",https://t.co/2kX7ueCwgh,544,4707,2011-02-04 06:22:51,247161834,,False,2035,7497
159,1290666613738557443,"Daniel, I asked a question three times by now on twitter but got no reaction at all. Hereby again: would it be possible to make a function so you can actually talk to your opponent? That would be a good corona-option, don’t you think?",0,KeesBerghuis,Hoofd Voorlichting Tweede Kamerfractie VVD.,,498,5597,2009-01-20 11:53:54,19232593,Den Haag,False,1697,3430
160,1290675230877216768,"Individuals with COVID-19 can spread it before showing symptoms. Some don't even show symptoms at all and still spread it. That ""When to use mask"" tweet from @WHO must be severely outdated. Information now is saying to always wear one in the public",0,IsAMoofan,"Made this for my stream and shit. Small time content creator on YouTube, hopefully not so small later on 👏",https://t.co/TvHeQJYXwZ,17,10,2020-03-28 02:39:38,1243729372709679105,,False,89,91
161,1290648983178797056,someone explain to me why some people believe that doctors shouldn’t voice their opinions on abortion & gun control but politicians are allowed to give their opinions on the corona virus?,1,imamberz,single mother to a hamster named Lily - ig:imamberz - she/her,https://t.co/fq2b3vbCtt,445,1007,2015-12-09 20:37:12,4430311420,,False,76057,144491
162,1290673671497908224,"Despite seeing a decrease in cases, contact tracers are still struggling to keep up with new cases. And our outbreak #s and case per capita rate are still too high. Some officials feel now is the time to develop an app that can tell you if you've been exposed to COVID-19. ",1,LAWinkley,Watchdog reporter @sdut. Send tips to lyndsay.winkley@sduniontribune.com. Military wife / girl mom / DM for a Dungeons & Dragons crew,https://t.co/qxLk932mjl,776,2536,2012-07-19 19:19:38,705626528,"San Diego, CA",True,2572,4781
163,1290669641921179649,"A drug that is used worldwide and has been deemed safe for over 60 years, used specifically for a corona type virus in 2005 successfully BY fauci. I choose to live. If you want a vaccine that has no trials and no safety tests, be my guest.",0,Cindy73312095,"move along, no bs here",,39,9,2020-05-22 11:02:45,1263787327299731456,,False,469,345
164,1290673751345049603,"they’re probably emphasizing that it’s a lot better than it is. the mortality rate is supposed to be ~2%, so if it’s say, 1.7, while other counties have 2.3, they’re trying to say “it doesn’t matter if ppl get covid bc more of them survive here!”",0,clicheanna,"everytime i see your face, there's only so much i can take // UNC'22",https://t.co/XlJCjyYB1m,243,113,2013-10-29 21:26:29,2163566473,"Raleigh, NC",False,22503,1813
165,1290675220580315137,"State attorneys general: Use federal law to lower cost, increase supply of COVID-19 drug remdesivir https://www.usatoday.com/story/news/health/2020/08/04/bipartisan-coalition-attorneys-general-today-asked-u-s-department-health-and-human-services-invoke-f/5580087002/ via @usatoday",1,kalltucker,"Health reporter @usatoday, formerly @azcentral. Father of two girls, bassist, SF Bay Area native. Contact: alltuck@usatoday.com, 703-854-5402",https://t.co/iJnt4doh6o,800,2336,2009-07-09 04:00:44,55135810,Northern Virginia,False,453,2790
