,id,tweet,label,screen_name,description,url,friend_count,follower_count,created,uid,location,verified,fav_count,tweet_count
55,1290673811944173573,"$DECN disruptive technology their test is going to be huge,it has applications to far more than covid",1,Dorian93880855,,,52,37,2020-03-16 04:18:25,1239405504842969088,,False,979,1142
56,1290675289673146368,"A5(4) Education is a fundamental right and the bedrock of equal societies, no child should be denied the opportunity to learn. Education systems should put strong focus on equity and inclusion to ensure no child is left behind especially in the COVID-19 context #EducationTuesday",1,WonganiN,"Education Advisor, right to education, education in emergencies.",,335,365,2011-06-23 08:57:32,322510184,New York,False,116,1343
57,1290677551313096711,Jared his immediate response was to close the boarders but he was called a racist. He found a drug Hydroxychloroquine that was very effective in reversing COVID symptoms but because it was effective they discontinued use! Even banned it in some states!,1,jane_mink,"Mom, wife, sister, daughter, friend. I have been supportive of EVERY POTUS we have had. United we stand, divided we fall. 🇺🇸",,30,15,2019-04-26 16:54:07,1121819756582068224,"Massachusetts, USA",False,278,764
58,1290665273603825664,Actions like these are part of the reason why pandemic like the Corona virus is ravaging the world. We have become inhuman in our treatment of fellow human for whatever reason. May GOD have mercy on all of us for denigrating what is more sacred a human life!,1,toshguerrier,,,180,36,2009-06-25 05:21:02,50559509,"Cincinnati, OH",False,31,422
59,1290677333016354816,"They were real! Science has proven that children's imaginations were the sole source of force fields in the world, keeping most of the virus pop. lower, which is why covid is here because we don't have enough magic of innocence detoxifying things anymore and hey r we out of pot?",1,DeviousToaster,"I ingest dolphins & make European candle scents.

But for REAL, twitch gamer & joke maker! Any business inquiries, contact me: devioustoastergamer@gmail.com",https://t.co/ZPDFbWWBF8,162,241,2014-02-21 17:37:58,2355123380,United States,False,12776,5166
60,1290642506523213825,"As conspiracy theories continue to rise in spiritual communities, I want to let anyone who needs to hear this know that I don't agree with this idea. Not all tarot readers or occultists are on this 5G / 5D / Corona-hoax bandwagon and I'm one of them.",0,LizWorthTarot,Tarot reader. Astrologer. Author. Aries. Weightlifter. Coffee drinker. More wolf than woman. Seize the future. Book a reading with me at https://t.co/Q38g2e24r8,http://t.co/SJdWRP5ehx,1594,3319,2010-04-07 16:57:02,130557377,Toronto,False,2176,15015
61,1290671268644245504,"Yeah I feel like that’s the same sitch as me!! It hasn’t bothered me in years but I’ve been riding my bike (both outdoor and peloton) a lot since corona and it KILLS me after I get off. If it’s an option for you to try acupuncture, I recommend giving it a go at least once",1,miniwheatzmer,don’t forget to floss your teeth,https://t.co/rx7qjByvZ4,259,550,2009-09-01 23:12:30,70815630,,False,108432,32349
62,1290675847062528000,"Corona was spread all over the world months before this. It has been determined that it was spread across the world in Nov - Dec 2019. A study of genetic mutations within the virus proves this. If you think that this was the source, you're delusional.",0,nickpotgieter,"""ᴡᴇ ɴᴇᴇᴅ ᴛᴏ ᴄʀᴇᴀᴛᴇ ᴀ ɴᴇᴡ ʙʀᴇᴇᴅ ᴏꜰ ꜱᴏᴜᴛʜ ᴀꜰʀɪᴄᴀɴꜱ ᴡʜᴏ ʟᴏᴠᴇ ᴛʜᴇɪʀ  ᴄᴏᴜɴᴛʀʏ ᴀɴᴅ ʟᴏᴠᴇ ᴇᴠᴇʀʏʙᴏᴅʏ, ɪʀʀᴇꜱᴘᴇᴄᴛɪᴠᴇ ᴏꜰ ᴛʜᴇɪʀ ᴄᴏʟᴏᴜʀ."" - ᴄʜʀɪꜱ ʜᴀɴɪ",,2096,993,2011-10-26 10:38:11,398643548, 🆂🅾🆄🆃🅷 🅰🅵🆁🅸🅲🅰,False,6610,11678
63,1290674686339231744,I honestly don’t understand that poverty statistics. How does poverty raise the likelihood of someone CONTRACTING covid. I can understand if they are more likely to not receive the treatment or have the resources to be treated but how is covid saying “I chose you cuz you’re poor”,0,Karakaizen,"ɪ ᴋɴᴏᴡ ɪᴍ ʙᴇᴀᴜᴛɪғᴜᴋ ᴀɴᴅ ʜᴀɴᴅsᴏᴍᴇ sʜᴇ/ʜᴇʀ ʙʟᴀᴄᴋ,ᴀʀᴛɪsᴛ,ᴘʀᴏᴅᴜᴄᴇʀ,ᴇɴɢɪɴᴇᴇʀ,ɢғx ᴅᴇsɪɢɴᴇʀ.",https://t.co/GiCPqrS9ya,787,461,2018-01-02 16:35:57,948231397407449089,South Florida,False,4526,1663
64,1290655657042092037,"Keep up the good work! Tell the mainstream media the democrats to stop politicizing this Wu Han Chinese Corona virus! Hydroxychloroquine saves lifes, safe, and cheap 896,000 M .",0,Efrain92700988,,,4,0,2020-07-13 15:11:32,1282694087922024450,,False,15,14
65,1290674771831775232,Speaker Pelosi is still holding up this entire package over bizarre unrelated things like carveouts for the marijuana industry. She even claimed to the press that pot is a proven COVID-19 therapy! I hope she’s shared this breakthrough with Dr. Fauci. Can we get serious yet? ,0,senatemajldr,"U.S. Senate Majority Leader Mitch McConnell
Follow @McConnellPress & @SRCC",https://t.co/J5RQpHiTgo,105,1743916,2013-03-07 20:21:15,1249982359,"Washington, DC",True,136,4293
66,1290676563806162945,55% of Covid-19 hosp admissions show increased rate of psychiatric disorders. &amp; thats not taking into account the huge psychological impact Covid has had on general population. The mental health pandemic is yet to peak! ,0,Jenny_Collard,Director @RHCPupdates | UKCP Registered Psychotherapist | Clinical Supervisor | DBT Practitioner. Being a Therapist is the greatest honour 💚,https://t.co/qEBQtK7NYb,778,743,2014-08-22 14:56:25,2755242998,Leicester,False,2419,1592
67,1290675488491536384,It’s certainly an improvement compared to the last few months. Few more weeks I reckon before I can stop taking them. GP has been on the ball and v helpful with tests/diagnosis/treatments as know not all GP are aware of long covid,0,sarkpowell,Deaf Clinical psychologist working for SignHealth. All views are my own,,758,983,2011-08-26 19:22:32,362655258,,False,10539,4820
68,1290642089232027650,"Mam,second para is the truth, there won't b one time vaccine, few vaccines r already available like Pneumococcal nd others, this is all market Gimmick. Only Self Hygiene and Social Distancing can avoid Corona. ",1,arvindtweet4,"Be Humane nd protect nature🌴🌏,
RashtraBhakti Sarvopari,

RT's r not endorsement.",,611,126,2017-08-04 07:20:29,893371041665384448,"Kanpur, India",False,16231,6720
69,1290645647050387456,The gap between the reality and perception around Covid risks – almost a factor of 100 – shows how state-sanctioned “fake news” – Project Fear – has come to dominate the public imagination and is negatively impacting how we manage the crisis. #covid_19 #corona #كورونا #لبنان,1,TUOJOSS,"We don’t have news anymore, We have Psyops. Phoney events designed to sway opinion. Anti Feminist - Love Feminity.",,142,36,2019-02-25 13:34:00,1100026124485173248,,False,1158,1533
70,1290676910868103168,The impact of #COVID19 on nutrition in developing contexts is long-term and extremely detrimental. Refugees in particular are at an increased risk of both malnutrition and contracting COVID-19 due to overcrowding and limited access to health care. ,0,GOAL_Global,Humanitarian aid agency ensuring the poor & vulnerable in our world gain access to the fundamental rights of life. Registered Charity No. 20010980,https://t.co/rMiRCEr893,2869,9085,2010-01-15 11:20:53,105107549,Dublin,True,7971,11503
71,1290665978091708418,"With so many VVIPs being infected by Corona virus the question that comes to mind is whether these people flouted norms of social distancing, wearing masks etc. or these preventive measures being prescribed are humbugs. Let our PM clarify @PMOIndia",0,Umakant66466858,Engineer,,55,4,2018-10-06 13:33:36,1048566947061755904,"Bhubaneshwar, India",False,395,682
72,1290674103872114690,"I believe we could classify her hypothetical as a red herring. Who in the media would do this? The media is a rather large varied group. The major panic that I have noticed is the HCQ stupidity that you mention. It doesn't work on covid, even if some quack in Houston says so.",1,glenn_deshields,,,1242,351,2012-10-12 01:28:15,874684290,,False,2286,1855
73,1290671189593976838,"Is the lockdwn proper solution get ride frm corona I think no,never. How can any gov help the poor families.All gov provided only meal ,oil,salt etc.But spices,milk, medicine,green vegetables any many more.May I know how can a poor manage all.Perhaps he can't for he hasn't money",1,tohid9690,,,28,0,2017-01-09 17:58:55,818517420499496960,na,False,268,34
74,1290676362940907520,"SARS-CoV-2 strains show little variability, COVID-19 vaccine could be effective against all, finds study https://go.dsmenders.com/sars-cov-2-strains-show-little-variability-covid-19-vaccine-could-be-effective-against-all-finds-study/",0,GoNewsIndia1,Go with the update.... | Recent Tamil cinema updates and stories...,,30,307,2019-11-25 13:05:36,1198950746558828545,,False,129,62702
75,1290647070416809984,"Corona was never a hoax, no one knew much about it. Trump spoke optimistically at first, but he did all the right things. Keeping hospitals from being overwhelmed.removing obstacles for researching vaccines, therapies. Increasing production of ventilators, testing.",0,DecaniniLeone,,,107,53,2014-01-21 19:57:23,2303631978,,False,2288,1573
76,1290675629403381761,Supporting your employees' mental health is important now more than ever. Here are some things that you can do as an employer: https://youtu.be/OEh8Y6eihow #mentalhealth #humanresources #workplacementalhealth #COVID,1,MikeVeny,Leading mental health speaker & teamwork facilitator whose messages inspire the Diversity & Inclusion of all. 🙂 #YouTube: https://t.co/EqUD2QWjfn.,https://t.co/NiCEQify8a,140,11803,2009-03-02 23:47:25,22554510,New York City,False,2110,27332
77,1290674435071016967,Anyone else notice this UK Govt messaging pivot from the Infectious Disease to the #coronavirus catch all term? ⠀⠀⠀⠀⠀⠀⠀⠀⠀ I thought the issue was the virulent virus SARS-CoV2 that caused the infectious disease called COVID-19? Read more in thread ,1,AdapNation,"💥 Self-Optimisation & Personal Growth. 🏅Creator of the #BeYourBest Journey program. 🎙 🌐 Wellness, Mindset, Muscle & Food Content Hub",https://t.co/sCiZr2i9hv,185,127,2019-10-21 11:05:22,1186236910387318785,"England, United Kingdom",False,999,669
78,1290677264414396416," COVID-19 Planning - the second wave Many medical experts are predicting a second wave of the COVID-19 Pandemic. Although we do not want to try to predict the future, we examine a few possibilities and suggest some planning ideas on our blog: https://src-time.co.uk/covid-19-planning-the-second-wave/",1,SRCTimeUK,"Professional Chartered Accountants & Tax experts 
Audit, Accounts, Corporate Finance, Tax planning, Wealth Management, Payroll, business advisory #Accounts #Tax",https://t.co/2ZqJWRPfb5,317,230,2010-12-15 18:51:50,227034044,"Brighton, England",False,281,1919
79,1290675942755569664,"#RT @IncedoInc: In the backdrop of COVID-19, Pharma companies are facing various challenges. Learn how Incedo’s AI-powered COVID Control room can help assess and predict the impact of Covid-19. Read more@https://bit.ly/2PpyKLy #infographics #AI #COVI…",1,apurvbhatnagar,,,162,44,2009-06-27 11:39:59,51416281,"Hyderabad, India",False,43,3811
80,1290674726944243712,"It’s not REALLY an experiment, @joshmich. We know what the results are going to be — exponential increase in COVID cases and more deaths. It’s not like there’s an unknown result except for people too stupid to face reality: Schools opening significantly increase COVID cases.",1,brianjbellz,"Husband, son, brother, in-law, dog owner, love Detroit and my hometowns. Tweets = all my own and no one else's.",,670,700,2010-02-25 21:14:35,117531984,"Detroit, MI",False,17091,8807
81,1290649314189082624,"Match the serious cases of N Corona with each ones vitamin D levels. A biochemical causality exists, let's see if it is displayed in real time",0,AdessSingh,,,1106,345,2013-12-28 09:43:31,2265675031,,False,482,15848
82,1290674384907014144,Knowledge differs from wisdom (application of facts). There is nothing wise about this snippet in time. #COVID is a serious #publichealth concern. Please use wisdom when deciding about #SchoolReopening. ,1,msvictoriafp,Project Manager. Executive Administrator. Minister (✝️). Future Accredited Angel Investor (💰).,https://t.co/uenVL82XEu,773,258,2012-05-30 23:15:53,594991978,,False,860,2878
83,1290664694450212868,"If they make a corona virus vaccine, would you get it?",0,NICKatnightt,Always taking the next step,,484,483,2011-06-30 19:19:19,326954834,402,False,15517,25874
84,1290675784462606336,"Question, (I have no medical background), but why tout a malarial drug to kill a virus. Malaria is caused by an infected mosquito. COVID is a respiratory illness, am I missing something. Not trying to be a smart girl, truly want 2 know, so I can understand 45 &amp; his supporters.",0,jerrisha10,,,6,0,2020-03-01 19:22:13,1234197191406780417,,False,124,118
85,1290677006095581184,Fair question. Another question: Is there a high inventory of the drug in stock (inventory = profit) and is the administration's desires to push it associated with profits that could be obtained from any potential sales (despite it not being effective for COVID).,0,BoyInABox3,Scientist. Philosopher. Innovator. Dad. Brother. Son. Friend.,,958,171,2019-09-14 01:50:00,1172688843264409600,It's not a secret by any means,False,14543,5684
86,1290675928318836738,$TLSA announces they have began clinical trials for Covid-19 vaccine Human trials to start first quarter of 2021. Using inhalation technology instead of traditional intravenous administration. If this works stock will go bonkers #stocks #stockmarket #RobinhoodTraders,0,QuarantineInve1,"Started investing during quarantine. Amatuer trader. Longterm growth with a few penny stocks here and there.

--Profile pic shows my gains--",,12,7,2020-07-20 23:41:20,1285359117440294912,"Cary, NC",False,3,45
87,1290676719217598464,"...than the west, even if the costs in mortality are lower. Rich countries are going to buy these vaccines first and basically remove COVID from their countries, while the disease becomes endemic in the Global South. The WHO has already said as much.",0,shafer_soc,"Canada Studies chair & Sociology professor, BYU. Health & Society adj professor, McMaster U. Studying fathers cross-nationally. 🇨🇦 🇺🇸. He/him.",https://t.co/cIfGWqt7La,1856,1490,2013-08-07 03:27:01,1651938091,"Provo, UT / Edmonton, AB",False,9690,12124
88,1290647050980397056,"It is also used by number of doctors to treat corona viruses, and there is data that proves it works stop cos I can see you want politician to approve so that you can approve it.",0,stunnatheking1,,,298,45,2015-12-03 09:50:35,4360108936,"Estcourt, South Africa",False,411,550
89,1290675897339699200,"As the reopening of #schools and #daycares during the pandemic continues to be a hotly debated subject, new research shows that #children are not as resilient to #COVID-19 as many previously believed. https://www.healthline.com/health-news/new-research-finds-kids-just-as-likely-as-adults-to-spread-covid-19 #happiestbaby #happiesttoddler #parenting #health",1,happiest_babyuk,"Founded by @DrHarveyKarp, we solve parenting challenges with science & compassion. Get 'aha' moments sent to your inbox, sign up here: https://t.co/2gjoPXdVBP",https://t.co/G3vgTkX0wI,0,4,2019-11-27 01:28:37,1199500116081594369,,False,1,92
90,1290658888623296517,"Come on dude, we are famous for exporting cheap software testers to USA on h-1b who do horrible job and result in the failure and closure of the companies (like boeing) they work for. So we have an aversion to testing, be it software or corona !!! :)",1,Sameerreddyin,"Motto:
Never waste one's time arguing with people who know they are   wrong but won't give up.",,176,77,2013-08-04 21:01:55,1646102778,Singapore,False,14843,4206
91,1290675111637508100,"The recent COVID-19 (Coronavirus) pandemic magnified the need for remote interpretation services in the wake of social distancing, overcrowded hospitals, and the spread of the virus. Learn why: ",0,Akorbi,"Akorbi is a women-owned global provider of multilingual staffing, call centers, interpretation, learning solutions, and translation into 175 languages.",https://t.co/w07UyUIRAs,153,403,2009-06-25 16:01:35,50684782,"Dallas, Texas",False,446,1215
92,1290637594590683137,Provide a platform 4 the community to come togethr and discuss what is Corona Virus; Analyse the causes and solutions (Preventives Measures Communicate wit decision makers to share plannd action n obtain their endorsemnt; dailyBuild their capacity on what WHO/NCDC says on COVID19,1,isyaku12,,http://t.co/jcKkSbDOHQ,370,716,2013-03-11 08:31:17,1258918368,Kano,False,18,2427
93,1290676890319982595,"It's possible to obtain grant funding and also claim R&D tax relief, but certain grants can significantly impact the level of R&D tax relief available. Especially relevant now, with the various Covid-19 support packages. #GrantFunding #R&amp;DTaxRelief",0,Shorts1890,Est 1890 Innovative Sheffield & Chesterfield based accountants with specialism in all forms of taxation. In partnership with Shorts Financial Planners.,http://t.co/zWIzG1ry,1510,1603,2010-11-16 13:30:27,216349614,Sheffield & Chesterfield,False,1173,9469
94,1290661880118358017,@PressSec @realDonaldTrump @Scavino45 @kayleighmcenany @SecPompeo I don’t trust Dr Fauci Dr Brixt ! I wonder if Dr Fauci Dr Brixt and democrats are taking HCQ and can they be tested to see if they are using this drug. Dr Fauci has known for 15 years it works to stop Corona virus,1,winterchill2002,,,165,60,2012-03-09 02:30:16,519102574,United States,False,3668,213
95,1290674095223443456,"#exposebillgatesday Research needs to be done between each countries infected, recovered and death rates of covid in comparison to each countries uptake of flu vaccination last year to see if there is a correlation",1,Gaynor598,,,355,130,2011-05-14 16:49:39,298620476,London,False,363,1487
96,1290675101134917639,"The full @save_children ""#SaveOurEducation: Protect every child’s right to learn in the COVID-19 response and recovery"" report has more analysis, insights &amp; recommendations. It's worth checking out. ",1,IDPFoundation,IDPF is committed to encouraging and supporting the development of innovative and sustainable solutions to complex global issues. #IDPRSP,http://t.co/4vAm9589PR,1299,2328,2010-01-26 17:18:01,108661495,Chicago,False,825,3797
97,1290667783500582913,"That makes sense. I had H3N2 (claimed to be the strongest influenza strain, yet), and I've probably had Corona, a few months ago, given the symptoms (dizziness, fever, migraines, joint pains, and thick, green nasal mucus, unlike anything else), but mostly recovered.",0,vmlemon,,http://t.co/A9N4he0eQX,1030,975,2008-09-01 18:53:32,16086285,United Kingdom,False,144957,32902
98,1290648408202579972,"I call people who refuse to wear masks in the midst of a corona virus hot spot stupid or worse. Why? Because the harm caused directly effects others not to mention the fabric of our society. I don’t perceive evangelicals much differently. In fact, they overlap considerably.",0,craniumspeak,The big question: Why was Pres. Trump golfing and doing political rallies and minimizing the danger rather than getting the United States ready for a pandemic?,,523,102,2017-01-10 04:26:26,818675340054642688,,False,35773,5666
99,1290648809039712256,Why is there only people who think: “Corona is the worst thing in the world and will kill us all” or “Corona is completely harmless” It’s neither and if you would do your OWN research you would know that.,0,bobo50cent,"Travelling in a fried-out Kombi on a hippie trail, head full of zombie.",,453,1281,2015-07-26 00:24:25,3293945318,Banana,False,5245,13328
100,1290676416581959681,"As COVID has presented new challenges for everybody, clubs have been seeking creative solutions to keep athletes connected and recruited MVPCAST delivers HD-quality streaming video with an intuitive and easy to use app! See how it can improve your club: ",0,PrepVolleyball,The ultimate destination for ladies' high school and club volleyball,https://t.co/upoZTzrooj,632,32676,2009-05-01 17:20:28,36991867,"Los Angeles, CA",True,4966,36674
101,1290675464617558017,"That's true but I dont think the overwhelming majority of elective surgeries are going to fall into that category. But your original question, of how many are are covid beds vs how many arent, is still a valid question.",0,Shtim6,"Yes, I'm real....a real lurker.",,341,15,2019-07-12 14:37:31,1149689248087531525,,False,1984,793
102,1290654018587578381,We need SARS corona free society and a culture that is willing to ask hard questions and expect the right answers and results.,0,Brooksie1Jenn,#Biotech|#Entrepreneur|#Founder https://t.co/EBec3QnARd.|#Smithie|Biopharmaceutical drug-developer|#medical devices|consumer #health & #wellness,https://t.co/eWPAi9XJyE,833,668,2009-03-25 20:10:37,26579073,🏝🌊 & 🗽🍎,False,13831,6152
103,1290650587462344708,Is there a plan how to get mental help to school children who realize at some point that it was them who gave corona to some of their loved ones? This is a rethorical question.,0,ToadEU,Life is a tale,,322,23,2017-01-30 18:30:04,826135405435219968,,False,11605,670
104,1290675957389561858,So would memory B cells to other coronavirae explain why some older folk survive covid-19 even if they have underlying conditions?,1,seenitallbefor,"MK Dons supporter (was local team). Goes to away games oop North. 
Cricket is my main love though, YCCC member and occasional NCCC supporter.",,146,125,2014-01-01 12:02:41,2256148708,,False,7039,4241
105,1290677177596477441,"surely this was to help Brazilian lupus patients, because doctors are like pretty clear that it isn't a good treatment for COVID-19 definitely doesn't have anything to do with trump having a stake in its production and sale, surely not ",1,sqitles,Nerdy and sometimes funny.,,261,52,2012-12-31 14:15:30,1050412212,,False,2033,3855
106,1290675464399282176,"I love a good analogy. As Tyler mentions in his thread, it's hard to come up with a perfect analogy for COVID since it's so unusual. But he does a good job with this one. ",0,mirmatt,"LIS professor, researcher, engager in ideas large and small, sports junkie, helped save the Crew, recovering musician, nasty woman, she/her/hers",,1294,430,2008-09-18 23:12:06,16355239,,False,18788,8591
107,1290675530681876480,"Have your patients been watching the continuous coverage about COVID-19? Does hearing about the recent surge help them heal? In this post, get tips on alternatives to commercial TV by offering a positive and healing distraction: ",1,TheCAREChannel,"Healing #HealthCare Systems produces C.A.R.E.®  nature and music programming that is being used in more than 1,000 hospitals & healthcare facilities in the U.S.",https://t.co/YSgjdTyLC3,1801,391,2018-10-04 21:12:08,1047957564263030784,"Reno, NV",False,3850,763
108,1290654393629659138,"@narendramodi @drharshvardhan Sir please take serious note of this.FMG,s can be included in fight against corona,it will overcome shortage of trained manpower in hospitals. Plz don’t discriminate FMG’s on the basis of an barrier called FMGE #letfmgserve #IndiaNeedsFMGDoctors",1,dipika72748292,Foreign graduate,,20,10,2020-08-02 13:38:32,1289918462471503877,"West Bengal, India",False,28,262
109,1290675957875933184,"places where young kids would be likely to pick up any illness, COVID or otherwise, have been closed for months in most nations (schools, daycare, sports activities, etc.) has this age group even been exposed to environments independently of their parents in this time frame?",0,purpledcake,"she/her | engineer in energy | möther of voids | powerlifter | talk a lot about mental health and brain injury recovery | an adult, allegedly",,1177,1565,2010-12-30 22:14:16,232343408,"Calgary, Alberta",False,37617,28554
110,1290677186370981890,Serological tests detect antibodies specific to Covid-19 (especially those with a sensitivity of 90 and upwards which is what the ministry claims will be used) They indicate whether someone has been exposed to covid 19 in the past and may therefore have immunity.,0,AlexisReice,"Conservative
19 
868",,77,13,2020-04-13 04:02:46,1249548480382722048,,False,1768,1681
111,1290677077159665665,"I also have a vitamin deficiency, so I get you on the teeth thing, do you have the implants or just denture? Covid slowed down the process of my new ones so now debating over which style. Any tips and help appreciated",0,muddygirl198272,"Married to my best friend, lovee being goofy cause well everyone needs the weird friend and if you don't have one here I am BABY",,758,151,2014-02-06 22:56:45,2330958486,Nebraska blah blah nebraska ,False,10586,2690
112,1290652180026990593,"Just to play devils@advocate. The cost of HQC with zinc and that other drug supposedly used in combination to fight corona, were in the couple dollars a dose range. That other new drug I don’t know how to spell or care to check is 3500 a treatment....",0,thatfreakincat,moo moo moo,,211,220,2020-06-26 02:18:08,1276338873400848384,"Oregon, USA",False,1706,1298
