,id,tweet,label,screen_name,description,url,friend_count,follower_count,created,uid,location,verified,fav_count,tweet_count
364,1290674159744364546,"Well my patience has worn thin now. If I order for delivery I have to pay £3.99, if I go to the nearest in-sainsburys store it will cost me £5 in bus fares as I don't drive. How is that fair when my nearest store was just a 5 minute walk away until COVID?! Resolve that issue!",1,g_silverfox,The grey streak came through in me hair so hence I became nicknamed 'Silverfox' but formerly G-Dog!,,8,2,2019-06-04 01:16:15,1135716861830717440,Techvill!,False,15,193
365,1290676240890777603,Good Mares acknowledges that; -even #HousingFirst requires other conditions to work -solutions must fit the type of homeless population you have -hotel placements aren't a new thing for COVID. They've been around for ages. Bad placements often re-traumatized the #homeless.,1,Boston_Married,"Thinking things through.

No fixed address. 
Applied feminism. Anti poverty. Democracy. Homelessness. 

Big Dyke Energy",,676,199,2018-11-11 13:43:53,1061615499421741056,Australia,False,20585,18678
366,1290660850760654848,"CM @BSYBJP's govt cannot threaten us by serving legal notices. Why one, you serve 100 such notices to me, @siddaramaiah &amp; @HKPatil1953. But we will not stop exposing your Govt's corona corruption. You are looting when crores of people are suffering. ",1,DKShivakumar,"President, Karnataka Congress | Kanakapura MLA | Congressman",https://t.co/KTdvY1GJWt,167,253674,2015-11-02 06:12:58,4098851654,ಕರ್ನಾಟಕ ,True,2175,2108
367,1290637004623892480,Yes they do from cancer car accidents etc. But this virus is taking people’s lives in every country. Let’s do our best to stamp it out once and for all otherwise we will open up then shutdown over and over again. Dan didn’t invent Corona,0,HelenCo81968926,,,66,2,2020-01-03 22:22:40,1213224059833466880,,False,166,145
368,1290640391621009410,Pretty sure the government is using college students as test subjects right now... their mindset is “how far can we go before corona virus makes a 3rd spike? How many people can we put in a small area before corona infects everyone?” I’ll stick to Devry University #roadtoglory,1,Samj_nicewitit,I hope my supervisor don’t see this shit,,111,31,2018-09-12 03:10:07,1039712733036519430,,False,535,407
369,1290677339437883397,"Join us today (Aug 4, 2020) at 1:30 pm for a Paramedic Services Committee Meeting via the County’s YouTube channel at http://www.brant.ca/ParamedicServicesAugust2020 Due to COVID-19 pandemic, we continue to meet virtually. Council Chambers remain closed. View the agenda at http://www.brant.ca/CouncilCalendar.",1,BrantCommunity,"The Official County of Brant Twitter account. Monitored Monday-Friday, 8:30 am-4:30 pm",https://t.co/bq5dpMOTCK,302,3391,2012-03-29 19:13:14,540209600,Paris,False,439,5361
370,1290676162155479040,"Let's remember that the @GOVUK don't care about poor families. All they care about is themselves. Struggling families don't go out to eat as it is with #covid making things even worse. Look around. Access to benefits fails, sanctions are introduced regularly and the @DWP kill ppl",0,mikus2604,,,144,34,2009-08-28 11:52:11,69568943,"Windsor, UK",False,86,218
371,1290676195256930310,"I’ve come to the conclusion that someone somewhere (cough Kushner), that this is the Tik Tok generation who can cause real damage to their ideologies. Like not providing help to COVID hit Dem states, the herd of future leaders can be culled this way.",1,defectiveMom,"Perspicacious. Blue dot in a sea of red. Sisyphus never rests.
I mostly re-tweet.",,1592,321,2014-01-21 23:24:32,2303854284,land of the black dog,False,21295,11641
372,1290677716371542027,"And enough of our population has not as well - to the point that there's a massive political divide over public health, from masks to social distancing. And y'all want us to send our kids into this. You want to treat teachers like COVID unit nurses.",1,nolanolegal,My Seminole love will make you uncomfortable. Who Dat. EMAW wife. Mother to the army of darkness. Once made Leonard Hamilton smile.,,3041,4898,2008-04-15 02:27:15,14392960,"New Orleans, LA",False,203336,175597
373,1290675197096464384,Is anyone considering the role @coronaextrausa had in getting everyone to start calling the virus Covid?,0,icon226_isaac,Ball,,242,57,2016-03-06 20:07:49,706572010923515904,,False,550,220
374,1290676676871872513,"Another lie. Did he ""wish well"" McCain? Lewis? Even Covid victims? Nah, just worried about reelection, ratings, and crowd sizes. In other words, himself.",0,1953_One,Blue woman in a red state,,139,161,2017-07-03 15:24:14,881896370021552129,,False,43442,12002
375,1290644300464828419,"@nch14404 being a consumer forum, it is also not looking into our cases. It has also become corrupt as @goairlinesindia . Companies like @goairlinesindia are like corona virus now affecting government also.",1,daadhiiwala,,,404,19,2018-10-05 13:04:18,1048197187388297218,"Mumbai, India",False,272,28
376,1290676367399489536,Colleagues across the Investment Bank have been taking part in the Skip Lunch Fight Hunger fundraising campaign for @CityHarvest this past spring. 17 of them joined teams to help feed NYC’s children and families hardest hit by COVID-19. #RisingTogether #WeAreCityHarvest,0,BarclaysIB,"Official Twitter account for Barclays Investment Bank insights, research, news, people & more. For T&C: https://t.co/6ASGClu2E6",https://t.co/sUwN4ElufK,96,49868,2017-04-24 15:06:45,856524819948609536,,True,130,1399
377,1290676841913581568,And One More another 20Members Arevwating for Covid-19 Results so pray for God To get Normal Result,0,SrinivasBouthu,🅅🄸🄹🄰🅈🄳🄴🅅🄴🅁🄰🄺🄾🄽🄳🄰    🄵🄰🄽,https://t.co/i3Jj4ndI77,87,35,2019-08-20 15:52:13,1163841122721882112,Gσԃԋαʋαɾιƙԋαɳι,False,529,1081
378,1290677184248426496,i seriously hope bighit won’t be dumb enough to send bangtan to a place where covid numbers are still so fucking high everyday just for one performance. pls don’t risk the boys’ health for this. don’t. and if i see anyone demanding bh to do so i’m coming for your fucking throat.,1,eleezarocket,Moon says I have corrupted lungs & magical power. Sometimes I just wanna be Winona Ryder or Joan Jett with ancient dragon as my pet. ARMY 6기 • Muster Busan,https://t.co/QBul5Q5K0H,789,1519,2010-05-09 05:28:38,141838568,,False,149536,71336
379,1290673794819018754,"If your job threw you back in person w/ unclear or ineffective Covid standards and more questions than answers, I'm sorry. The proper response to exploitation is not to blame others that fight it, but to consider what allows for a fairer fight: unions + collective bargaining.",0,ScottTakes,particularly bad takes,,523,649,2009-06-15 20:34:11,47436667,,False,24550,59859
380,1290657855398391808,"I have a solution - when they stop lying the corona virus disappears. Once you say you make it right with Gd and abandon and cheat- and colive with another woman , while stringing me in heaven to a man, is callous. He has to come and pick me up and bring flowers for once.",0,DanielaCalota1,"We're as humane as our deeds-Democracy is freedom. ""Those who fail to learn from history are doomed to repeat it""",,578,868,2019-04-03 09:44:47,1113376790418948097,Stockton,False,66483,78860
381,1290674125749411850,"This is your fucking tweet? How about unemployment, Russian bounties, Covid, eviction disasters, health care, testing taking 2 weeks, hurricanes, the list goes on.. no one truly cares that athletes are kneeling, they will either watch or not, not your problem. Not. Your. Problem",1,ShelliesSister,Sister to Shellie. Laughter is my religion. Dave Grohl is God. Biden2020.  Not caring what they think 🌊🌊🌊,,1940,1072,2019-05-23 03:22:54,1131400081217687555,,False,10419,2203
382,1290673715286597632,"The @gbbf may not be happening, but some traditions are too important to cancel for Covid, so I have ordered supplies for Thursday-normally #HatDay with friends at the GBBF; this year Hat Day will be on Zoom. Grab a hat, pour a tasty beverage and join me on Thursday! #GBBYOBF",1,ianaitkenhead,"Countertenor, lawyer, Perudo and poker player, fan of good red wine and Leicester City. Has been known to run a long way and cross-dress in the name of charity.",,425,615,2012-11-17 11:46:05,953413620,London E12,False,60,1262
383,1290645950407618563,There’s a spike in corona virus cases in RI because y’all can’t fuking stay home. It’s frustrating doing my part and seeing everyone else I know just ignore the fact that there still is a pandemic,0,Samlc149,"mother of cats,paranormal junkie and feminist|Namaste🔮🕉✌🏻#nastywoman #pmddwarrior",,255,230,2017-01-02 00:49:18,815721595213934594,"Rhode Island, USA",False,5883,4643
384,1290675938884235277,"@jimcramer “No, actually, covid is killing us and the Fed this time around is just trying to keep us afloat until the pandemic runs its course... I would not attack the fed here. They are the good guys this time around...”",1,treseo,,,333,17,2013-09-18 19:24:41,1880623357,,False,3872,5460
385,1290673929598545921,"24months of campaign.. ..... absent level fields, absent rules of engagement, there's work to be done here... .....then somebody tosses #covid19 in the mix (hint: b4 covid, here at crazy ethnicEuro Diane had that cough from hell , gave ppl the flu)",1,morningfog1,fullmoon walking tour of 94704 new bldgs frenzy😵 we got o'nts in our p'onts n we NEED to build!!,,417,193,2018-05-29 00:36:45,1001261022185844736,"Mount Shasta, CA",False,9776,43976
386,1290674868816695296,"Adhering to County COVID requirements, Groundwork will open the EarthLab to students this Fall to augment their online learning. We are seeking instructors to lead small group instruction during weekdays. If you are interested, please contact Leslie@groundworksandiego.org. ",0,GroundworkSD,"Nonprofit organization dedicated to rehabilitating the Chollas Creek Watershed through community involvement & empowerment.

Newsletter:https://t.co/U4GajMQGJp",https://t.co/SeZ9whm0Ox,234,251,2009-11-12 19:39:31,89521979,"Chollas Creek, SE San Diego",False,23,570
387,1290676599474589697,I just hope and pray no one plays politics on this issue now as they did on covid .. is all I am saying ,1,saiyidsajidshah,Arts & Culture  Journalists & Pundits News Science Literature Politics Technology & Science,,263,2231,2016-12-01 11:08:27,804280998527729668,"Karachi, Pakistan",False,288,3425
388,1290675880428216320, Finding joy in all my backyard moments. It’s not always easy I read COVID story yesterday that had me balling. It made me even more thankful for the protection God has been providing me and my family. Remember to look for hope through it... ,0,TWEETIE814,"Member of Zeta Phi Beta Sorority, Inc. 
TU Baby Sexy Eta!! #TUMF
Owner of Li Li's Creations",https://t.co/dh2CxqnkNN,643,402,2009-06-22 14:33:14,49645142,"Roosevelt, NY",False,2748,7185
389,1290674565023244289,Why should a member of the public have to pay for every overhead mentioned. All they want is reasonably priced pizza. That’s why these places ( apart from Covid ) are closing.,0,SEAMONKEYOO7,"I've got a bike, you can ride it if you like.",https://t.co/yyxcXdqgCw,74,74,2011-03-15 14:41:07,266620551,Just off the main road.,False,2763,15248
390,1290674768644050947,Do your work Covid... get him.,1,reginaldedmund,Activist/ Playwright / Producer/ Master Mischief Maker/ Curator of #blklivesblkwrd / Really good at pissing people off,https://t.co/Lq4dtOc88N,5000,1476,2012-04-27 16:54:15,564839097,Houston and Chicago ,False,36774,12269
391,1290665894134329347,Good path to Corona Patients the TRS Government always For Public Welfer,0,kishanraotrs,,,268,193,2015-05-03 16:41:55,3184413487,,False,3632,1377
392,1290674082602799111,"Why don’t you go do your hate rallies and not test yourself for a week and let us know how that works out... If you manage not to get COVID, I’ll send my kids to school... Otherwise ...shut up!",0,BellaLuna468,"Italian mom of twins, turned political news junkie ~ watching a presidential train wreck. #NotMyPresident  *MAGAts blocked",,1362,1093,2009-03-04 17:32:36,22804041,"Itasca, IL",False,81323,17992
393,1290674645495160832,@ChildersRadio I would really like to know what Eric LeGarnd thinks about this issue of COVID safety for college football players and what type of risks you take just stepping on the field.,1,DHStanley2,"Father, Husband, Pharmacist. Golf, CFB, Bourbon. I’ll give you a billion Stanley nickels if you never talk to me again. Repatriate the Pharma Supply Chain",,824,121,2018-07-21 00:08:15,1020460407058821120,"Atlanta, GA",False,1375,4960
394,1290677052287393792,"Yet mainstream news are yet to cover what’s happened?? Just .. Covid, Covid ,Tracking &amp; Lockdowns !!!!!! Real journalism no longer exists",0,dizzydw1,"London, Miami, LA, Toronto, Barcelona, Marbella. Sold a bit, saw a bit, heard a bit, learnt a bit & did a bit. Happily married. Truth Trump & MMA👊",,493,273,2020-07-02 20:38:12,1278789996246425613,"London, England",False,972,759
395,1290656031916384258,"His Corona,Queens home the most charming and adorable tour in NYC. When, and if we get back to hitting harmonic notes, make sure you go. He knew what a wonderful world we had-even with its' many blemishes. He made the best of it &amp; deserves a vandal proof statue in every state!",0,CrezRamirez,Entered this space post Maria to express absolute faith in our “unstoppable” island & people🇵🇷🤝🇺🇸. Earthquakes & power failures no match for our strengths!,https://t.co/aRd71Hu5tV,289,157,2018-07-18 18:58:07,1019657586466000896,A Boricua State of Mind & ❤️,False,4376,2979
396,1290675810437926983,"Due to the Covid-19 pandemic and the chaos and uncertainty it has caused, FAnews, the creator of The Insurance Apprentice, has decided to extend the deadline for applications for the 2021 series to December 2020... for now. The exact date will be confirmed closer to the time. ",0,FAnews_Online,FAnews is the leading magazine and online portal in the financial services and insurance industry. We talk to financial advisors and brokers.,http://t.co/YsqRCQGWf6,758,3697,2010-05-25 08:48:00,147885489,South-Africa,False,962,18931
397,1290666662258184196,November 4th.- CNN: Breaking news... Experts: Corona virus isn’t as bad as we thought!,0,R_Paps1979,🇺🇸🇺🇸🇺🇸🇺🇸🇺🇸🇺🇸🇺🇸🇺🇸🇺🇸🇺🇸Lets Go Flyers!,,510,134,2012-06-30 03:14:17,622536351,Western NY,False,16207,4072
398,1290673790494572544,".@SenatorShaheen to @wkxlnhchris on prospects for COVID-19 relief bill compromise. ""It’s time to stop the partisan grandstanding; let’s get back to work."" #covid19nh #nhpolitics",1,KlandriganUL,"Kevin Landrigan-Award-winning pol. reporter/columnist, covered NH prez primary since 1980, now State House Bureau Chief",https://t.co/CFi7wfNrg3,1075,7640,2010-10-04 14:24:49,198511319,NH Union Leader,False,141,15436
399,1290658273566367747,"How could you get riots then, how could CNNs of the world get their paycheck, how could you get Corona spread, how could you have racial divide...don't you want nice things!",1,Gmizavci,"Mrzitelj paćeništva, prenemaganja i manipuliranja.",,1037,459,2013-07-15 08:57:48,1595359338,Republic of Croatia,False,48698,18912
400,1290676321924898819,"Yeah, we already know that Covid is more deadly for people with underlying conditions. Quit spreading half truth conspiracy and put other's well being above your own interests for once!!",1,Laces20288055,,,185,3,2020-03-30 17:01:35,1244670972713730050,"Kentucky, USA",False,177,10
401,1290658985054437377,I went out today and saw people walking and cycling more than ever before. Corona gone ?,1,ShreyanshNahar,,,170,46,2012-01-27 16:23:32,475952978,,False,316,47
402,1290676816462721025,"@AustinAngels walks alongside children in the foster care system and their caretakers. Due to the pandemic Austin Angels has received an influx of referrals for families with immediate needs.G|A is supporting their efforts during Covid-19 by providing groceries, toiletries &amp; more ",0,glimmeraustin,We are committed to serving the poor and breaking the cycle of poverty.,https://t.co/jwxRbI2KGZ,476,475,2013-03-19 17:53:17,1281089083,"Austin, TX",False,290,1703
403,1290674776332091392,Journalists need to keep correcting Trump. He tries to use the camera time to repeat his lies. Trump says a kid gets the sniffles and it’s a case. No. A case means positive for corona virus. I’m afraid people don’t understand. Letting Trump go on &amp; on is not helpful.,0,lncaliheart,"Advocate for education, healthcare and quality life for all-raised 3 sons-widow, preXcond. ESL teacher. #Resist #VoteBlue2020 Be Kind🙏",,4793,4097,2011-08-28 17:47:54,363783636,SoCal,False,7615,8331
404,1290674955269607425,"Add in the City’s debt load, climate change, restoration of Chedoke Creek, $250 million RHVP CLASS action lawsuit, RHVP public inquiry, homelessness, drug addiction/overdoses, & the risk that COVID-19 fears lower attendance at such large sporting events. Let’s focus on priorities",0,BCouncillor,Proud and honoured to be serving my community as their elected City Councillor.  “Getting things done”,,459,732,2019-08-01 19:10:27,1157005690793336835,,False,0,696
405,1290677214632124417,"Disappointed that Honorable member for Banjul South is asking “where did the Covid funds go” on Facebook. My reply is she should be in a better position to tell us. If colleagues in the NA can’t tell us where the money went, what can we in the lower house tell our constituency?",0,kemo_bojang,"Legislator @PublicKMC & adviser to @mayorKMC. MWF fellow, China-Africa fellow and Nat. Sec. General of @OfficialUDPGmb Youth Wing.  I tweet all things Africa.",,1609,5403,2016-05-22 18:36:37,734452923967606784,Gambia,False,20212,14045
406,1290656292265222146,"Yes before corona we were in the pool. He holds the record for teaching the most people how to swim at one time. He also teaches first aid, a life guard class, and a business class on aquatics.",0,duttygyalkeyuh,knee-key-uh🇯🇲 ⠀⠀ ⠀⠀⠀ ⠀⠀⠀ ⠀ ⠀⠀ ⠀⠀⠀famu20’s favorite future sexologist .✨ ⠀⠀⠀⠀⠀⠀⠀ ⠀⠀⠀ ⠀ ⠀⠀⠀ ⠀ ⠀⠀⠀⠀⠀⠀⠀ ⠀⠀⠀ ⠀ ⠀⠀⠀ ⠀⠀⠀ ⠀ ⠀ ⠀famu alumna 😉,https://t.co/HXfFqMXAdS,1525,2913,2011-08-19 17:50:29,358290379,Palm Beach.,False,639,178710
407,1290643513810583553,"Or maybe those who used to register over the borders think with corona and military presence at play, it not worth it any longer... It could allo mean that people have just stayed away... Maybe they have other pressing worries than registration",0,OseiAkotoIan,Sports Business| Integrated Marketing| Business Solutions & Devt| Brand Image & Association| CSM| Family| #Wolfpack Konsult| #SmileyFest| #GSTEP,https://t.co/bRywJ0rM5u,438,127,2014-12-03 13:02:46,2903720873,"Accra, Ghana",False,466,490
408,1290676005208760321,"I had a covid dream last night and someone was like “everyone should go get tested, be prepared though, the test is $2,000” like even in my dreams we can’t have affordable healthcare",0,tssttsst_,"mi piace

she/her",,195,217,2009-04-14 01:55:27,31025689,,False,113001,9636
409,1290646473068220418,this is one of my favourite dennis scenes ever the way his whole decorum just changes hahahahaha i can’t wait til they make a corona episode the levels of insanity it’ll reach ahhahahaha ,1,KateOShea98,@WayneRooney I'll put u asleep within 10 seconds u little girl. Don't say stuff and not follow up on it. I'll be waiting,https://t.co/qjCDJOJQds,1400,1706,2012-04-29 13:27:25,566299552,"Waterford, Ireland",False,40653,28421
410,1290677688408190983,Read his transcript and coach sounded confused. He had his talking points with regards to sitting out due to COVID and handled that well. There is so much unknown on if a players decides to sit out due to a protest. He could have handled it differently but it wasn't malicious,0,HarbachCFB,"Contracts have Consequences.  Auburn Football, Former CFN SEC Writer, Loud Music, Dad.  Hyperbole and Hypocrisy vilified often.",,242,618,2009-04-20 01:53:43,33377087,North Carolina,False,5955,23857
411,1290677407201079296,"I feel like you and Scott both agree and this ""argument"" is nonsense. Scott's main point is the battle against COVID isn't over yet, and saying one approach is better than another isn't fair. We are still in the middle of things.",0,victorberishaj,Enterprise Software | eCom | 🇺🇸 + 🇦🇱,https://t.co/XI6Ds1U8rk,119,137,2009-07-22 02:24:48,59005983,,False,825,167
412,1290674197748998144,"That’s great news. Now RE: corona virus spending bill, Republicans, do NOT give Democrats $for their Xmas list! I have faith in our fellow countrymen, we see the shenanigans going on. You’re doing the right thing. We’re behind you 100%!",0,95smitty95,,,35,2,2009-08-22 23:35:20,68014271,,False,2,208
413,1290656551611576325,"That might be the way to go. At a lull in development atm. We were getting ready to sell a test trial series of grow systems before Corona. Have several revisions in the design, model, and marketing efforts when I get back into it. In the middle of a move and remodel atm",0,EuGrow,"💪families grow, buy, and eat fresh healthy food. We're nerds with a passion for human potential being met. Tweets by @RamonAlonsoJr. 

DM's are open👂s. 🖖",https://t.co/xsqpz3IgZm,0,57,2019-06-27 01:55:26,1144061643967668231,"Tampa, FL",False,0,622
414,1290677013611778050,"Take down all their names, refuse them all medical services related to Covid in the future. In fact refuse them service for anything for the rest of their science denying lives. ",0,TGSgigiddy,,,21,5,2020-07-14 17:05:14,1283085081129648129,,False,161,335
415,1290677483075969025,"My prediction after watching this all unfold and keeping an open mind : It's not even close to being safe for kids to go back to school , there will be kids getting covid 19 and spreading it to teachers and family and people are going to die ... just look , cases on the rise !!",0,steve2010201,"Fan of Lady Gaga , Madonna , Taylor Swift , Christina Aguilera , and others .  Proud Canadian .  BLM .",,375,111,2017-09-15 18:09:47,908754732801511424,,False,20013,8109
416,1290676988148158472,Helping to reduce the spread of COVID-19 can help small businesses stay open. #SupportSmallBusiness,0,LeiLaRayHolding,"Business Planning, Consulting, Growth Strategies, Market Research, & Strategic Partnerships.",https://t.co/6lShk1MU6P,80,30,2019-01-22 22:57:30,1087846748066705408,"Salt Lake City, UT",False,48,5877
417,1290676057356607492,"Welcome to the Gies Business Family ""2 years ago we joked about how amazing it would be if we went back to school together. Who would have thought that the COVID-19 quarantine would be our motivator to finally return?"" ",0,giesbusiness,"Official account for Gies College of Business at the University of Illinois. Departments: Accountancy, Business Administration, and Finance. #WeAreGIES",https://t.co/Fl8xZFyyfF,1732,11727,2009-01-27 20:53:54,19615559,"Champaign, IL",False,41511,24910
418,1290673336855465984,"@NianticHelp Will there ever be a comment on the gift nerf? The drop rates on balls HAVE been reduced, and it kills the game for those without stops nearby. Corona is still going on here!",1,Fattypatty187,,,5,1,2020-07-29 17:09:04,1288521905063034881,,False,4,8
419,1290650387876319236,"idk but somehow this corona doesnt really make anything matters lately like ""...oh the sun is so good today ffs lets call the boys and hangout!!!"" and suddenly it was just ""...nevermind its corona"" well my life evolving pathetically lately",1,fvmertue,"Allô, je suis dans ma 18°C chambre, avec mon ½ paquet de Marlboro.",,978,606,2020-05-18 03:09:42,1262218751589494784,Jakarta Sud ,False,58,6775
420,1290675171620200448,"Someone left these around my neighborhood’s walking trails. If only I didn’t live in a state that never shut down and whose residents are stupid to the point our governor got COVID and still thinks it’s fake, I’d have a lot more hope.",0,mgenevievef,"Healthcare wife. Do not @ me w/ pseudoscience BS right now (ever, but especially right now).",,1315,460,2009-01-15 16:30:08,19027533,Blueberry stuck in red KoolAid,False,47432,19139
421,1290647407412367361,"Thread - I told one of my employers directly that I view “corona” as a farce tonight. She wasn’t opposed to my views, and even could see where I was coming from. She still fears the whole thing, though. I realized the emotional toll this has been taking, as I felt my throat",1,VoluntaryJapan,"✌🏽Individual Self-Ownership. Voluntary Japan, Voluntary world✨ Promoting Unschooling, Free Markets, Free Minds.",https://t.co/Ev6rVvhcaW,1030,1473,2016-07-06 06:28:09,750577054073155585,Japan,False,12074,7655
422,1290677468374814720,First event held at the venue since the covid-19 crisis and it held in NEW YORK OH NO PLEASE I don't want to risk the boys health,1,Jung_cookiees,,,291,244,2019-08-31 13:25:07,1167790304260313088,"Chennai, India",False,18373,10804
423,1290669219973959681,Yeah let's just put kids to risk and see if they get Corona ,1,dank96853764,R.I.P KOBE| Lakers Fan| R.I.P GIGI| not even a goat lol| NBA🏀FAN| FN PLAYER| BLM| RIP GEORGE| I CANT BREATHE| ✊🏿✊🏾✊🏽✊🏼✊🏻| #woo| #lakeshow,,521,178,2019-09-08 00:59:58,1170501949021491201,Home,False,2742,656
