,id,tweet,label,screen_name,description,url,friend_count,follower_count,created,uid,location,verified,fav_count,tweet_count
183,1290676406444265476,Glad to see more places shutting in aberdeen after the corona spike at the weekend. Honestly cant believe pubs in scotland have opened. Hopefully the mintlaw ones shut too. People dying across the world so lets all open pubs to spread the virus further new lockdown coming soon,1,Besty_scotland,songwriter/ musician. debut ep available anywhere online. reviews for @sle_dj. rocks a gibson j45/ gibson les paul and gretsch new yorker,https://t.co/5TM6qgxO24,458,653,2020-06-06 04:57:37,1269131225299632133,"Mintlaw, Scotland",False,379,989
184,1290671774816845824,@UPGovt kindly postpone UPBED2020 paper. We are in quarantine as our neighbors has Corona. because of administration strictness we are not allowed to go outside. @PMOIndia @narendramodi Pls look into the matter. Save Lives by saying no to it.,1,Manmeet05651924,,,16,7,2020-04-26 14:34:03,1254418406750793734,,False,7,28
185,1290677143224147969,My good friend who’s a great PSU fan says it would have to be an SEC School. They are in the worst area of uptick of Covid and are (let’s face it) the most powerful.,0,MrcpwcCummings,#VoteBlueNoMatterWho,,646,590,2015-04-10 14:35:55,3148200566,,False,100819,79993
186,1290675399312265216,now that i take a second and think i don’t want bts coming to america. covid is literally everywhere. i want them to be safe and healthy @BTS_twt,1,_brewer_anna_,Just a typical ginger 🤷‍♀️,,63,30,2018-11-27 21:11:48,1067526426990125062,,False,9775,226
187,1290675366219018242,i hope the performance isn’t actually in person tho this pandemic hasn’t slowed down (esp in the US) and i don’t want them to risk getting Covid :((,0,milkkiekoo,#JK ☆ ° {𝐟𝐚𝐧 𝐚𝐜𝐜𝐭} ☾⁺˳ “𝐞𝐯𝐞𝐧 𝐭𝐡𝐞 𝐝𝐚𝐫𝐤𝐧𝐞𝐬𝐬 𝐰𝐞 𝐬𝐞𝐞 𝐢𝐬 𝐬𝐨 𝐛𝐞𝐚𝐮𝐭𝐢𝐟𝐮𝐥” * 𝐣𝐮𝐧𝐠𝐤𝐨𝐨𝐤 𝐞𝐧𝐭𝐡𝐮𝐬𝐢𝐚𝐬𝐭 ~ #방탄소년단,https://t.co/Y5YEe19Uwr,228,171,2019-06-30 23:21:10,1145472373547655168,,False,24552,5334
188,1290674779691851776,Love that reporters are finally challenging Pres Donny on the Covid issue. Big respect to Axious. This virus is not “under control.” ,0,mattjaygee,In the summer I like the AC and in the winter I like the heat. I’m a regular guy.,https://t.co/qJcvtPVZFO,567,2932,2014-02-19 01:42:32,2351687068,"Bronx, NY",False,4324,5681
189,1290647881746190336,"OMG! We are better than the world.... I actually cannot take this anymore. I know the Corona deaths are extr sad, I am just laughing at Trump. I cannot believe my ears!",0,JacquiStaaden,Pay it forward and do something good for someone less fortunate!,,32,6,2019-09-25 13:30:43,1176851230439743491,,False,692,924
190,1290676285778341888,"I spent 4 full months at home due to covid, 4 months, but USA is like ""yea we don't care"" and as long as they don't care this situation won't change.",0,bangvmin,"ㅤ𓂅 𓏸 ｙｏｕ ａｒｅ ｍｙ ｓｏｕｌｍａｔｅ 
                  ❞ yes, bts 𝘱𝘢𝘷𝘦𝘥 𝘵𝘩𝘦 𝘸𝘢𝘺. 🦋 𝗘𝗧𝗘𝗥𝗡𝗔𝗟𝗟𝗬 𝟳 .",https://t.co/Y21nsaqjLG,297,349,2020-06-08 21:10:34,1270100890666532866,25 • s/h,False,2902,3773
191,1290677523618181120,"ok ok i understand the Eat Out to Help Out scheme is there to help restaurants start up again HOWEVER. Surely making £8 meals in spoons £4 is going to make these places busier and in turn, spread covid? Like am I missing something?",1,LauraMeganCarr,22 - Graduate in Photography 📸🍁,,188,56,2019-10-28 18:42:12,1188888634717544448,,False,6080,671
192,1290675439678054401,"Extremely glad to learnt that the Frontliners combatting this deadly COVID19 disease in Kangpokpi have all tested negative. Continue your great task. Also handed over bulky PPE & essential items for the COVID Care Centre, IQC &amp; for all the frontline workers. ",1,KipgenNemcha,"Minister of Social Welfare and Cooperation, Government of Manipur. RTs not endorsement.",,126,2291,2017-05-10 04:20:38,862160424107724800,"Manipur, India",True,1021,2122
193,1290674987179835397,Apparent Covid cluster in castletroy and seeing stories of 40 people up on top of each other in living rooms in college court all weekend :)),0,ULConfession,Born in Stables. The pride and joy of Castletroy. Brown Thomas is my godfather. Submit anonymously via Curious Cat link,https://t.co/yiYLJxUrKi,5,2583,2020-01-21 15:06:51,1219637449946750981,"Limerick, Ireland",False,53,1824
194,1290673984204230657,"They are just as bad, just slightly smarter. They are getting away with what they can, taking advantage basically. Remember, the illegal insider trading all those wealthy connected people did right before the COVID lockdown?",0,MsGo,Black Woman. Tweeting about whatever I want. Mostly cheering positive moves in inclusive media. I just want to see one Octavia Butler work on film before I die.,https://t.co/khIVEADPdY,2092,1067,2007-10-21 23:32:55,9587442,United States,False,39269,16896
195,1290656747514929159,The fact that #Maharashtra Corona would not be affected today under the leadership of #DevendraFadnavis is an acknowledgment of his work.,0,TanmayJ94,student,,1486,365,2019-11-07 13:29:28,1192433610604724225,,False,1271,3557
196,1290674511566770176,Sure seems like he is waging a campaign to be yanked by the 25th amendment. Living in a bunker during Covid times is not for the faint of heart.,0,Minouch11705945,,,36,0,2020-07-29 01:59:07,1288292808726585344,,False,264,178
197,1290675685669904384,"Schools overcrowded to begin with so even if a portion opts out there will still be crowded classrooms. Also puts a lot of pressure on teachers to dedicate themselves 100% to teaching both in class and remotely, while also having to practice new safety measures for covid ",0,kailerrrrrr,not a regular person,,206,307,2014-04-29 22:03:05,2469903332,"Brooklyn, NY",False,10568,8419
198,1290677102761648128,"Covid-19 isn't a joke!! You really wanna see people die don't you? You're literally just sacrificing us, we could get covid-19 too it's not just the older people. If you really wanna reopen schools and make us go think twice.",1,o_Ashyyy,hiyaa welcome to my boring twitter page :) roblox: https://t.co/dvw8sSydYb youtube: https://t.co/VnJZQVZl9x… pfp by linduskalin,,80,10,2017-11-28 00:18:02,935301722435616768,,False,86,47
199,1290675631563386886,What does BLM political agendas have to do with her talking about Covid making it where she can’t have an engagement party though? Where’d she say anything about BLM?,1,bradshaw_hollie,,,80,2,2015-09-27 22:12:04,3708061454,,False,302,76
200,1290675052384583680,Wanna know what it is...they are positioning after this whole “social justice” thing and now are seeing rating plummet due to people like me not watching or giving a damn. That’s a loss of money and better to blame Covid 19 than loss of fan revenue,0,HTexan68,"married male, sports lover, 2A, MAGA KAG2020 Ohio born, Texas raised!",,715,126,2019-07-23 02:48:08,1153496992255021057,"Lake Jackson, TX",False,4281,1387
201,1290677146122424326,@ProjectLincoln Drumpf always likes to always likes to tout his rally numbers...how about an ad with the Rally of Death in which you show a crowd representing all those who have died from Covid. Maybe the visual aid with his fave context will bring it home for him.,1,SHE_RAH369,"Enigma,Celtophile,Vocalista,Waterbaby,otter,doe, scorpion,crow,sing write swim love:)",,366,154,2010-10-03 19:36:13,198248930,The Final Frontier,False,10842,13289
202,1290675543189458944,it was so frustrating like she was so close to me that even without covid it would’ve been rude,0,namixion,bitch i’m playing my ps vita i’ll call you later,https://t.co/LWhqGweXgK,170,1399,2012-08-17 05:41:32,763083511,,False,60371,147497
203,1290641660997763085,"They were screaming Corona fshaya. The people have a lot to learn, Kurds only think about themselves, nothing more. It doesn't matter what they get, they will never be able to push forward with the current state of mind. There I said it.",1,Pishtgir,I'll go and find myself first.,,332,614,2013-02-02 22:35:38,1143593029,,False,986,120
204,1290676381215526912,"In an effort to aid in social distancing efforts & minimize the risk of COVID-19, Bayfront Park's #FREE #yoga classes are going virtual! Join us virtually via #Zoom every Tuesday at 5 p.m. for FREE yoga sponsored by @BaptistHealthSF #community #fitness #BayfrontPark",1,BayfrontParkMIA,Bayfront Park Management Trust is a limited agency & instrumentality of the City of Miami. It manages two downtown waterfront parks: Bayfront & Maurice A Ferré,http://t.co/jC3BaNVHN8,217,3270,2014-12-29 16:33:40,2949529859,301 North Biscayne Boulevard,True,2023,4716
205,1290674683793117189,But you're INDIRECTLY making a fun of those people who are compelled due to the corona pandemic:(,1,Middle_wings,"I'm seeing some people are taking advantage in the name of SSR's justice for getting followers, likes and retweets on social media, why?
it's not HUMANITY",,184,35,2019-12-13 04:09:10,1205338471780368384,why do you want my location? ,False,733,2246
206,1290660658682499075,"People fuck up And people learn The only thing I’d hate him for is the Corona video But you’ve gotta weigh the good vs the bad, he’s raised a lot of money for St. Jude Also if he takes criticism badly, you do too",0,FerinGang,I changed my handle after taking a good shower,,437,65,2019-09-27 12:48:18,1177565588035637248,Yep,False,19039,3527
207,1290677077138649095,"Help someone get a used car to get back to work when COVID-19 Vaccine is in flow. Buy for $1. Convey to your followers. #ChillHop #JazzHop #Lofi Track is ""Eye Wateringly Expensive"". https://youtu.be/GfY2y2YcL6w Buy for $1 Here: https://distrokid.com/hyperfollow/pdh1/optimus-chill-3",1,PDHMUSIC1,"This music is a compilation of a few different styles of music. Jazz, Lounge, Jazz-Hop, Hip-Hop, Chill Hop, News Music, Real Estate Music, Coffee House, Cafe.",,43,25,2018-11-21 13:56:51,1065242641800024064,"Chicago, IL",False,262,2105
208,1290676689245282306,There’s a difference between acting like Covid is not a big deal and acting like it’s the bubonic plaque. Nuance is difficult on Twitter but I think that’s what some people are trying to get at. Some of the hysteria is out of control.,0,durdeee_e,CEO of my brain. Uncanny ability to find uneven spots on sidewalks. Susceptible to a good conspiracy theory. Nicer in real life than I am on Twitter.,,273,87,2016-11-28 21:48:38,803354941804965888,"Tampa, FL",False,9463,5636
209,1290676839829000193,Nobody Accurately Tracks Health Care Workers Lost to COVID-19. So She Stays Up At Night Cataloging the Dead. ,0,bettyp711,I'll go with the example posted here. Rocket ship builder? What's in your pocket? Really old hippie groupie?,,977,542,2013-12-10 01:26:44,2238402254,,False,12,155653
210,1290674405471903744,He is probably hoping for a school shooting to take the focus off of Covid. Nothing he does makes sense.,0,CokeyL,,,150,11,2008-12-21 15:39:38,18286236,,False,368,1448
211,1290673652057419776,"RT MercuryMakesPix: RT parkermillsap: Hey senschumer Please get the RESTART act included in the next COVID relief bill! If Congress doesn’t help the small venues, live music will collapse, and musicians will have nowhere to play or make money for a very long time. Please #sa…",0,czahller,International man of mystery. Cocktail nerd. Web Designer / Developer @ https://t.co/HzhAoOqDxm. Paparazzo @ https://t.co/nK5zRRHHIM #OKIEX,https://t.co/CrJ7ziRz1R,215,238,2011-09-14 13:33:20,373375786,Earth,False,10537,12841
212,1290674065666179073,"All of this and hardly anyone, but a few people without brain damage from all the news narrative, are seeing that this is civil war. I'm not going to tell anyone to wake up, it's passed that, so stay asleep. Covid is real, but so is liberty. Wear a mask or don't......",0,RobertM1982,Play games. Speak truth.  Live life.,,226,85,2017-03-20 21:54:54,843943961530191872,"Wilkes-Barre, PA",False,12170,2418
213,1290677350552571905,True words @anirudhofficial ! Love towards u is like COVID 19 Increasing day by day!!! With love #anirudhians Let's go crazy ,1,Anirudhtrends,"@anirudhofficial veriyan 😎 | Spread #Anirudhism🤘| 💝 ×1 post , ×3 twt💝 | Let's go crazy! 💙 | #anirudhian can follow💯",https://t.co/eOYvCI5qWO,21,174,2020-03-25 05:19:37,1242682473290420225,"Albuquerque records , chennai ",False,3992,1161
214,1290676641878773760,And wants 357 million to re-do the West Wing to make it look like a casino....with COVID relief funds meant to help the starving and our if work ppl,0,corbijo,"Certified Energy Practitioner/ RN/ Massage Therapist
Enjoying Life and looking forward to new and exciting things.",,2540,291,2009-08-24 03:43:53,68318187,Washington State,False,9102,14176
215,1290677249067192322,"As GOI had decided to reopen all businesses except few keeping in view to provide relief to the people of India for their livelihood. So, if these are allowed why test is not possible by taking all precautions as per the Covid-19 Pandemic guidelines of GOI. Please think. Regards",0,harminder73,,,27,14,2017-10-31 12:45:15,925342906725965824,Amritsar ,False,68,12
216,1290674963582799873,"I hope they're able to go without a bubble. But when I see the Covid success numbers of leagues in a bubble like the NBA/NHL, and then what happens with leagues not in a bubble like MLB, it really makes me question if non-bubble is doable.",0,ChrisDunnells,"Managing Editor of @SaintsCSC covering the #Saints for @SBNation. Formerly with @DKNatn, @WhatCulture. Husband, father, attorney. christopher.dunnells@gmail.com",https://t.co/DJ4WrwSMsb,432,1238,2011-04-18 19:48:01,284178799,"Jackson, MS",False,80,18759
217,1290676909483995136,Measures to contain COVID-19 led to @KendraScott's retail stores being shut down w/ its primary distribution center reduced to minimum basic ops. See how we helped them to quickly implement #ShipFromStore + #ContactlessPickup capabilities. #PushPossible https://bit.ly/383kYGU,1,ManhAssocNews,"We help the world's top brands solve the most complex business problems in #supplychain, #inventory & #omnichannel. #PushPossible",https://t.co/fTn9e8WNlg,1687,9757,2009-03-18 16:00:41,25096188,Global,False,2272,18282
218,1290646961553645568,How did Google become such a horrible search engine? It can’t find me a single news item in English that doesn’t mention Trump or corona virus or pandemic? Other searches are just terrible also. Most searches not news related in the regular search come up with news items. ,0,ffootballfan123,,,1436,150,2011-08-28 20:42:55,363870359,,False,2654,12535
219,1290676121885958144,Follow the link below where you can view our brief guide to restrictive practice and ways to reduce its use during the COVID-19 Pandemic and beyond: ,0,AQuA_NHS,We are the Advancing Quality Alliance. We support our members and customers to improve the quality of health and care across North West England and beyond,https://t.co/sBarZvfKvW,579,6124,2012-04-12 14:09:14,551889886,"Sale, M33 7FT",False,2071,7917
220,1290674193500196864,Broh you'll get yourself into trouble . That video is from way back. You know how this guys are sensitive about Covid 19 issues,1,DJBUNNYWORLD,Sagittarius 🕎| Resident Dj🎚| Club DJ 🎛| Promoter |  marketing agent | Certified Hustler🇧🇼✌,,1664,910,2020-06-23 09:40:50,1275363125508935682,Botswana,False,535,268
221,1290655959300308993,How many new country songs will have the words Covid or Corona in them? Probably all of them! ,0,PapaKelch,"Distance yourself from the media, and the toxicity of social media!",,2296,3114,2013-01-19 18:38:39,1104368083,The Ville,False,45055,104976
222,1290674620719411206,Health Ministry Says Covid-19 Recovered Cases Double The Active Patients; Fatality Rate Lowest Since First Lockdown ,0,VeerNews1,Breaking News and Top Trending News,https://t.co/69ks2v2u0Y,23,14,2020-05-08 04:20:52,1258612764127514626,Rajasthan,False,1,1653
223,1290675276511432705,"Since the start of the COVID-19 outbreak, @witfacilities employees have been working hard on campus, sanitizing and reconfiguring spaces, establishing social distancing parameters and making upgrades to several areas https://bit.ly/2BWVfnU",1,WITNews,"Wentworth is recognized for its focused academics, cooperative learning, innovation and entrepreneurship, collaboration and partnerships, and ideal location",http://t.co/25Cc6j4nET,573,2918,2009-06-26 18:35:42,51170186,"Boston, MA",False,1250,3301
224,1290676623545643009,"I believe he's the one who demanded that post, he's said to be against the appointment of DJ Biscuit (Obadiah Moyo) in the first place and reports say he wanted to head the Corona virus taskforce.",0,Tafaratc,"Academic, Entrepreneur, Media & Sport. Price is what you pay, Value is what you get. #HalaMadridYNadaMas",,4338,3151,2010-06-10 22:32:43,154306096,,False,34586,24143
225,1290674309325819904,"I think its really lame from UEFA to put that weight on the clubs. Not even making an effort to adapt to the new “corona times”, just throwing the responsibility on someone else’s shoulder. I’m angry (but not surprised).",0,vonwegenathalia,ich kann kaum laufen aber sieh mal wie ich tanz,https://t.co/jFC6neVMup,398,872,2009-03-28 03:52:10,27173409,"Friedrichshain, Berlin",False,12765,95574
226,1290655979533750276,"How is the ground breaking ceremony even allowed at the moment? Corona doesn't differentiate between religions, BJP does. Obviously you know who the bigger virus is",0,aditya0912,"MBA @MDIGurgaon , Engg. @iitismd
Sports freak, Finance enthusiast, Quizzer.
#lfc #barca #nadal #esp #dravid",,2454,1014,2009-03-09 19:02:58,23481599,Indore/Mumbai ,False,1530,66574
227,1290675651775799296,"No Step, No KD, No Klay, No Kyrie. Season was already iffy before COVID, big names not playing. I want to see the best of the best go at it. Lakers lost key pieces. Its just a diminished season period. You all have a right to enjoy the product they scraped together.",0,TeeHottie,,,1407,311,2009-08-25 19:22:46,68781285,"North Carolina, USA",False,6720,7000
228,1290642830377881600,funny cause the us had massive bread lines and food lines in response to corona virus because of how unprepared we were and because of how faulty a system like capitalism is,1,oknataaniel,"he/him, leftist, progressive, marxist, idk i care about human life ???",,259,82,2020-05-12 02:34:17,1260035468583768064,,False,2792,1270
229,1290673886472724480,Stupid indeed. I’m apolitical and I want people to think about something. How are these people so concerned with the spread of COVID but they’ve allowed these protests all over these Dem run cities? We’re those conditions not ripe for spreading. But we had no concern for them ,1,TheKoolKennyD,"From Newark, NJ now living in VA. Just enjoying life and living it to the fullest.",,61,57,2012-07-12 19:18:13,633975215,"Va Beach, VA, USA",False,726,2017
230,1290673662094274561,"If they had the ability to reason, they'd recognize their behavior will cause an extreme spike in health care costs as the insurance companies recoup their COVID losses. But, of course, they'll blame the Democrats for that too. Personal responsibility? Not on their menus.",0,PamBoling,"Copy Editor | Writer | Photographer | Adventurous Spirit | Wannabe World Traveler | DV Advocate | Justice Crusader
Keep your naked face far away!
#GemsOfLife",,1288,1634,2014-03-07 22:45:09,2377756129,"Las Vegas, NV",False,22273,12187
231,1290651008834641925,U see why you fool? You didnt know we in corona era! your own polling station should be a walking distance cause you live around bus people! Are they all one family! Think nigga think,1,Kofihercules,#🤫Susubribri🐆,,179,7,2019-10-15 14:18:48,1184111340165746688,"Greater Accra, Ghana",False,44,698
232,1290666246535614465,American Exceptionalism is me feeling like I have to take out a dementedly huge loan to live on campus just so I don’t give my mother the corona virus which would kill her,0,laurahoIIis,22. Theatre Goblin. Mothman enthusiast. Queer and unforgiving.,,819,231,2018-01-17 04:03:47,953477928515522560,,False,23119,8434
233,1290651280306769924,"As soon as Corona is done having HER moment, I’m running straight to church!",1,hercomplexion,"We help women of color get clear on their goals, increase their income, & create generational wealth. Subscribe to our mailing list below.",https://t.co/LX3kbcQsIN,0,0,2019-08-17 15:21:55,1162746346761310208,"Nashville, TN",False,0,5
234,1290674321451618304,It stopped for a little while during 1st COVID #lockdown but they came back. #USA #UK Increases Respiratory illnesses &amp; more All those streaky clouds are #chemtrails The place is being poisoned. 'See What In The World Are They Spraying? https://youtu.be/rEUg8uLoZNY. #Geoengineering,1,freedomgirl2011,"“When all of us band together against injustices and in defense of privacy and basic human rights, we can defend ourselves from even the most powerful systems.",,3497,2648,2011-02-05 19:26:46,247878466,USA ,False,35576,143967
235,1290677132587401216,"Our staff is COVID-19 free! We hope that all of our donors and supporters across the world are staying healthy and up to date on all COVID-19 health and safety precautions, just like we are at Daraja Academy. As seen here in our staff’s temp checks &amp; COVID education! #wearedaraja",0,darajaacademy,Daraja Academy is a boarding secondary #school in #Kenya for high-achieving #girls living in material poverty. We #empower girls to be agents of change.,https://t.co/h3khr8t2Gh,696,1403,2008-10-15 18:27:28,16788526,"Nanyuki, Kenya",False,1130,3174
236,1290677310711095297,"With your support, Habitat ReStore is adapting to the new retail world amid the COVID-19 pandemic. Thank you for standing with us as we raise money to build more affordable housing right here in Dane County! Read more: ",0,ReStoreMadison,Both Habitat ReStore of Dane County locations sell donated building materials to the public. Proceeds help build Habitat for Humanity homes in Dane County.,https://t.co/vqb7XPHpgc,485,819,2011-09-23 16:38:00,378683106,"Dane County, Wisconsin",False,461,1835
237,1290677267669168128,"Me too - they also block me so I can’t respond lol. I largely ignore them because some people are ignorant and happy to remain that way and the rest like conspiracy theories because they explain why shit they don’t like is happening (covid,social uprising etc).",1,LindsayAnneFos1,"Mask wearer. NDP for life. Clean and sober but still kind of pissed. Proud Nana, Mother to 5 cool adults and all kinds of rescues.",,600,185,2020-05-13 13:52:57,1260568647711576073,"Toronto, Ontario",False,1961,700
238,1290676816466804744,"Seems clear that in the words of someone on here a while back, as the Tories realise that only a few of those who work in theatre would ever vote for them the industry is expendable. Using Covid as the screen is so very 2008 Bank Crash and Austerity. ",1,iamfinlay,Actor @ITG_Ltd Voices @AnotherTongue. Available for mischief upon polite request. DMs open. YNWA.,https://t.co/KiRr8Lyoh9,1137,1718,2009-03-13 14:11:04,24175889,"London, N5",True,9764,18901
239,1290642745384734721," Corona, lockdown airports, travel drama, fast busy life! You can name it! But bringing loved ones together in one fram was my vision from a very long time and my task since Corona started. Inspired by Spike-V @gaming_pc_emagazine And... ",1,Cretvo,"LED 3D Puzzle and Craft workshop (LTP) Learn through Playing Play, Create, Assemble parts together.  M: +4571469287 @cretvo #cretvo",https://t.co/6nCupEOZh9,87,288,2017-06-03 12:20:45,870978558918787073,"Vejle, Denmark",False,383,899
240,1290663655042879490,"LISTEN TO OUR NEW PODCAST: Wait Til You Hear This! Episode One: Corona Don’t Care American ”Hidden” History Truth About Testing Top Stories Of The Week Our Message of the Week If You Don’t Like Wearing A Mask, You Won’t Like Wearing A Ventilator https://podcasts.apple.com/us/podcast/wait-til-you-hear-this/id1521567076 42",1,VippusaO,NON-VOTERS ARE UNDEFEATED. THEY'VE WON EVERY ELECTION. Join https://t.co/5csCrsXWsk to change that & help save DEMOCRACY from Tyranny. https://t.co/qkljCYU9pk,https://t.co/BnfUvpY4bI,3385,2063,2020-02-07 14:49:27,1225793633342935043,USA,False,84,29118
241,1290658665398185986,"One working staff in DOK 10 asked me to take off my face mask in a very rude way! His excuse was he was not able to hear me when I wore a mask. That is obliviously NON-SENSE! I wore the face mask to protect others from the corona virus, but was not treated with respect.",1,baiguannan,"PhD, Public Health",,49,30,2015-03-24 22:06:29,3111812345,"Rotterdam, The Netherlands",False,18,23
242,1290674595205468162,I understand Arsenal need to spend more as they need CL football. Arsenal fans hate their owner and we've been told we need to wait and see of the impact of Covid-19 before making any moves. Would just be frustrating to see a club like Arsenal show more initiative ,0,MakeUsDreamLFC5,LFC supporter who also watches MMA and NBA. History graduate.,,1404,2357,2014-07-13 15:07:56,2637147086,England,False,5047,25837
243,1290640615345131521,Again do you even know what one is just saying but those people may well be idiots or even racist but they are far from fascist if they where the thing that you accuse them of by now there would have been a full blown hostile takeover much like the beer hall putsch,1,I_h8_scum,my pronouns are sir/highness I am royalty gender,,62,15,2016-09-28 13:10:34,781118904173289472,"South East, England",False,499,5190
