,id,tweet,label,screen_name,description,url,friend_count,follower_count,created,uid,location,verified,fav_count,tweet_count
612,1290676110561353745,"Community Can Send Well Wishes to Hospital Patients During COVID-19 Outbreak | Henry Ford Health System - Detroit, MI ",0,Theguesttable,A New Way to Make Sure Guests are Seated and Happy #theknotpro  #seatingchart #eventplanning #eventsoftware,https://t.co/wORxjiqrst,86,82,2017-10-11 21:01:17,918219980247916549,"Detroit, MI",False,457,123
613,1290664782455083012,Corona virus was increasing Day by Day and many people are loosing their lives. But in this pandemic time some people are behaving very badly as untouchables towards with people who are fighting with corona positive. ....#Continue...,0,IamSappaRavi,"ఒకరికి మర్యాద ఇచ్చి తిరిగి మర్యాద పుచ్చుకోండి.
మీకు చేతనైనంత వరకూ ఎదుటివారికి సహాయం చెయ్యండి. 
అన్నం లేనివారికి అన్నం పెట్టండి.
అందరూ బాగుండాలి!🙏🙏🙏🙏",,521,17,2016-01-19 12:18:06,4782988542,Pedapudi,False,2081,306
614,1290676330514784256,not saying they are there’s a probability of them doing so bc vmas is the first event to be in a venue since covid but i highly doubt bighit will make them go solely for a performance that will risk their health,1,RETROYOONlE,skirts ‘nd chunky shoes,https://t.co/n6fEwhFhQb,609,766,2019-09-10 01:05:00,1171227993412374528,SHE!HER¹⁵ byf read carrd ,False,1001,997
615,1290660132708405248,"This world has never seen anything as close as the corona virus. Those who chooses to be in denial and won’t repent will be destroyed by God himself. Take it, or let it alone.",0,RaymondBey34,,,1,0,2020-06-20 18:00:32,1274401719221436417,,False,2,64
616,1290676097697427456,"The $DECN SCAM SEC Quote: “Petitioner made these claims even though it had never manufactured, let alone tested a single COVID-19 kit using the method it promoted.” Happy Trading but don’t get caught holding this bag. Just a matter of time before this SCAM gets shut down IMO",0,investor6969,"Guitar Player/Musician, Investor-Day/Swing Stock Trader-Play The Day Trade, Not The Day Dream-, Biz Owner, NY Giants fan",,47338,51174,2011-05-05 11:40:28,293458690,"New York, USA",False,598,10552
617,1290675020520280065,Now if only we could get trump to leave for his terrible science denying response to Covid.,0,kurtimus,🤔 Recovering Publicist; my kids other dad; full time parent; part time getting into some “good trouble”. America deserves better than Trump. Don’t 🇺🇸 #BLM,https://t.co/yrcmIUaF5h,793,245,2016-03-24 16:35:48,713041637664894976,Malibu adjacent. ,False,3344,7374
618,1290644428307214336,@fsarsah come see your people. You put people for truck inside like sardine say make dem go do voter ID card but you say make students no go school sake of corona. Ano see useless party like NDC before ,1,guyguyameyaw,Deutronomy 6:4 team #GOD #SOCCER #EPL #LFC  #KOTOKO #believeOVAhope #HoldNothingBack,,1140,1093,2011-02-22 03:55:17,255832382,Accra- GH,False,8444,7654
619,1290676545741357056,"Going to be running daily journals from the Fourth Portal in Great Yarmouth, outlining the situation inside and out as Portal B attempts to establish itself in this time of Covid-19, fear and economic disruption. #technology #4IR",1,PLATFORM7events,Platform-7 creates live art interventions in public spaces exploring how people form opinion and reach important decisions.,https://t.co/SZMCdY1e1N,1123,884,2010-10-22 15:04:42,206236158,"LONDON, ENGLAND",False,3293,6888
620,1290655939046014985,"hello, good morning, i would like to share a real-life example of the epitome of selfishness regarding this pandemic: an engineer of mine is constantly yelled at to wear his mask correctly. he's had multiple corona scares -once with symptoms, twice in a week bc of exposure risk",1,kimbylough,#blacklivesmatter #acab #nojusticenopeace,,396,165,2010-02-25 20:51:05,117525299,"Pittsburgh, PA",False,5329,9596
621,1290673756122370052,"I’ve honestly given up watching/ giving any attention to media outlets re COVID 19. I systematically check @ProfKarolSikora on twitter every few hours. No political slant, uses figures to demonstrate a point and is so much more informative! #thankyouKarol",1,gilb03,,,134,203,2009-05-17 13:19:08,40657401,"Warrington, England",False,2329,5739
622,1290650373573804032,Am realised corona is boring. Next year we want different something like vampires zombies . #justkidding #allahraham ,1,parvez_shames,,,43,9,2019-07-01 06:28:22,1145579882799198208,,False,108,47
623,1290676344238608384,Tonight! Meet with your local ward councillors and share your experiences of the COVID-19 pandemic at the first ever virtual #CommunityConversation in @lbrut on 4 August. Register to attend here https://bit.ly/2Oih3Nt and have your say about what matters most to you.,1,RichmondComLink,We are @LBRUT’s Community Engagement Team. Follow us for our latest community news and Community Conversations,https://t.co/piA8q9hi7o,812,2729,2013-03-21 13:40:34,1285990716,Twickenham,False,658,17234
624,1290672386589642753,Someone wrote a script for movie but due to corona no director accepted the plot but BJP leaders found it perfect on the backdrop of Bihar elections! Replaced the characters of the plot with deceased persons &amp; circulated the third grade movie story via brainless leaders - trolls!,1,AnaghaAcharya,Robust Web Portal Project Mngt - Expert in Dashboard Requirement Analysis - Digital Media Mngt - RTs Not Endorsement #मराठी #म Views personal | Indecent भक्त 🚫,,1544,12731,2013-07-19 18:40:22,1606500846,"Mumbai, Maharashtra",False,13844,26321
625,1290676022258491393,"@realDonaldTrump Why should someone that has a job get a stimulus check, that is not really fair in my opinion? Us that have lost our jobs because of COVID-19 need money now! I am appalled at the fact congress (both democrats and republicans) cant agree on unemployment aid!!!",1,CraftDacraft,,,9,2,2012-11-18 07:56:59,955055996,,False,0,23
626,1290671793984897025,"Still raging I took my 13 year old cousin to the Hancock during the day and its 18+ even during the day. Students have gone, pubs empty cos of corona.. youd think they'd change the rules a bit. The £1 pint days have loooong gone",1,phoenixfelis,keep it cute 💞,,142,379,2012-08-13 15:27:06,755336198,,False,413,9392
627,1290676932909117440,"And that's why @JusticeCanadaEN and @ONAttorneyGen need to let the judges, Crowns and defence lawyers on the front lines find solutions to the problems caused by COVID, and not take away their discretion with arbitrary new measures like they did with prelims and jury selection ",1,TheDefenceGroup,Criminal Lawyer and Managing Director at The Defence Group,http://t.co/bwFwpfbFg9,618,454,2013-03-01 20:26:19,1231300946,Greater Toronto Area,False,1082,8307
628,1290675567348420608,Stop sabotaging the Census. Give organizations the times they need to accurately count their communities. Congress can address this impending disaster including the necessary extension and Census funding in any COVID-19 relief legislation. ,0,UrbanIndianNews,The National Urban Indian Family Coalition (NUIFC) is a network of urban Indian organizations that advocates for American Indian families living in urban areas.,https://t.co/CYxd5IcIVT,311,1221,2011-06-13 05:03:53,316251776,Seattle,False,227,303
629,1290662928061018119,"Really sick of realtors from CT betraying the rest of us and specifically aiming to have city people move in up here. Thanks for causing the second wave of corona in this area, you’re a cunt",0,whatthemeep,I like plants,,124,132,2010-10-11 13:55:31,201273024,"East Canaan, CT",False,6013,4386
630,1290663678220668930,"It is scary to watch this. Anyone on the fence should view this. It is astonishing to know that this moron is at the helm. Sitting with his 3 photocopied pages, trying to deny the critical situation with Corona in America? ",0,designergirla,PRODUCER/DESIGNER. Creating innovative products in a wide variety of categories. One of my favs. https://t.co/2IoCbYx6ny,https://t.co/0PyHDkLPg9,21055,29556,2009-03-12 19:24:17,24012890,COOL CITY,False,7533,73254
631,1290642564023017475,"@arnab5222 @republic @MumbaiPolice @RajThackeray @Dev_Fadnavis Such a dirty politics is going in this critical situation, Mumbai now in control of corona cases that's why opposition and paid media channels like republic tv making personal allegations on CM .#SaveMumbai",1,NileshPDhande,,,36,11,2012-04-10 13:21:22,550106086,,False,31,41
632,1290667307128168448,Get ready for it .....that's not Covid 19 and this may come as a shock to you ....what works on one type of Corona virus doesn't necessarily work on others. Hence the ...actually I can't be bothered you obviously like being lied to.,0,Mooby_Doo,The worst lies you tell - are the lies you tell yourself.,,900,371,2010-12-01 15:15:42,221767099,The World,False,11764,18900
633,1290668604543778816,"It's big jok made by baby penguin ha ha dirty politics see who is saying that bmc, palghr, jiaa, disha, corona, lots of thing gvnt failed everywhere exposed day by day",1,Anita72957191,,,24,9,2020-08-02 19:39:00,1290009152828268544,,False,145,890
634,1290664076192952322,"There is nothing that I need outside my home that will be worth dying for from corona, I'm shutting it down my damn self, no one is coming to my home. call, e-mail or text. I cant' do it. Trumps leadership is again tested, Gov't financial assistance, schools re-opening, election.",0,rozdixon1,,,30,1,2020-01-01 03:26:17,1212213353424146432,,False,196,484
635,1290676830555516930,"Between budgetary challenges, our housing crisis, COVID, our infrastructure deficit and a looming recession/depression, anyone considering asking upper levels of government for $1b for games should be ashamed and embarrassed. We have many bigger problems. #HamOnt",0,KingAndJames,"Wear a mask. 

Blocked by Bill Shatner.",https://t.co/FQuv7v99co,3793,5531,2009-04-24 13:18:53,34921899,The great indoors,False,49174,37495
636,1290674684095275011,It's the people wearing the masks that just 'don't get it'. Take a look at the real risk Covid 19 poses (not the government and media propaganda) and try and find any justification for any of this madness.,1,IanPowe2,,,12,2,2020-05-12 17:52:40,1260266608896937992,,False,171,146
637,1290677646360219649,No PPEs No Work Forward with Covid 19 Risk Allowance Forward! #SAMWU wish Worker's a Happy #Women's Month! Let's Wash our stay at keep social distance wear your mask always. ,0,NkqubelaSotsho1,News Government Politics Local News Sport News,,2462,357,2016-06-27 15:53:29,747457835383029761,"Mdantsane, South Africa",False,7901,6213
638,1290674113141448704,"In line for a Covid test and the lady behind me looks like death. If the wind was blowing the other way, I’d go home.",0,Jaxson313,The only party I’m beholden to is the cocktail party. 🍸 #Rogue 🇺🇸 ⛳️🏌🏻‍♀️🥎🇺🇸,,2733,2094,2012-10-10 03:11:02,871031503,"Detroit, MI-Born & Raised ✋🏼",False,32505,6872
639,1290673778779799554,"First time listened to show since Edm/Winnipeg game back in market Pre Covid, good show today , sports back",1,smoothkopy,massive sports fan and great father of 2 great kids.,,3699,152,2012-12-08 00:51:15,996181387,,False,1494,2713
640,1290677254335365120,"The challenges our state is facing are daunting. We need real solutions in this moment. We need to learn the lessons of COVID and listen to scientists before it’s too late. Join us Tomorrow night, August 5th, at 7pm ET for our virtual campaign kick-off! https://bit.ly/stimulus-kickoff",1,MikeTidwell4,Director of @CCAN and @CCANActionFund. Activist. Author. Views do not necessarily reflect the official positions of CCAN or CCANAF.,,73,71,2014-03-02 19:25:08,2369289426,,False,26,129
641,1290675931393200128,Take care. I might do the same for a few weeks. Due to Corona I got the feeling Twitter got even more vile.,0,dinnnadoron,"26, here for the problematic side of Twitter",,509,6,2019-12-03 17:06:08,1201910427837456385,,False,18574,2391
642,1290676283584778245,"Our number one priority is safety – for the people who fundraise on our behalf, and for the fantastic Great British public who are so generous in their support for deaf children. Find out how we’re fundraising during COVID-19 on our webpage https://bit.ly/30AwWEO (2/2)",0,NDCS_UK,We're the leading charity dedicated to creating a world without barriers for deaf children and young people.,http://t.co/yCGx6ByGyw,675,19217,2009-08-28 09:11:46,69545844,UK and international,True,10251,17768
643,1290676901439254528,"What I'd really like is a sequel to True Lies. All the leads are still working, covid aside. Lets get more Arnie less Avatar.",0,tonyandrewgiles,Host/Producer of @recordroomshow. One half of @tigerlabvinyl. BTS Army.,https://t.co/ri3OaB6J7V,640,1093,2015-01-19 09:39:31,2985492310,Midlands,False,14167,13471
644,1290639923138232322,This is why #CorruptGOP are holding up the Corona Virus Relief You’re continued support for the Party of Death is in direct conflict with your lives Get smart #VoteBlueToEndThisNightmare,1,MomMomHolt,#VOTE2020 justice for all! Blue Sheep of my Family Ready to Resist and fight for values.#Russiagate #Putinspuppet #CorruptGOP #GOPGreedyOlePrix,,5001,2075,2012-11-28 13:09:27,976084290,"Annapolis, MD",False,43849,66292
645,1290675753777070080,And for mandating that elderly be accepted into nursing homes with a positive covid result as well as mandating that nursing homes are not allowed to test new incoming residents. Not allowed!! Then took down the mandate from the state web site after you came under attack.,0,alldadsunited,"Hey New York City, Do you feel served by your elected people? Hey USA, do you  trust your elected person who you pay with your hard earned taxes?",,152,39,2009-06-20 16:19:41,49044901,All over NYC,False,407,2341
646,1290674248462131201,"@SaraDaviesCC is doing something awesome during Covid and helping out companies in the north east by sharing content to try and promote their business. We are a north east, Mobile App development business called Mobile Rocket More details in the video by @JacobIreson :) ",1,TheMobileRockit,"Engage Candidates With Your Mobile App
Streamline candidate management and fill more vacancies",https://t.co/7e4cKMZiLy,2532,1135,2013-05-21 19:35:22,1447126628,"Newton Aycliffe, England",False,149,1388
647,1290675385588424704,"When the COVID vaccine is announced in the distant future, the first people we’ll tell will be the construction workers at Broadway Park next door.",0,robothouseOKC,"A creative quartet passionate about research informing effective design and positively impacting our clients' goals. Also, beer. We’re passionate about beer.",https://t.co/CclFSn3tm1,1133,2630,2009-12-01 22:23:33,93957848,"Oklahoma City, OK",False,3136,9584
648,1290675770126405634,"Noted and thanks, we will vote for Biden.. If you want more COVID bodies lined up, more police Brutality, A DICTATOR , A scammer, A Man whose name should end with Bankruptcy , then Vote for #TrumpVirus #KKKTrump",1,Mike43356921,,,8,2,2019-03-22 00:39:25,1108890893464100865,,False,541,168
649,1290674526498500610,"Join COVID-19 modeling experts Nigel Goldenfeld and Sergei Maslov at 11:30 a.m. Thursday. They will discuss their modeling, how it's influencing the #ILLINOIS campus testing, and how the university is using these models in decision-making. https://bit.ly/3kd6zgP",0,uofigrainger,Leading global engineering education and research,https://t.co/ujuZTsIk5S,460,11490,2009-04-02 21:33:37,28425476,"Urbana-Champaign, IL",False,2183,5359
650,1290676775782092800,imagine being so selfish to not wear a mask in a public place. It literally puts everyone at an even greater risk than we already are. We've been down people all week at work because of covid and we were also slammed with people coming in :),0,stoworm_,art hobbyist | 19 | ♌️ | DPS for @TeamSPIRITOW | tweets are my own,https://t.co/TFks6VFU2w,388,241,2017-06-22 18:47:41,877961306258780160,"Florida, USA",False,5368,1227
651,1290674620324954112,"can't we really make this world a better place to stay? I mean, yes, there's a pandemic going on, a shitty government and no concrete plan to lessen the cases of covid. but really?? we only have this platform to have fun and escape that fucked up world for the mean time ++",1,b4ngkeita,ⁱ ʷⁱˡˡ ⁿᵉᵛᵉʳ ⁿᵒᵗ ᵗʰⁱⁿᵏ ᵃᵇᵒᵘᵗ ʸᵒᵘ,https://t.co/ffQgiNVUgD,748,1405,2019-12-21 02:32:07,1208213463031410689,"sad, lonely, or empty? u can always come and lean on me. we'll make each other feel better. let's make this world a better place to stay♡",False,786,1138
652,1290664171986718723,my aunty was forced to reduce the guest list for her wedding next month due to corona &amp; instead of mfs being understanding about the shit my cousin got mad and blocked the whole bridal party ,0,diamondfvngs,"cant hurt me, like I cut off all my nerves. | #HowardU21❤️💙 ♒️",https://t.co/L94LcB9FAi,1682,2491,2010-12-12 02:52:32,225643132,Chi ✈️ DC,False,36406,31568
653,1290666293696372737,"fuck off. schools would become a corona virus hotspot. students and teachers getting infected left and right, the older staff being at an extreme risk. all you care about is money, not the lives of the people. do you not realize the harm of this? do you have any morals? ",1,Soap_The_Scrub,Minor | They/Them | Fluffy! Not a Furry! | Musician | Bastard | Vent @SoapsMind | Artist | Single | pfp by @MadameSocio!!,,266,1199,2019-10-13 00:57:25,1183184898070405120,Streaming The New Gojira Song,False,72138,10938
654,1290663279229112322,so he gonna pretend like that kid who came back to school didn’t just get tested positive for the corona and he wants to open schools? i- ok,1,jentlechild,✿ #YEJI : かわいい女の子,https://t.co/Vo7gOdZXg1,2574,2716,2020-05-23 22:24:24,1264321231454703619,𝘴𝘩𝘦:𝘩𝘦𝘳 🕊𝘢𝘶𝘥𝘺 ₁₈,False,5090,6765
655,1290676225963429890,"Landlords are advising the city to open up so their tenants can pay rent and their portfolios don't collapse despite rising covid cases. I thought I was the dumb one? Do you need other lines drawn from a to b? Let me know, here to help anyone who needs a lot of help!",0,maNic_Cage,I'm vegan,,717,158,2018-07-31 13:44:53,1024289799052701696,"Chicago, IL",False,35681,2304
656,1290636736150687744,"Who is this, Doctor What he had done wrong, Nothing He raise voice on national bill, He can He is in the Jail, in corona time... Release him release him ",1,witterT_,,,172,48,2018-09-22 09:23:56,1043430685212594176,,False,3629,3299
657,1290677431758716928,"I have an odd hobby of loving tableware. Pre covid, I often went to thrift stores just to admire (&amp; sometimes buy) rare dishes. Today I had to look for a shelf, and stumbled upon this. I got it for $3.. this would be about $50 based on the case price. V happy ",0,VBerryBoy,"Ⓥegan • 👨‍❤️‍👨🏳️‍🌈💏 • trans, NB • anarchist • he/him • I'm white • BLM, TRANS IS BEAUTIFUL, ACAB •▪icon image is painting by Francesco Paolo Michetti▪",https://t.co/qQdHv8xwrq,265,326,2019-01-24 06:06:31,1088317102602235904,my cozy coffin,False,17518,11673
658,1290675108994932736,"I can't be the only one who thinks we'll have 3 weeks of schools/unis open from September and then a mad (unsuccessful) rush to online teaching again. Why can't we just deal with this effectively? Covid isn't an annoying neighbor, it won't go away if you ignore it. ",0,HannahSmeth1,"DPLP & Graduate LLB at the University of Edinburgh; LLM in Innovation, Technology, and the Law; Private Tutor. She/Her.",,1422,492,2013-12-30 21:15:20,2252905223,,False,36444,8083
659,1290671372038004739,"Don’t apologize for going to parties... AND THEN KEEP GOING TO PARTIES!! Your making yourself look stupid. And when you catch corona, suddenly it’s “how’d that happen ?!”",1,halleyne181,"Do what I want. Don’t like? Idc😌
#BlackLivesMatter",https://t.co/XMGTbFoq0e,136,167,2020-05-01 22:16:10,1256346674320084997,Minor🦋,False,7222,1773
660,1290640881830318083,"We are Sanatani, and we think about our Bharat but please speak on some real issues like Hospitals and no. of doctors, Rise in Corona, Poverty. Unemployment is main issue nowadays. We are not here to fight with our own citizen. We have to focus on making Bharat Great again.",1,rshubham358,"#हर_हर_महादेव
Youtuber
https://t.co/Y0pqWTJitC…
यदा यदा हि धर्मस्य ग्लानिर्भवति भारत।
अभ्युत्थानमधर्मस्य तदात्मानं सृजाम्यहम् ॥




#जयहिंद",,15,15,2014-01-14 15:45:21,2291322386,Bihar,False,113,685
661,1290661192193708032,"Confronting the powerful with facts & good sense. Remember that? I wish @jonathanvswan could replicate &amp; spread, Corona like, across populist countries' media! ",1,LeonieGreene,Award-winning climate/energy campaigner. Joy of solar. Urgency of climate change (+Covid & Lyme Disease). Brexit miffed & plotting escape... offers welcome.,,4314,4672,2011-12-21 16:01:53,442904755,"London, UK",False,17623,23075
662,1290674643662184453,Typical Bristol CC bringing in another thoughtless scheme. Spend millions on roadworks in the city centre only to ban the use of these roads. At a time when most wont use public transport due to covid..pollution will only build up elsewhere...stupid decision.,1,RebeccaHeptins1,,,19,2,2017-12-04 20:35:16,937782374942892033,,False,65,75
663,1290674627228897280,i truly feel like im going insane being the only one taking covid seriously in the crowd of people i'm surrounded by all day every day,1,thaye_s,taylor ⭑ 26 ⭑ they/them ⭑ NSFW 18+ ⭑ i make art ⭑ personal and fandom content ⭑ im in love with bts and geralt of rivia is bi 🥀,https://t.co/bt3Wv0UM7Y,263,2615,2018-04-21 17:18:34,987742402092978181,US,False,15564,10252
664,1290653712768274432,and then corona said: move back to your country and fuck your chances id getting with the british boy you fancy again haha x ,1,voguestylesH,flowers all round.,,63,706,2015-09-02 13:33:21,3523626195,blm,False,5881,7754
665,1290657442355912706,"This is just unreal! Meaning oh I can’t believe they are ticketing ppl for having a party in their own house.This Corona thing is way out of hand,meaning there is no where near the illness going around 2warrant R freedoms being taken away. In fact, we should make our own choices ",1,madeINTheUSA006,WE DO NOT SUBMIT!,,3822,1542,2013-11-18 16:33:45,2201587776,,False,36363,38569
666,1290676699269660683,#GameboysTheSeries This could also be called 'love in the time of corona'. Everyone should watch this tbh. It's adorably lovely with occasional drips of real feelsy moments. ,1,DramaLets,"I’m Jen and this is the side account for @meowsaystheemo. Come watch me spiral! Slice of life fiend. Multi ish but mostly BTS, GOT7 & DAY6",,394,154,2020-01-28 16:22:49,1222193276721168386,"England, United Kingdom",False,14132,9210
667,1290674118942175232,"That's done on purpose! Don't you both know this is a set-up. It's borderline entrapment. They want you to change it so that you get caught and prosecuted. You may not be too cute for prison, but you don't want to be there especially with COVID-19! Be smart!",0,PeterHatem2,Father - Husband - Special Education Teacher - 49er Fan - Spiritual Advisor - Wildlife Guardian - Warrior for Peace - Militant Pacifist - Fan of Permaculture -,,457,160,2020-03-31 16:02:16,1245018464546361344,White Plains,False,4929,4182
668,1290676579232874498,Seen any good billboards lately? Many people are struggling with #anxiety during the COVID-19 pandemic. CSO created these #billboards to remind us it's OK to ask to for help — and nonprofit community #behavioralhealth agencies like CSO are available for that purpose. ,1,csoincorporated,Clinical & Support Options Inc.,https://t.co/hnsDkR5ot6,328,132,2016-01-05 17:53:56,4716952877,Western Massachusetts,False,719,695
669,1290640893238816771,"I visited the place x7 for the love of this place and its beauty Friendly staff and divine food When corona hit, I was scared for the workers because EC its quite far and they get a lot of International guests. It will take time, so let's support local tourism",1,Naledi1818,Child of God❤ Mother Law 👨‍👦‍👦 Since 1818🎁 Loves 📚 Soul 🎺Life 🙏,,1206,1183,2019-09-04 15:42:17,1169274435519635457,South Africa,False,23570,2992
670,1290674982989762561,Watercolor and ink excerpt from @bighedva’s exceptional Sick Woman Theory. Every few weeks I’m making a new mantra to put up during COVID. This nails so much of what it is to have an empathic view of the world and one’s community. Looking forward to this kind reminder each day ,0,JeremyWheeler,"Artist / Occasional Writer / DJ / Ann Arbor Art Center / The Bang! / Past: VGKIDS, Esquire, DeathWaltz, AV Club, All Movie Guide | cooljeremy at gmail",https://t.co/9DShl8wLmy,1513,1351,2008-03-12 18:19:01,14134072,"Ann Arbor, MI",False,15263,11528
671,1290651381137903617,"Shows in the time of corona, every 2nd row is used + in those 2 seats kept empty inbetween groups. Guests also need to keep their masks on for the whole show. Saw the new Crazy Italiana comedy singing show. Was funny but still hurts that the amazing Rulantica Musical is gone ",0,cslkenny,Very rarely tweet anything actually good,,528,472,2014-09-02 15:40:51,2759411019,75m above Europa Park,False,8489,2514
