,id,tweet,label,screen_name,description,url,friend_count,follower_count,created,uid,location,verified,fav_count,tweet_count
0,1290668519454113798,"Why are you perpetuating this nonsense, anyway? You are privy to the #WorldEconomicForum 'Corona' graphic, which was created LONG before this &lt;cough, not Covid&gt; #Scamdemic ever happened. Is there one 'news' outlet anywhere brave enough to tell the truth?",1,Buster_Guff,"My thoughts are my own, and can at times, seem offensive to the overly sensitive.",,267,280,2016-06-27 08:09:48,747341143919104000,"South West, England",False,4698,10729
1,1290675275169243143,Gotta agree with the guy above. Just wear your mask and stop arguing with medical professionals who make a living off of keeping us safe. Recent headline of political activist Herman Cain developed illness and died from COVID complications from not wearing a mask...,0,asianboyian,"thank you, Logic. 🦾",,822,208,2016-03-22 20:42:50,712379029698048002,,False,18349,3718
2,1290674221081939968,"My sentiments exactly - all these people thinking that he is just stupid. He knows what he is doing by trying to twist the facts - He IS stupid to think that anyone would buy his version of ""we have the best stats in the world on covid.",0,caroline7eliza,"Wednesday ""Shade"" Adams: The Regina George of the Trump community. #FTS
***Member of Former Trump Supporters, sworn loyalty to the downfall of Trump***",,1237,605,2013-06-08 04:51:26,1492020625,"Annapolis, MD",False,43370,5068
3,1290677221091418114,"Hello Ima Single Dad, I Lost My Job Due To COVID-19. I’m Currently Low On Food And Essential Items, Can Anyone Help Me And My 3 Year Old Son Please, Also Retweet For Exposure My CashApp Is ($Ogslim5300) My Venmo is Dunk5300 ",0,UptopSlim53,"Single 👨‍👦 Father🥇💉OTF👨‍👦 N.E.↗️ Getting Better, I'm At Practice 💵 Is Motivation Take Risk And Prosper 🙏🏽 $Ogslim5300",,4999,1162,2011-12-04 06:42:16,427998529,,False,17329,26654
4,1290673917632434177,"@eddiemair This wall to wall #Covid stuff is for most people really boring radio especially with so much out there like @SecPompeo’s attempts at virtual war with #China , truth about a Russisn vaccine, demonstrations in Israel etc etc .. Wake up @LBC",1,BlairToTheHague,"Documentary filmmaker , peace activist, father of two amazing kids.",,717,244,2012-07-08 20:52:10,630592908,London,False,217,1132
5,1290677399655337984,#TuesdayMorning All This Talk Of #Covid_19 Numbers Yet No Talk About That High Risk Community Within Our Community Are Our Homless Still In Motel / Hotels Nope Are Our Homeless Back In The Same Situation Pre Government Roll Up Yes Take A Look Around #vetsrising,1,82nd13,"Husband, Dad T1D / CROHN'S Parent 
 Former 13F2P PROUD MEMBER @iava @codeofsupport #vetsrising Veteran / Family Advocate The VOICE Authority Hates Too Hear 🤨",,2567,1046,2018-09-04 03:12:14,1036814163371220993,California 916,False,45071,25373
6,1290675212879626241,Coronavirus impact: Doctor gives advice for monitoring kids’ screen time amid pandemic — ABC7 Bay Area https://apple.news/AUUgJihfnT9KokYdJL5LZYg #COVID #screentime,1,familyvoices_AL,Our Vision: That every child and youth with special needs receives family-centered health care. RTs are not endorsements. #FVAL #F2F #F2FHIC,https://t.co/drYIufN0K8,190,61,2018-07-25 14:39:56,1022129325791948802,"Alabama, USA",False,115,1723
7,1290676688423092225,"And by “public”, you mean radical leftists that would complain if he told us the cure for covid... oh wait..he did.",1,scott_thereal,"Think for yourself. Constitutionalist Trust in Jesus, or not. Either way, you still get to meet him someday.",,179,378,2017-01-22 10:37:15,823117313528528896,USA,False,8487,8383
8,1290676329457819648,"Are you preparing to head back to the office? We are, and we can’t wait to start seeing each other face to face. We couldn’t do it without the help of our Covid Safety Officer, Flora, who’s making sure the transition isn’t too ruff... #EmployeeEngagement #officedogs",0,helloNKD,We're a next-generation employee engagement agency. We supercharge your business performance through your people!,https://t.co/VVtPLnVvlZ,1179,1145,2009-08-13 16:02:57,65396175,London,False,944,2717
9,1290655204585680900,"How could they care either way? They’re not even playing sports right now because you’re destroying the country with your bungled Corona virus response. Great job on that Axios crash and burn, BTW. Heckuva job, Donnie.",1,dolgre82,"So much to be grateful for: my hubby, kids, family & friends, my patients. Animals, music, nature, camping, science & medicine. Truth. Freedom. Booze. RN/CNP",,156,69,2013-10-16 17:56:31,1965253352,"New Mexico, USA",False,3347,6710
10,1290675900523130885,"Im actually more insulted by the fact that he said ""nobody has done more for black Americans than me"" while not even trying to back up that claim with stats, facts and figures. We dont even get misleading or misappropriated graph data like he did with Covid deaths.",0,hegonbealright,They call me popsicle because Im cool but Im sloppy.,https://t.co/uD6nXMKmka,0,6,2019-03-01 17:33:21,1101535912251572224,YouTube:,False,134,393
11,1290675108982296576,.@LawDavF sat on the Chilcot panel Here he says the Covid-19 public inquiry must not be based on previous models. We will need something new ,0,prospect_uk,Think again. Think Prospect,https://t.co/0U5ZAE7lg2,4399,50597,2009-02-20 18:02:06,21417687,London,True,1462,105820
12,1290674494114127879,"""Instead of taking the summer to hone arguments against returning to the classroom, administrators and teachers should be thinking about how they can best support children and their families through a turbulent time. "" Literally all I think about. Well, that & dying from Covid.",0,RCMeg,"Asst Prof & WPA, Sonoma St. Formerly, Dartmouth Inst for Writing & Rhetoric & #usf Writing Studio. #teamrhetoric #firstgen (views mine, obv) she/her",https://t.co/3FtnbWfxRJ,1412,1793,2011-10-21 23:21:03,395611908,"Rohnert Park, CA",False,32442,12973
13,1290675165207158789,Moral of the story stop getting too technical. Make noise after Corona,0,SangayKarp,Calm and Cribby- GNH'ed out Man,,70,138,2012-08-11 01:29:35,750404258,Everywhere,False,59,3864
14,1290638204974972930,"Thanks @AmitShah . Your dedicated effort and affection towards Delhiites, revived the corona pandemic situation from worst to better. Delhiites proud of their home minister . Now the time to Take care if yourself sir @BJP4Delhi",1,divybhargav1,Jai Shri Ram 🙏🏻,,521,144,2018-06-17 06:28:38,1008234948833284103,Delhi NCR- Noida,False,12990,3048
15,1290676779284402177,"To all the people who stay saying “watch, as soon as the election is over later this year Covid will just magically disappear”.... I hope you’re right. I’m OVER this shit. I just want life to go back to how it was back in January &amp; February ",0,ValleyGrl89,Cali girl 🌴☀️ Kentucky livin' 🌳🐴 Mexicana 🇲🇽 31 ♑️ Tequila lover 🍹Wine drinker 🍷coffee sipper ☕️ Momma 🐻 of 2 girls 🎀💕,,289,129,2010-06-01 21:38:59,150802156,LA ➡️ KY ,False,1026,10858
16,1290676237770186753,"Hey @ucdavis - implementing paid parking is not the best idea. My essential lab workers, if not able to ride, will need to take the bus and put themselves at increased risk of COVID.... This new policy means an increased risk of exposure to all who come to campus..",1,bradylabs,"Getting to the root of biology, one plant at a time.",https://t.co/1TgLYwcMMv,620,4297,2014-01-15 05:40:29,2292210726,UC Davis,False,6236,1661
17,1290676712615874561,"you know what... maybe corona gave us a W and bts performing at the vmas virtually is a god sent cause not only they’re in the comfort of their home/country BUT we get decent camerawork &amp; lighting, full on stage set up and we can turn that sht off as soon as they’re done",1,p7radise,fan acc.,https://t.co/d17EBhEJok,547,2094,2018-10-09 23:19:18,1049801507661651970,"22, she/her",False,71361,29000
18,1290650767389528065,"In view of the increasing challenges that State Transport (ST) is facing due to Corona crisis, a decision to provide ₹550 crore to the ST Corporation has been taken which shall definitely help in alleviating the financial difficulties faced by the ST Corporation.",1,AjitPawarSpeaks,"Deputy Chief Minister, Maharashtra | Member of Legislative Assembly, Baramati | Nationalist Congress Party Leader.",https://t.co/uQNhuGDrVE,33,832135,2014-03-07 07:49:55,2376754662,"Maharashtra, India",True,82,4355
19,1290675865840484352,We are excited to partner with French magazine @laviedesidees @booksandideas to exchange a series of essays about COVID-19 in a global frame. First up: examining the conditions under which some continued to work in Wuhan during weeks of confinement: ,0,PublicBooks,"Public Books is an online magazine of ideas, arts, and scholarship.",http://t.co/aUN6rCm7Ah,1347,15543,2012-01-22 11:19:00,470991619,,False,5267,20271
20,1290658516408193026,"The corona virus hoax Political hunger games. This is the new world order guys. Wanasema ni ""THE NEW NORMAL"". ",1,SimonGako,Entrepreneur.,https://t.co/UK0CUAZK82,5930,5472,2009-11-17 14:32:22,90640725,Nairobi,False,1632,9026
21,1290635796630863873,"Pandemics and disinformation change the rules. There is a company selling essential oils on Facebook to ""cure corona virus"". Should that be allowed to stand?",0,kevinfolta,Academic scientist obsessed with sustainable food / farm technology and strategic communication.  Talking Biotech Podcast host. https://t.co/ZTCpQm6tVz,https://t.co/YdSb4815Ks,988,24561,2010-04-03 13:38:29,129193125,"Archer, FL",True,27289,42340
22,1290661629605171200,"That dedicated gym are bad fuckin conmen, signed up to the Wirral one which was meant to open on the 14th march, never opened then corona happened but they haven’t given any update&amp; blank the comments asking about it but apparently I’m in £54 debt with a gym that doesn’t exist ",1,ChloeOhanlon,Free your soul🔮🌙🍄🌸🌈✨💫🌞,https://t.co/F1tv3wn1fS,3168,3282,2009-12-05 11:02:45,94772179,Wirral,False,19550,21388
23,1290677223276584962,"Not saying virus doesnt exist. Covid has been around since 1953 or 54, just saying htat government lied to you and you cannot afford to do nothing and throw your freedom in the garbage. Now they want your air. Can they have it?",1,Seaphre,"Thrown into the storms of life, I was forced to swim with dolphins in the deep sea, where treasure of life reveals the light  https://t.co/0klpYMCjLA",https://t.co/bUzF0b0ND9,7091,6977,2011-03-19 06:14:06,268657863,California,False,3438,36688
24,1290674239406780416,Helping to reduce the spread of COVID-19 can help small businesses stay open. #SupportSmallBusiness,0,GoogleSmallBiz,"We provide #smallbiz owners with tips, tools & resources to grow their businesses online. For support with reviews & your Business Profile, contact @GoogleMyBiz",https://t.co/NztVdP24hz,354,149451,2010-08-05 17:03:02,175102903,,True,3856,6419
25,1290655848960851976,Please dont mess our lives and again spread corona cases byopening universities soon. let corona be almost finish once,1,AhmadTaaibah,"Medico 20
wandering soul☻",,52,17,2020-02-20 02:28:38,1230318264166866946,,False,35,21
26,1290677389584928768,"COVID-19 has forced acceleration of previously slow-moving digital transformation trends like telecommuting, on-demand food and services, and virtual events. Behind all this is cloud technology. #digitaltransformation #cloud #covid19",1,ArenaSolutions,"Arena Solutions enables companies to design, produce, and deliver innovative products quickly. Speed product development processes with connected #PLM and #QMS.",https://t.co/u13Y6Fo0ky,1095,14015,2009-02-03 06:39:22,19958058,"Foster City, CA",False,1446,10515
27,1290676367798022157,"COVID-19 is a powerful disruptor, responsible for the delay of almost 450k property transactions. It goes without saying, everyone must take action to minimise the ongoing impact. Agents need to make sure their workplaces are COVID-secure, here's how: http://ow.ly/Bqq750AQt3U",1,uk_nava,NAVA Propertymark auctioneers and valuers have the highest professional standards so customers can benefit from independent redress and client money protection.,http://t.co/haNeAUh5b2,916,1199,2011-01-31 14:18:56,245358268,,False,397,5200
28,1290642475258990595,Still mad I didn’t get to have a tenure party this summer. I was going to get a custom sign that said Tenured Ass Bitch then hang it in my office when I went back to work. Fucking corona really messing with my plans to flex on em. ,1,DrSamiSchalk,"Sarcastic fat Black disabled femme (She/her). Research on #race, #disability & #gender. Author of #BodymindsReimagined. Rep’ed by @CCMNTSpeakers.",https://t.co/QvRq0JN9mk,889,25573,2011-12-24 15:55:12,445586377,Stolen Ho-Chunk Land,False,47133,20954
29,1290676451868643337,"I mean, it’s probably slightly inflated bc if covid right now but yeah either way it’s like include it since we already bought access to the show",0,Just_Seth44,"𖧵 I’m love Min Yoongi & those Bangtan Boys - fan account | he/him, 27 ∞",,297,154,2016-11-13 23:34:15,797945704232652800,Bangtanland,False,88637,39171
30,1290648580500475910,"etc... But it was good I laughed so loud. She said it’s fine if I think she’s crazy, and I said that’s why I feel safe to tell her how I feel about all this corona bullshit, too. Anyway, I feel my position is more scientific, of course, and also more ‘spiritually in tune,’",0,VoluntaryJapan,"✌🏽Individual Self-Ownership. Voluntary Japan, Voluntary world✨ Promoting Unschooling, Free Markets, Free Minds.",https://t.co/Ev6rVvhcaW,1030,1473,2016-07-06 06:28:09,750577054073155585,Japan,False,12074,7655
31,1290674139087478785,"The only thing I didn't complain about was using hand sanitizer. For the fact that I had to handle coins for the car park, and I've always had a pet hate for handling money, even before covid ",0,SUSPICIOUSsMIND,I can handle the truth. It is the lies that annoy me. It is okay to doubt what you have been taught to believe. Awaken. Linguist. #CivilDisobedience #π,,313,1237,2014-10-16 15:34:25,2834230515,,False,288,20413
32,1290663488659034115,"Sure, if someone changes how they act and you can see they've changed, all for forgiveness and support. But the Toby Fox thing and the corona video just show he hasn't.",0,Infindox,"29/bi-pan/🌟❄(she/they)★Laid back, wanderlusting adventurer that is obsessed over life.★
GOAT: @magikoopa24
Icon: @toukitsune
XIV: Absenthine Starfrost (Faerie)",https://t.co/AQHKQomtmV,1779,1176,2009-08-27 22:49:48,69429602,Inbetween the universes,False,20276,134862
33,1290676590435807236,"Our local park that leads into the ravine is holding up to significantly increased usage and we have definitely seen an uptick in laneway strollers and smokers since late April and COVID. Here, it’s been manageable, w/ a few disgruntled by increased #slowlane noise (minor).",1,biltonlaneway,Greening an orphaned patch of midtown Toronto #TOstpauls laneway. Our proposed name was approved by city council ; now in #slowlane #raspberrycane growth mode,https://t.co/ZZbqEEskfp,383,159,2015-03-21 22:05:46,3102949829,"Village of Forest Hill, Canada",False,1180,1299
34,1290676756895141888,"The future of #commercialrealestate is data, particularly as the industry and economy recover from #covid. We're building a new way of sourcing and securing #occupiers @wbtc_uk - check us out!",1,MichaelPryke1,"Co-founder at @wbtc_uk. Part of @pittcueco. Jolter on Start-Up and Growth stuff @jolt_io.

#growth #strategy #brand #purpose #proptech

Hit me up!",https://t.co/AUSi7QgqCU,641,311,2016-02-25 21:17:18,702965615728971780,"London, UK",False,124,155
35,1290657084661551105,"I can't wait for what BTS In The Soop bring to watch, according to the teasers, permission to wait for nice viewing moments. If something good can be said about the corona, #BTS have got even a little ""to experience a normal life"". #MTVHottest BTS @BTS_twt",1,Zipitii1,🇫🇮⟭⟬💜⟬⟭ OT7🎵🎶,,112,99,2019-01-16 13:11:43,1085525004605943813,,False,11346,2268
36,1290643693154848769,That's what's up bro. I love seeing their usual rants here. It's a free source of laugh and entertainment.. Some are never allowed to step out of the house since Corona started while others are genuinely bitter to their soul... Let's use their post and catch cruise.,1,Simply_Sanusi,"BSc, MSc Chemistry • Academia • Tech • Liberal Democrat • Humanist • Minimalist • 
NB: Trump supporters keep off please.",https://t.co/axHYkSEQEi,1175,2316,2010-05-31 05:15:08,150136917,"Yobe, Nigeria",False,40666,3958
37,1290649390001065986,"Exactly! Modi promises everything while announcing something big but when we look at outcome we only find `EMPTY' (Demonetisation, 370, Corona Lockdown, economy reforms, job creation, black money and so on)",1,PremPra05554708,"Please spread the truth. Satya, Ahimsa is our tradition and strength.",,17,7,2020-05-08 05:12:25,1258625472310718464,,False,341,309
38,1290674269807050756,"I am on the side of the young students ... especially now with Covid around, they need to be given every possible chance of a decent future.",0,DavidCameronSnr,Add me to a list without permission and you are BLOCKED !,,815,1665,2014-09-11 12:58:23,2803650494,Jockistan,False,33312,58846
39,1290674370059395079,"we aren't making plans on how to handle covid, yet here we are talking about parks that most people aren't allowed to go to without fear of getting sick and dying ",0,alexbruns,"Gaming, basketball and PC building enthusiast.

https://t.co/6sZiAtnQLG",,112,17,2020-05-22 20:28:32,1263929722746155008,"Minnesota, USA",False,1174,565
40,1290657490804322304,"No one said banging thalis, clap and liting diya would stop Corona. Come out from your pappu mindset. And a scientific Congres party what has done in Maharashtra everyone knows. You just rubbish nothing else since 70 years you have just speak but haven't done anything. ",1,Mumbaichatter,,,50,71,2012-12-06 08:32:26,992652698,,False,7169,6598
41,1290636590989991936,Ice Shivling made by me on the very first of this Sravan asking prayers for the entire world suffering Corona ,1,SoumenR03280212,"Be humble!!
For the dust I am and to dust will return to",,287,9,2019-07-28 17:06:13,1155524876272148481,"Kolkata, India",False,416,392
42,1290658174719209474,"Dude Corona doesnt impacts only infected people, it will n is affecting economy of EVERY NATION. Be logical dude. I am taling about all research n development programs. Building Silicon valley, empowering youth, making roads n water draining systems. Let's start with Mumbai ",1,rodger14223,"Gym freak . passion for fitness and health , obsessed to learn more to gain more . If you dont know ..You wont grow, As simple as that.",https://t.co/ZcOCKc8J0N,198,22,2011-08-20 07:43:29,358646008,Chandigarh,False,167,939
43,1290651771103322115,"Good job Lala but without mask, you are donating Corona (DonateCorona). Hope you got my point... ",0,SaugataRoy1,,,36,17,2011-05-26 08:00:14,305462524,"नई दिल्ली, भारत",False,93,69
44,1290675849235238921,"Hello Ima Single Dad, I Lost My Job Due To COVID-19. I’m Currently Low On Food And Essential Items, Can Anyone Help Me And My 3 Year Old Son Please, Also Retweet For Exposure My CashApp Is ($Ogslim5300) My Venmo is Dunk5300 ",0,UptopSlim53,"Single 👨‍👦 Father🥇💉OTF👨‍👦 N.E.↗️ Getting Better, I'm At Practice 💵 Is Motivation Take Risk And Prosper 🙏🏽 $Ogslim5300",,4999,1162,2011-12-04 06:42:16,427998529,,False,17329,26654
45,1290653526465675265,"I imagine that sometime, after years of dystopian covid self-isolation, I will finally crawl out of my corona-free lair, blinking in the sun, just to touch another human being one last glorious time before succumbing to the virus and handing in my final dinner-pail.",1,IBlame,"TX Hill Country farmy cronesplainer. Renowned specialist in a field. Horses, dogs, sheep, vineyard & a Pomeranian. Abolish the police. She. 🏳️‍🌈",https://t.co/djJvxlhLQz,2244,3261,2009-04-22 22:33:56,34425259,West of Austin TX,False,102260,74537
46,1290648304066461700,@Nasty_CSA and @reece_youngking if you guys don't drop your albums they will get attacked by corona virus and delete everything and it have to be us fans suffering cause you've been cooking for so long just serve us we're hungry,1,RealBokienova,around me is fire of God 🔥❤,https://t.co/kuS5BfDH1t,987,350,2018-09-18 05:51:18,1041927624556208128,Botswana,False,977,174
47,1290674783567388673,"Y’all are gonna be open for like 2 weeks then get a single case which will close the campus again. If you give students the choice between risking corona to blow off steam and following proper CDC and college guidelines, they’ll pick the former 9 times out of 10.",0,BabielKabriel,I reserve the right to be distracted.,,103,61,2013-07-17 22:24:33,1601971550,"Mason, MI Albion, MI",False,5154,1157
48,1290675542216380421,We are staying on top Covid-19 by holding weekly safety meetings. We WILL be opening this Fall and can't wait to see you on the mountain! #winteriscoming #mthigh #covid19,0,mthigh,Southern California's Closest Winter Resort l #mthigh,http://t.co/WCtWYjZ85U,1596,14494,2009-07-30 20:56:24,61596738,"Wrightwood, CA",False,5315,9050
49,1290640823802114050,"It’s 2020 Corona n all and I am still not comfortable with the ease with which people use the words; Penis. Pussy. Fuck. In Public, Songs, speaking etc. societal peace is really missing something and that’s the cause of so much bad. ",1,TheGist9ja,classified.,https://t.co/PouoSlpqcZ,1949,1614,2013-04-02 23:12:01,1323448856,Nigeria ,False,14049,2851
50,1290676796451684354,Why stop with covid everything in this world is for sale including you and your ideas. Take it all the way. The media you using to dispute the reality of covid is also fraudulent and not vetted. Everything is a lie including you.,0,180_Samadhi,"To know the truth of one's Self as the sole Reality, and to merge and become one with it, is the only true Realization.",https://t.co/3XUixQtshY,1742,106,2011-10-12 18:07:15,389604284,"Nashville, TN",False,24210,6253
51,1290659377750380547,Travelling under corona conditions involves some new rules. Even if you are not travelling yourself and simply picking someone up from the airport. Please wait in front of the terminal if this is the case.,0,berlinairport,Berlin Schönefeld (SXF) & Tegel (TXL) Airports‘ official service channel with up-to-date information as well as news & tips for your flights. 📞+49 30 609160910,https://t.co/hld9bvNkVS,950,43094,2011-09-21 11:11:30,377307157,Berlin,True,3672,16669
52,1290675637640888323,There’s no doubt that #FlexibleWorking will play a bigger role in #businesses post #Covid-19. Read more about how this benefit could help attract and retain talent in @InfluencePRMag:,0,OpenComms_,"Open Communications is a #PR, #socialmedia and #contentmarketing agency working with brands of all sizes. Small agency, big ambition. Based in West Yorkshire.",https://t.co/0V4CONyXRi,458,106,2019-05-30 16:27:17,1134134192462344199,"Wakefield, England",False,245,193
53,1290677135254917120,ACTION NEEDED! Join me in sending a letter to the editor to your local paper about the immediate need for Congress to pass a families-and-economy-first COVID package. @MomsRising makes it very easy--&gt;,1,DebbieL02501602,,,8,0,2019-06-24 23:52:41,1143305978600988674,,False,5,4
54,1290644739688202240,"Oh wow my initial interpretation was legit ""I take corona tests on the regular, I take this seriously."" And I just like... Totally accepted that messaging until I thought about it. Seemed perfectly normal...",0,Maddoxnelson,"Front-end developer. @DrakeUniversity alum, marathon runner. In a cabin in MN until the pandemic settles down. he/him",,313,517,2008-11-02 17:43:49,17117150,"Hibbing, MN",False,2631,10417
55,1290677754761887744,"Trump & the dems reaches a new stim agreement, HOWEVER the other house republicans do not want to give in, and in short of making everyone go back to work they want to give businesses IMMUNITY FROM COVID RELATED LAWSUITS",1,xosamryan,30% sugar 70% spice i’m not really nice,,313,299,2012-07-21 05:29:27,708426367,"Los Angeles, CA",False,25844,12869
56,1290677402465718272,"Hello Ima Single Dad, I Lost My Job Due To COVID-19. I’m Currently Low On Food And Essential Items, Can Anyone Help Me And My 3 Year Old Son Please, Also Retweet For Exposure My CashApp Is ($Ogslim5300) My Venmo is Dunk5300 ",0,UptopSlim53,"Single 👨‍👦 Father🥇💉OTF👨‍👦 N.E.↗️ Getting Better, I'm At Practice 💵 Is Motivation Take Risk And Prosper 🙏🏽 $Ogslim5300",,4999,1162,2011-12-04 06:42:16,427998529,,False,17329,26654
57,1290676069872402440,I see people complaining that a college wants to track where kids go on campus for Covid-19 and yet they are using cellphones where almost every app tracks them. Tracking your kids for health = Constitutional Violation. Tracking your kids to make others richer = Totally Cool.,0,geekdaddio,"Gamer dad to 3 gamer boys and 1 nerdy girl. Husband Love games, podcasts, politics and Star Wars EU. He/Him. 
https://t.co/1LK9g8jtHc",,336,491,2008-07-20 17:01:33,15503636,,False,1368,9078
58,1290668161659015168,You know I'm happy they are gonna perform at the VMAS but are they really gonna risk corona for them???? I mean they are gonna be held at NY with various performances across the city,0,raplinequeen,"Ot7 but Rap Line's bitch
BTSPopper
                                    
          Check my moments",,324,272,2019-04-02 15:38:44,1113103479382343681,She/Her | Fan Account | Mexico,False,22208,11996
