Tweet id,Tweet text,Tweet label
1290671165787185153,"Ohh realy?? People like LK Advani, MM Joshi would really care about corona at this point and not come for probably what could have been the greatest moments of their life. These were the people who were ready to die for Ram mandir and today they are afraid of Corona? Lol",1
1290641405749219331,"I am not saying it spread with food or not, but what happened if someone sneeze or cough or drop it's droplets while talking ' accidentally ' ?? And I will be glad if u send me a research which suggests that infected food don't spread corona . Thanks in advance.",0
1290655723555258371,Didn’t say it wasn’t. That graph is also from the CDC about total cases. And in an argument about “being the best” about Corona in the world. Neither graph matters because America still tops the charts. So in it’s entirety Trump is still full of shit.,0
1290676775018729472,"A major challenge to this fall's elections is that most poll-workers are over the age of 60, and at high risk for COVID-19. Municipalities are using creative measures to recruit younger poll-workers. https://www.npr.org/2020/08/04/898853304/coronavirus-pandemic-impacts-election-site-staffing @barbarasprunt",0
1290658054015520768,@realDonaldTrump Open the schools so Barron can go!!! Want him be the first one to get the CORONA virus. Either that or he's the next school shooter!!!! It's in his DNA!!!!,1
1290636237032710144,College must open in September now the times comes to become aatam nirbhar so mostly students are ready to become atam nirbhar where they ready to fight with corona and do their education from campus @HRDMinistry @DrRPNishank @ArvindKejriwal @PMOIndia #reopencollege #unlock4,1
1290647867955322881,"So the best way to reduce Covid-19 numbers @ArvindKejriwal &amp; @myogiadityanath reduced number of tests. In last 24 hours:- UP - 66k tests, 2900 positive Delhi- 4k tests, 680 positive With decreased numbers they are celebrating like they are winning Corona battle #cheaterCMs",0
1290670785061953541,I was suppose to be in Mexico at the end of the month first time out the country and corona wanna do me like this,1
1290677475819819008,"idek what happens anymore and i live here, but we're basically the only country that still has covid as a big problem bc everyone's stupid i hate it here ",1
1290676749706113024,"My gut tells me that they realize that most of the people that are affected and die from Covid are people of color, and/or living in multi generational houses, working in processing plants, farming, etc. That’s why I think they really don’t care.",0
1290674930628071424,I work in a mall so I’m just trying to not go back to the mall in the pandemic. I have pretty bad asthma and so if I catch covid I will probably be asymptomatic or hospitalized and I would rather not risk it,0
1290674683218522112,"I would be absolutely livid if I was a small business owner. This is why COVID is spreading, not the businesses that have been forced to close. ",0
1290645446097096709,"Bill Gates and his boys have just upgraded Corona and are thinking of releasing it again for a more Robust attack in November December months. After that they will force you to have a vaccine, to inject their micro chip in you, so they control humanity, sources claim. ",0
1290663391376416768,Magic happens when the community comes together. Discussing how can we positively impact the world in the times of corona. @ic3movement @jim_ic3 @GaneshKohli @RajikaBhandari @LegacySchoolBlr,1
1290674148533043203,THIS ISN'T FUNNY Two of my siblings have just been confirmed positive of COVID 19 in Lagos state without any symptoms from their test yesterday But I'm feeling some symptoms and haven't done the test. I'M VERY MUCH AFRAID ,1
1290654282052665348,My coworker’s mom just died from the corona virus today. She had previous health problems and it took a toll on her. I just want to remind everyone that just because you’re fine with it doesn’t mean other people will be too.,0
1290672326720335872,The people of Kashmir have been deprived of high speed internet (4G) since a year. During the Corona pandamic when all the students of world are having online classes Kashmiri students are not even able to watch YouTube lectures. #SaveKashmir #stand_with_kashmir,1
1290668615050637313,#PostponeMMMUTEntranceExam In gorakhpur daily 150-250 corona cases are coming . And MMUT Is going to conduct offline entrance test ay different center. @PMOIndia @DrRPNishank @HRDMinistry @myogioffice,1
1290648014248382467,The same people yelling close the schools where screaming open the borders at the beginning of February aka the corona virus month,0
1290656021623570439," India's petroleum &amp; steel minister Dharmendra Pradhan admitted to one of India's most costly private hospital MEDANTA, after testing corona positive Covid +ve Amit Shah recovering there as well A common man though had to suffer, as I had shown in #OperationHospital ",0
1290644181543784448,"America has almost 1k daily deaths from Corona. Supposedly South Korea only had 300 TOTAL. But the US has the highest recovery rate in the world. If you believe these other countries are giving accurate numbers, you're insane.",0
1290675521089466368,Rumor was that these doctors are taking Muslims away and injecting them with covid +ve blood This is a very big rumor and anyone would do the same,0
1290677019890667521,i really hope they stay safe if they come to the u.s for the interviews and performance WHY ARE THEY EVEN COMING AT ALL TO THIS DUMB COUNTRY ITS FULL OF COVID ,1
1290659192316010498,Stay at low-risk of corona with our TRAKA system Know the number of COVID-19 cases around you Can be translated to any language Keep updated with 100% reliable information #covid19 #corona #coronavirus #coronacare #healthcare #wellness #nigeria #africa,1
1290669215058288640,"#When I had no time, I adjusted to give time to everything But, when I have 24 hours, I am drifting without any aim Of course, household duties due to Corona have increased I don't know when I will gain the earlier form to be of use If God feels I must face snags, can't avoid",1
1290654483115053056,"So when flu season come around, they still gone be saying ppl got Corona or its gone be the flu? ",1
1290675018746269697,to everyone using the argument “more students are dying from suicide than covid we need to get them back in school” : i don’t see you advocating for mental health. it’s the same people pushing for school to stay remote that are also speaking out about mental health.,0
1290655031331622914,What this Corona Virus pandemic taught us?? Be always ready for any kind of disaster!!! Save money and invest wisely ,1
1290677159992995842,We thank @SafeGraph for making the Foot traffic data available. Our paper uses the @SafeGraph data and the first study to quantitatively show that counties which had implemented policies and effectively increased social distancing have seen slowing of the spread of COVID-19.,0
1290649464475127812,I'm 38 a heavy smoker and I had corona. It passed through me with no problem. I see this as my sign to wise the Fuck up and get healthy.,1
1290648327722283013,Am I the only one that feels summer should have been longer since corona pretty much ruined everything else ,0
1290676534240411649,Guys It's It's Some What Sad News Near my Home the Corona Has Got So I felt Sad And Around my Home the Corona patients has There so I am soo sad and I am following all the rules of covid- 19 Taking healthy Food And Keep Neat Around You sourrindinds,1
1290651642124283905,Q.Don't Postpone NEET? A.Let others life be my stepping stone to become a doctor for thy I am a selfish person who will spread Corona even to thy parents. Risking their life for thy future. Where I steps body falls and tears sheds #dontPostponeJEEAndNEET #PostponeNEET_JEEinCovid,1
1290661221545500679,"So daddy tells the world that the over 150,000 Americans who have died from Corona Virus “is what it is.” Really, THIS IS THE AMERICA WE LIVE IN NOW? A man with Lewy Body Dementia is running our country into the ground &amp; tells us all, it is what it is. The man is dangerous! ",1
1290676009939996673,Doctors warn people without fevers may still have COVID-19 ,0
1290643161564536833,"Yoooo!!!! If Arakune sent you that Corona Virus, I'll deal with him as Tao. Don't worry! I'll deal with him. You just rest more to get your energy back! ",1
1290673687868223489,Corona has reduced your chances of getting stuck in rains... much more than BMC could do ever!! #MumbaiRains #MumbaiTraffic,1
1290658083795095553,Wasted two hours going to the wrong location now gotta go to Corona,1
1290644126073929729,"Very sad, WHO failed to take appropriate action in the initial stages of corona emergence.",0
1290675634545598464,"#ShowYourLove and wash your hands often with soap and water for at least 20 seconds to help prevent the spread of COVID-19. Also, wear a cloth face covering and wait 6 feet from others. Each action is important! ",1
1290677604190695424,"You haven't protected #Wisconsin kids from the virus at all. Whether school is physically open or not, my kids won't be attending until COVID is under control and I know I'm not the only parent who feels that way.",0
1290650444906270722,Great “Corona statistics” were attributed to the proverbial German discipline and an advanced health care system (but maybe it was just a systematic undercounting). It seems though that the Tea Party kind of rhetoric has landed there and maybe the stats will deteriorate soon. ,0
1290674092530470913,"It’s Low due to Low testing and due to the social stigma that people in India, Pak and BD seem to have when it comes to COVID.",0
1290658546389069830,"@AllianzTravelUS hello, are you guys still providing Corona coverage with your plans? Thanks",1
1290671794865700870,"i was trying to get something snapshot club related at sitc this year... like a little stall with a photo area with a cool backdrop for people to take photos but obviously when corona started back in feb, i had a feeling sitc would be cancelled so i scrapped it all",1
1290647536659771395,"@PMOIndia @narendramodi In India if we really want to control corona,we must give permission to local district authority,each collector is capable to take best decision in their region,national level policies doesn't get success in each place as each place has diffrent atmosphere",0
1290677057647599616,India&#8217;s #Covid-19 testing rate lower than other countries: WHO chief scientist https://indianexpress.com/article/coronavirus/without-adequate-testing-fighting-virus-is-like-fighting-fire-blindfolded-who-chief-scientist-6539222/ via @IndianExpress #coronavirus,0
1290676943667462145,Hospitals are incentivized by you to call everything they can a “Covid” death. This has been a front row shit show from the start. #PoundSandAdam,1
1290666582520340486,My gf was on the corona virus task force for Arizona and California and she had to make those charts but the data changed everyday for everyday prior by so many cases that there was no consistency and it’s bogged down with over inflation to what percentage we will never know.,0
1290662777510678530,During this corona virus you know the situation is getting hard.,1
1290676956602785799,This great team want to understand what Anatomy Educ will look like Post Covid in UK and Ireland. Can you help them? ,0
1290675135482155008,"HR, the near-6mo baby, has had no exposure to outside germs because he can’t go anywhere. He hasn’t been sick at all, so his resistance is minimal. Every day we go without bringing covid into our house is a chance he’s more likely to survive it if he gets it.",1
1290661726837506049,"Arabs calling and acting like ssi to get our money is waymore worse than anyone releasing any kind of makeup it could b called corona beauty and still not be worse than someone trying to steal my hard earned money and arabs stealing it from me makes it 1,000 times more agitating",1
1290656041387069441,What's even going on with corona now? Like it fully died down and is now back,1
1290642012564226048,"The DFL wants spectators to return to stadiums again, but the final decision will be up to politicians. Christian Seifert (DFL Chief): The priority in Germany is not the full stadiums, but the health situation. At the moment Corona is still around &amp; playing a very important role ",0
1290653201176440832,"Sold country- South Africa . We don't even know our rights lately because is Corona thing and people will say ""it's not a big deal"" how is it even possible while people dies.? It's not only Corona that kills us even our Government kills us ",0
1290676077808033792,"COVID-19 conspiracy theories creating a 'public health crisis' in Canada, experts say | CBC News ",0
1290675157250392065,"Hi, we regret the inconvenience caused and request to share your contact number and complete address over DM. However, in the present scenario arising out of COVID-19,you will appreciate that it is not advisable to meet you in person and collect the sample for investigation.(1/2)",0
1290676428846116866,4/6 •They chose 190 COVID-19 patients who received hydroxychloroquine within 24 hours of admission to hospital. •They were able to match them extremely closely with 190 other COVID-19 patients who did NOT receive hydroxychloroquine...,0
1290677073602686978,for my non-Indonesian followers: my Health Ministry • tried filing a defamation suit • using articles it *wasn't* empowered to invoke • over a tweet claiming that my anti-science Minister is less useful than a German dog in detecting covid-19 how are -you- doing? ,0
1290652180979093504,"If you don’t test everyone, they can’t be labeled as corona deaths. People in hospitals are not there because of corona, they are there with corona. These numbers are going to be way different in a year after they got cleaned up.",0
1290651482136760327,@ShivSena says people should focus on corona virus which is a bigger issue. @arnabofficial7 pls ask them what caused them to rape a girl during corona virus. Corona virus kept them home for a long time guess they couldn't keep it inside their pants ?,1
1290675500591980544,"Hey Margreat. Our travel plans have been severely impacted due to covid-19. Rather than changing the flight, is there any option to exchange for future credit?",0
1290653597248651265,the only thing you do is quote the rising numbers and blame trump for everything. You have no solutions and you are a virus that is worse than corona could ever be.,0
1290670473634775040,I just wish corona would end I had trips to take,0
1290675138271293442,Complementary therapies can help with many issues including post covid symptoms. Here we learn how Craniosacral therapy has done just that... https://healthylifeessex.co.uk/2020/07/craniosacral-therapy-for-post-covid-symptoms/ #craniosacraltherapy #complementarytherapy #postcovid,1
1290660817797615621,"Hello I proudly say that I am a son of farmer. .@CMofKarnataka ,@PMOIndia . Many farmers are dependent on ginger in Karnataka.please help us to get good price,in this time ginger is very useful to prevent corona. The buyers were cheating a farmer's please take a look. #farming",1
1290654563175989250,I think Niall could add some more tour dates in Brazil after this corona thing. But it’s just an idea... just saying ,0
1290657565198737410,"Interestingly last couple of weeks gave birth to some positivity and optimism. The civil military partnership seems to be working, the economy is on a stable path, stock market is rocketing up, and the war against Corona is coming to a victorious end. What happened????",0
1290638432457367553,"Lots of opportunities are available, now corona slowdown our industry growth, may come back soon.",1
1290675747552559106,World looks more peaceful and better place without #TikTok and stupid trending videos of #dalgonacoffee #thoughts #Trending #RamMandirAyodhya #Covid_19 #TrendingNow #Video #MotivationalQuotes,1
1290674728542273536,"In a 1 minute interval, Trump goes from saying (paraphrased) ""you can't look at deaths per population, only deaths per case"" to saying ""cases are higher than other countries because we test more"". The pathological idiocy of Trump's COVID response cannot be overstated. ",0
1290675313798721537,"Could you please help me I completed my Matric in 2016 I've been trying to apply but I haven't had any luc,last year I was able to go to college and I was supposed to finish my 1 year 6 months course this year but Covid-19 happened my mom hasn't been working",0
1290649129992036362,"Green leader Annalena Baerbock would likely see herself in Government with Merkel's conservative CDU Party, according to latest polls. After laying low - like so many - during first #Corona wave, now calls for more focus on keeping kindergardens and schools open. #SecondWave",0
1290641655184449536,"For those who not understand Marathi I translate it to England ""Corona Pandamic outcry in India, Maharashtra government taking efforts to defeat Pandamic, people's who cannot see success and popularity of Maharashtra government's played dirty politics on SSR case....",1
1290676718580174853,seeing so many tweets about exam results today.. people predicted A receiving a F instead because of the area and school... how that is even allowed is beyond me. Most students wirj their arses off and cos of Covid they are being punished,1
1290673992471371777,Dude. The toxicology report clearly shows that he died from the massive amounts of drugs in his system. He also tested positive for covid-19. He was saying he couldn't breathe before he was even put on the ground. a symptom of covid-19 is not being able to breathe.,1
1290676956212666369,"According to The #Times, a sample of the virus that killed six in 2012 was housed at the #Wuhan Institute of #Virology and was described in a scientific paper cowritten by Shi that states it is a 96.2% match to the COVID-19 virus.36 The virus, called RaTG13, says The Times.",0
1290675268579921920,"Data includes 85 new positive coronavirus (COVID-19) cases, bringing the District’s overall positive case total to 12,398 and one additional COVID-19 related death. [PR] Coronavirus Data for August 3, 2020 ",0
1290675627226353664,"Marijuana HAS been proven as a successful medical treatment for many things she doesn't say it's proven success against COVID...Your dumbass boss told us to inject bleach, so maybe sit this 1 out #MoscowMitch Regardless, I'll take funding for pot over billions more for Jets",1
1290668871058223104,What great work has he done He is the same Cm who was untraceable for months and left his people to die in corona and then flood... Time to rethink priorities @NitishKumar @ABPNews @narendramodi @SushilModi @yadavtejashwi @ShatruganSinha @ravishndtv @ndtv @ZeeNews @aajtak @ANI,1
1290656000903647234,Good if daily will be like this then #Corona case will be negative,0
1290675689352572934,"I just heard two teenagers died from Covid. It’s so awful! Please wear a mask when you’re in public! Please think that maybe you wearing a mask prevented even one person from getting this and possibly dying! And, it could possibly be a loved one! Please!",0
1290674819495686144,I wanna see those bighit body guards make a bubble around bts at the VMAs. How fucking funny that the racist Americans that were joking about people avoiding bts when corona started are now going to be the people bts needs to avoid for these awards,1
1290666555219607552,"Haha I've unfortunately fallen off a ton with video games since Corona hit (you'd think it'd be opposite, but I'm just grinding movies every day). I stick to sports games and CoD almost exclusively. Had a 1.9 K/D (playing Ground War only) but got rusty over the months.",1
1290653687032033286,I think people said they had all the symptoms of Corona as early as October and they were diagnosed with a viral infection,0
1290675128259481607,"It’s just the worst thing he did today, before noon. Every single day brings a new worst thing. At 11:59 PM it will be 1200 additional deaths today from Covid. See how it works?",0
1290650415852290048,There are 2 types of ppl In the world: 1: The people who are aware of Corona buy are reasonable with their social distancing rules... Then there’s number 2: People who are over the top with social distancing rules. I’m not gonna lie to you. I’m aware that Corona is dangerous.,0
1290664620819189761,I was planning to go back home unfortunately have to go for 14 day's Qurentine which I totally don't like so I skip the idea of going home for another time when i get to know that Corona is no more at #maldives #whatalife,1
1290676723412013071,In the comments on the original tweet there are people worried about how polite the interviewer is or which stats are more meaningful. Here’s a meaningful one. Daily US deaths from Covid-19 are about 7% of normal daily US deaths. No reason to expect that to let up soon.,0
1290673786103173128,"Despite Mask Wars, Americans Support Aggressive Measures To Stop COVID-19, Poll Finds ",0
1290676070434377728,"Having to do all the extra work of bottle-feeding (on top of illness recovery and general childcare) in the weeks after covid would be If supply keeps up then you can do 3 months with baby in one hand, device in the other Exercise regime: journey between sofa, bed, kettle.",0
1290636346130944001,the same people I b seeing talking about corona be the same ones I see out ... in crowds .. like come on ni make it make sense lmao y’all foolish,1
1290659276558671876,Would rather corona come near me over this pedo,1
1290674692165177345," The latest Hackney Business Network newsletter is now online This week we've covered Covid-19 outbreak action cards for businesses , NHS Test and Trace guidance for businesses and some great funding opportunities https://content.govdelivery.com/accounts/UKHACKNEYCOUNCIL/bulletins/2988283",1
1290674002214752258,not some moots hoping bts and ariana both go to the vmas so they can interact. pls no. i hope my babies stay home where it’s safe and away from getting covid. a bangriana interaction can happen some other time but not rn when their health is at risk ,1
1290662644056297475,"That I mean, I am witnessed to at least few deaths including my elder brother with clear symptoms of Covid 19, yet they were not labeled of corona. One example for you sir. When testing touches 30 K the death ratio rapidly grows. What govt did the reduce testing to 20k and --",1
1290674345594048512,"How do you guys feel about 40 patrons in the building at a time to browse, enforcing masks and distancing, and cleaning potentially COVID-contaminated surfaces every 2 hours? Not so good? #ProtectLibraryWorkers",1
1290676560622690305,Lots of factors in the decision to sell LFR many of which have nothing to do with racing. The economy taking a down turn because of Covid. The decision of ProCore not to return as a sponsor in 2021. Construction slowed in Tecas and Oklahoma. All these thing played a big role.,0
1290650617321607168,I was washing my hands way before this Corona came in. I dont need you to tell me to wash my hands. This is common practice hygiene.,1
1290656123859734531,"@LibertarianAlly If you live in Melbourne, and you let the Liberties that so many Aussies have died for, to be garbaged at the drop of a hat because of these alleged suspected Covid casualties, then I'd have more respect for the Corona Virus! ",0
1290677007030743041,"Joe Biden - I fear COVID-19, a cold virus, might never disappear despite what could have been done. I fear that we suffered a virus taxonomy event more, &amp; then abilities/funds to secure more respiratory equipment, better train new workers, etc. My past colds were mostly not id'd.",1
1290674458118819840,You should wait The life became slow in the time of covid 19,0
1290674689602461696,"have you seen what’s in the HEROES act ? Most of it has nothing to do with covid. I trust republicans more than you swampy dems. Common sense would tell you that if you make way more on unemployment, you won’t go back to work, no matter how many postings there are",1
1290676006743879680,"@craigmelvin The States created the Federal government to help them with common problems, like COVID-19.",1
1290674742891085824,"When will I be with my wife n kids?? I will quarantine, prove a negative Covid test...i will do whatever it takes!!! How much longer do we have to suffer this? @JustinTrudeau @BillBlair @Pattyhadju @marcomendicino #prioritizefamilysponsorship",1
1290676931810209805,"Literally none of that is true, you’re just being told these things by fake news. Only elderly people and people with severe health problems are actually suffering from covid. Stop letting the media brainwash you.",0
1290675730083348483,"You know it bro.. Since Covid happened they change our salary to a 3% commission.. Imagine 3% at this time, what sales are you gonna make,i feel so bad serving someone with my whole heart then a person doesn't appreciate with at least 10% gratuity",0
1290672920281387011,"Yes people Asians totally bring corona, Muslims are 100% terrorists, Mexicans are most definetly all theifs and illegally came in , Black people are totally “Thugs”. This country’s “ president” has said these things. and people still support him, disgusting",1
1290649544443801606,I really want to preorder the album but my economic condition is not good becoz of corona Did anyone experience the same feeling as me? #TREASURE_BOY_D3,1
1290676988659863552,"Yadier Molina tested positive for COVID-19, he announced in an Instagram post. In Spanish he says in part, “I’ve tested positive for COVID-19, despite following all preventative recommendations.” He adds he’ll do everything he can to return as soon as possible. #Cardinals",0
