Tweet id,Tweet text,Tweet label
1290668519454113798,"Why are you perpetuating this nonsense, anyway? You are privy to the #WorldEconomicForum 'Corona' graphic, which was created LONG before this &lt;cough, not Covid&gt; #Scamdemic ever happened. Is there one 'news' outlet anywhere brave enough to tell the truth?",1
1290654817703153665,"People are dying from fentenyl everyday. He had morphine, meth and fentenyl in his system. Add the ccp chinese corona virus and prior heart issues and that would kill anyone!",1
1290640761088880642,"Hahah, this president is a strange one, it’s going down I think he meant American people going down with corona",1
1290677617302089728,"Voting... touch the same machine as everybody else, or touch a shared pen, or a shared punch card poker chained to the voting booth... it is hard, dangerous, and potentially deadly when done in person these days. Pay attention. 1 in 26 dies when contracted with COVID-19",0
1290673828440559616,Doctors warn people without fevers may still have COVID-19 ,0
1290658597886664706,"When asked about Corona death totals, Trump said, ""It is what it is."" It is remarkable that such a creature exists and is considered by some to be more than sub-human.",0
1290658226564988928,I admire your comment. You are true in your statement. If India is first for Mr. Modi he would have not have put poor people who voted him on road and many are killed by his mismanagement on Corona virus. He did nothing admiring works . He spent people money for thier interest. ,0
1290665451786137600,Corona joined @BJP4India . Please take care and get well soon.,0
1290674697357721602,My school: please believe oh my god please we are following health protocols please please we promise Also my school: hello here is two more people who work with our school who tested positive for covid see you all on the 10th! &lt;3,1
1290677713729130501,"@Collector_MBNR Sir, Still there no transparency for treatment of Covid 19 positive patients at MBNR .Patients are forced to get admitted at Hyderabad corporate hospitals and spend lakhs of rupees .Can u pls ask the authorities to provide treatment at Mbnr isolation wards.",1
1290675275169243143,Gotta agree with the guy above. Just wear your mask and stop arguing with medical professionals who make a living off of keeping us safe. Recent headline of political activist Herman Cain developed illness and died from COVID complications from not wearing a mask...,0
1290674221081939968,"My sentiments exactly - all these people thinking that he is just stupid. He knows what he is doing by trying to twist the facts - He IS stupid to think that anyone would buy his version of ""we have the best stats in the world on covid.",0
1290676801694441473,While facing psychological depression the society expect scientists around converging in suggestion or recommendation toward COVID-19 resolution to calm down people,0
1290639922970296320,Try calling and telling them you’re being affected by corona virus .. they might be able to move the payment date or something :),0
1290677477505892360,"John: ""Thank goodness we vote in November & will be rid of Trump"" Beware: DEM's have a very bad habit of pulling defeat from the jaws of victory I'm 64 y.o., and have seen this happen too often Trump has broken the P.O. system Voting in person, even if it means COVID &amp; death ",0
1290661356958515213,"Hey good people hope you are safe wherever you are, let us help stop corona virus remember STAY home as much as you can KEEP a safe distance WASH hands often COVER your cough with your elbow WEAR your mask SICK? Call toll free number 2019 #STAYHOMESAVELIVES #COVID19ISREAL",1
1290677443297193986,"Germany's doctor's union says second COVID-19 wave has hit, while France's scientific council thinks worse could come ",1
1290674074038022144,1st I favour Democrats 2nd no matter whether you like Trump ir not hes put is Country 1st 2nd 3rd has a Diplomatic Polotician zero has a Strong Leader bar Covid hes 9 out 10 if you thing touchy feely Biden is the answer god help America I liked Obama a lot but he wasted 8 years,0
1290675781895585792,Remember when Fauci pushed AZT on AIDS patients and killed a lot of them with it? Now he’s pushing untested vaccines for Covid and repressing treatments that work. And the corporate media has millions worshipping him. ,0
1290671774816808961,We r in Quarantine because in Our neighborhood Corona patients are found. @UPGovt @PMOIndia @narendramodi I won't be able to give UPBED2020 paper because of Corona. please postpone it as our life and country is going in Emergency case.,1
1290661075311099910,"Corona bit everyone in the ass. And for the names you mentioned, honestly, if they are available, why wouldn’t you gain use those names. Rating...meh, I don’t care and look toward the rankings for the night and views online.",0
1290675112258265093,"Mr. Floyd seemed to be having a really bad anxiety attack. The anxiety raised his heart rate which caused breathlessness. That, combined with a lingering Covid infection, combined with a probable lethal dose of drugs caused a heart attack. In my opinion.",0
1290676715312816128,"This sucks. Every case of COVID sucks in a much more important way, but a substantial portion of a season without Yadi sucks in a baseball way that I still care about. ",0
1290675153060474889,The people of Kashmir have been deprived of high speed internet (4G) since a year. During the Corona pandamic when all the students of world are having online classes Kashmiri students are not even able to watch YouTube lectures. #SaveKashmir #stand_with_kashmir,1
1290668908245127169,“If you’ve got corona virus wash your hands.....” how long ago was that?,1
1290655116224344064,"@narendramodi Sir please take serious note of this. FMG,s can be included in fight against corona,it will overcome shortage of trained manpower in hospitals. Plz don’t discriminate FMG’s on the basis of an barrier called FMGE #letfmgserve #FMGEPP30 @drharshvardhan @MoHFW_INDIA",1
1290676464241848321,False. The median income was on the rise before covid. increase for thevaverage American was about 3000 a year and much more than that for people who were able to find jobs and whose jobs became full time.,0
1290674187065991169,"Look at your own face homie, looks like your the daddy of the apes you ain't got no room to talk. Now go outside without your mask so CoVid and take care of you.",1
1290677221091418114,"Hello Ima Single Dad, I Lost My Job Due To COVID-19. I’m Currently Low On Food And Essential Items, Can Anyone Help Me And My 3 Year Old Son Please, Also Retweet For Exposure My CashApp Is ($Ogslim5300) My Venmo is Dunk5300 ",0
1290652064083841031,You people don't tell us about religious programme what happened in tablighi is the base of corona spread,1
1290673816553713664,"863 new cases take the district's cumulative covid tally to 15,471 on Tuesday. In the last 7 days (July 29 to August 4), 7,341 new cases were reported in #Vizag district.",0
1290674323431333888,Does anyone have an air purifier? Would y'all recommend it or is it a waste of money? Any brands in particular? I have been waking up with a really bad congested nose every morning and it's getting exhausting to keep thinking I have COVID when in reality it's just allergies.,1
1290673917632434177,"@eddiemair This wall to wall #Covid stuff is for most people really boring radio especially with so much out there like @SecPompeo’s attempts at virtual war with #China , truth about a Russisn vaccine, demonstrations in Israel etc etc .. Wake up @LBC",1
1290662889808855043,"Bad days of China ahead. Villain of corona virus. Human killer. Damon &amp; devil country. Worst than Isis or Talwani. If not reformed, India US alliance forces may demolish China altogether. Bitter truth",1
1290677399655337984,#TuesdayMorning All This Talk Of #Covid_19 Numbers Yet No Talk About That High Risk Community Within Our Community Are Our Homless Still In Motel / Hotels Nope Are Our Homeless Back In The Same Situation Pre Government Roll Up Yes Take A Look Around #vetsrising,1
1290657896771080194,"#Netherlands #Amsterdam #Coronavirus Corona infections are also increasing significantly in the Netherlands. Over the past seven days, the number of new infections detected has almost doubled to 2588, the authorities say.",0
1290676072456093697,"Who said I can't? This shitty society? I'm not always going to listen to what others say. Others say Trump is a good president, killing african americans is okay, covid doesn't kill anyone, etc. I'm going to be my own person and fall under my beliefs and opinions.",1
1290664981722275841,"@ysjagan Sir PLZ OPEN THIS LINK HELP TO MONTHS BABY SIR BABY GOT CORONA VIRUS AND MOTHER ALSO BOTH ARE IN OUR GUNTUR ""GGH HOSPITAL"" HOSPITAL STAFF DON'T CARING ABOUT BABY PLZ HELP TO BABY PLZ ",1
1290674415882076161,"Thank you, Ben! 32,000 children in Florida are infected with Covid-19 and schools haven't even opened, yet. Trump and his goons haven't funded schools with enough money to open safely nor to provide for families who want the option of remote learning at home. It's insane.",0
1290675257871925249,"If you want to visit Norseal and see our drop seal cutting machine in action (it's the only one in Europe!) within COVID restrictions of course, then get in touch. The Geordie hospitality is great! Call on 01661 830088 and we'll get it in the diary http://ow.ly/Ufie30r1Q3t",1
1290642446045655042,"The Corona Virus stats are severely flawed, using this as an argument does not hold water. For example, how many cases reported from China? How many deaths attributed to COVID were based on pre-existing complications?",0
1290677418550857728,"The reason they refused to use detention centres anymore was covid. So , ok to stay spread out across the UK in hotels and mix with the public. Take care of them, but ####the British public.",1
1290676106299875334,"""Parents/guardians will be asked to perform a daily screening of their child(ren) for COVID-19 symptoms BEFORE leaving for school using a self-assessment checklist:"" Who's going to check the latch key kids, and what happens when parents forget or don't bother?",0
1290675146638991360,That’s because the hospitals could not send anyone with insurance and lose that money they were told to only send non insurance people to the Comfort so the hospital would not lose money they wanted the Covid patient’s to bill there insurance smh and this America,1
1290674693813354496,Professor David Baker's audacious approach to creating new proteins may offer new options for stopping disease—including COVID-19. ,0
1290675565729427456,"I count 2 masks. These young people didn’t get to decide their fate. As a parent, how are you going to live after your child or other loved one, dies or struggles to breathe after contracting COVID? How will you wake up each day after they are gone, knowing you sent them?",0
1290665311931334659,"So many; Me: “ did Trump just say that “ moments ! Trump: “ it is what it is.”regarding Corona Virus deaths, and EVIL disrespectful thing he said about John Lewis #thereisaspecialhellfortrump #trumpmustgo #votehimout",1
1290675212879626241,Coronavirus impact: Doctor gives advice for monitoring kids’ screen time amid pandemic — ABC7 Bay Area https://apple.news/AUUgJihfnT9KokYdJL5LZYg #COVID #screentime,1
1290677483646443520,"France could face a runaway spread of Covid-19, science council warns ",0
1290639868188487682,In March Birx/Fauci projected 200k corona deaths if we did things almost perfectly... 2.2 million if we did nothing... at 150k corona deaths Trumps response has been well within the range of almost perfect.,0
1290658063175815169,"@KTRTRS @TelanganaCMO @TelanganaHealth Please look into this matter. It could put hundreds of lives in danger. Allegedly, even some govt representatives are also endorsing him. According to his claims in some videos, some corona positive patients were ""cured"" by his medication. ",1
1290658735380213760,"@glenofthepower this corona overtaking virus, is just crazy, have you had to postpone wedding date also? I'm looking forward to normal life again, and see you guys go back to ""work"" ",1
1290659771092217858,“They are spreading corona in the air to kill us “ im still wondering why I ain’t dead yet,1
1290652896179126275,"#Arraed_News The deputy spokesman for the UN Secretary-General, Farhan Haq, said on Tuesday that the infection with the Corona is still increasing, and that the ability to test, track and treat people is low, and focuses on Tripoli and Benghazi. #Libya",1
1290677261147033600,"Sooooo a center that was set up to have enough beds to relieve the hospitals, would be covid only? And just for old people?",1
1290654830940377088,Really feeling very upset today . Day by day Corona increasing here. Oh God please save our lives from this pandemic,0
1290677130162913280,"Except the patent is public info, Vik, so Kennedy does have facts to back up his assertion. Also, new research shows Covid-19 RNA camouflages itself as human RNA which increases likelihood of autoimmune disorders from any Covid-19 vaccine: ",0
1290648220461404160,This is not threat. Multiple mumbai police's has died due to corona and also always stood for state in any cricises. Now you are attacking direct mumbai police. Think on it.,1
1290662540238884864,"Corona is widely spread in our country, and I'm in red zone and transport system in my area is not good. I'm feel very insecure to go out of my house, So please postpone CLAT #postponeclat",0
1290676688423092225,"And by “public”, you mean radical leftists that would complain if he told us the cure for covid... oh wait..he did.",1
1290676329457819648,"Are you preparing to head back to the office? We are, and we can’t wait to start seeing each other face to face. We couldn’t do it without the help of our Covid Safety Officer, Flora, who’s making sure the transition isn’t too ruff... #EmployeeEngagement #officedogs",0
1290675382144794624,Respected authorities @cbseindia29 you are requested to cancel the compartment exams 2020 due to the increase in covid cases. As if our honorable HomeMinister can be affected by this pandemic then what are we students? @sudhirchaudhary Sir please help in any way you can. @ZeeNews,1
1290655204585680900,"How could they care either way? They’re not even playing sports right now because you’re destroying the country with your bungled Corona virus response. Great job on that Axios crash and burn, BTW. Heckuva job, Donnie.",1
1290675900523130885,"Im actually more insulted by the fact that he said ""nobody has done more for black Americans than me"" while not even trying to back up that claim with stats, facts and figures. We dont even get misleading or misappropriated graph data like he did with Covid deaths.",0
1290675108982296576,.@LawDavF sat on the Chilcot panel Here he says the Covid-19 public inquiry must not be based on previous models. We will need something new ,0
1290649842843299841,"I'm thinking most people are no longer creeped out by this often-used image of the corona virus so its losing it's click bait power. That begs the question, what new image will media settle on to create the requisite level of revulsion. An intubated patient? A dead body? ",0
1290677242788487168,"No different from having an annual flu shot. Count me in! In fact, they could probably combine the Covid and Flu vaccines together for a two in one shot.",0
1290674834385571845,If we continue at this rate the economy with be decimated and mental health issues will be far more rampant than covid ever was. Is anyone really looking critically at suicide rate.,1
1290671163627143169,"I don’t get why people with cotton/polyester masks tell you to put your face mask on you’re a walking corona virus ventilation system, do your research",0
1290659350843994112,"It would be very dangerous to open schools, colleges at this time. Government isn't showing correctly the data of Corona patients and also their tests are doubtful. So be careful to demand to open educational institutions. Will our children able to face virus attack.",0
1290673075017613313,the situation with corona in america is out of hands i know they'll take all the precautions but it's still risky and dangerous,1
1290639631902531584,It's all BS Alan. Why are you entertaining this ridiculous corona lunacy anyway. Trump knows it's all rubbish. The US hospitals are being incentivised via funding to put deaths down as covid in order to maintain fear therefore compliance. He's just playing the media again.,0
1290675234371239936,"Dr. Mark Escott says after positive COVID-19 case numbers in Travis County were on the decline then plateauing, they’ve started to increase again in the past few days. He’s stressing the importance of not relaxing with masks or social distancing.",0
1290674494114127879,"""Instead of taking the summer to hone arguments against returning to the classroom, administrators and teachers should be thinking about how they can best support children and their families through a turbulent time. "" Literally all I think about. Well, that & dying from Covid.",0
1290675165207158789,Moral of the story stop getting too technical. Make noise after Corona,0
1290660823875162114,"Do you ever stop and feel so overwhelmed by life? I had this moment this year. Life fell apart, then Corona, then quarantine, and then my son’s self harm exploded. I felt helpless in the situation. Everything I… https://www.instagram.com/p/CDeKc9BH9la/?igshid=1o50ihvxuzncw",1
1290673823935860737,"From Ana Ceballos of News Seevice of Fla: Five people who attended Florida Sheriffs Association meeting last week have tested positive for COVID-19, and top state elected officials, including Gov. DeSantis, who appeared at the meeting have received a warning about their exposure ",0
1290638204974972930,"Thanks @AmitShah . Your dedicated effort and affection towards Delhiites, revived the corona pandemic situation from worst to better. Delhiites proud of their home minister . Now the time to Take care if yourself sir @BJP4Delhi",1
1290676203679088642,Liar you are just making up shit and throwing it out there hoping people will fall for it and vote for your lies again . You have had all most 4 years and all you have done is tweet and screw up the world ad let the Americans die from covid,1
1290674337855438861,in my district we had like 2 or 3 weeks ago just around 70/80 people testet positiv of covid from march on and in this just 2 or 3 weeks it went up to around 120/130 so that's about 60 new people in this short time. we fear a new lock-down in our area. ,1
1290674066857156609,Your president said “it is what it is” when asked about the rising death count due to Corona...we gone die #ItIsWhatItIs,1
1290653334240669700,Corona corona go away dont come back another day ,1
1290653207983726594,Congrats 2 Corona warriors . For the first time recovery figure exceeded affected figure.!A great psychological relief to people .Hopefully Govt will reconsider decision on weekend shutdowns which has been breaking financial backbone of poors @CMO_Odisha,0
1290676779284402177,"To all the people who stay saying “watch, as soon as the election is over later this year Covid will just magically disappear”.... I hope you’re right. I’m OVER this shit. I just want life to go back to how it was back in January &amp; February ",0
1290676237770186753,"Hey @ucdavis - implementing paid parking is not the best idea. My essential lab workers, if not able to ride, will need to take the bus and put themselves at increased risk of COVID.... This new policy means an increased risk of exposure to all who come to campus..",1
1290677265341145089,"Trump claims ""no one has done more for Black Americans"" than he has. You know who's done the most for Black USians? Black USians. They build your whole-ass country, busted their own asses out of slavery, AND still keep the US functioning while dying disproportionately of COVID!",1
1290673847654637569,they don’t even have audiences in music shows in Korea yall think they’re gonna be allowed to go to America ?)/£/£/&/& the place with the highest corona rate in the world ?/!:£/£/£,1
1290676712615874561,"you know what... maybe corona gave us a W and bts performing at the vmas virtually is a god sent cause not only they’re in the comfort of their home/country BUT we get decent camerawork &amp; lighting, full on stage set up and we can turn that sht off as soon as they’re done",1
1290665433205338112,"We are going to kill that corona, track it, hunt it down and take it out. Anyone know what that corona looks like?",1
1290675242738814976,"Have you ever wanted to get up close and personal with the farms in Alberta but don’t know how? August 15 & 16, experience Alberta Open Farm Days. Visit https://albertafarmdays.ca to book your tour today and learn about their COVID-19 safety precautions! ",0
1290656573472280579,China knows about his baby more than we do...Yes Corona Virus infected your Brain thatswhy you come to galwan valley on a suicide mission...Good luck happy Ending China....,1
1290676720564019202,We are all going to get COVID.. 99% will not even know that they have it.. The best thing you can do is prepare for it... Lots of Vitamin C (IV Therapy) and Hydro...Its like living in a trailer in Oklahoma. You know the tornado is coming some day. Prepare for it.,0
1290676343861018627,people are so dumb like we have THREE covid units and we just had to open another one and we are just ONE hospital in my city,0
1290649507416465409,producing drug by obtaining patent from US company is no big deal... may b u have also counted corona kit made by wrong no. patanjali... your jahil awam don't even afford underwear though ,1
1290645679912751107,"With Corona virus around, why are these people so earger to take selfie",1
1290675287781453824,"Ventilator(respirator is same thing) acquired pneumonia’s, pneumothorax (kind of like an air leak in the lung) from the pressure requires to ventilate people, especially with COVID because Covid lungs are stiff and require high pressures to oxygenate all the lung tissues....",1
1290673988952363008,"How should industrial manufacturing companies prepare to challenges brought by the Covid-19 pandemic? How should they leverage these trends to become more innovative, cost-effective and competitive? Find out more here: ",0
1290676752302448640,"Mine guilt tripped me into having diner with them and then told me after diner that they had my father tested for Covid and the test was inconclusive. Do I have it? I don't know, but I get to spend the next two weeks in horrible anxiety.",0
1290659262088314893,"If like 5 peeps jump on I'd figure out shipping, I guess international w/ the current corona situation would be a pain but something's gotta work out these are super slim !",1
1290636283895848960,Trump's plan was to blame governors of blue states for the Corona virus. Meanwhile tens of thousands of people died and Covid 19 didn't ask to see their voter ID cards or party affiliation. #TrumpFailsAmerica,0
1290674215700647936,"The accounts of monthly board meetings published on the group's website are cursory, says Chen. A summary of the December meeting, for example, simply says evidence of human-to-human transmission of COVID-19 in Wuhan was ""insufficient.",0
1290675264683479041,The flu season is coming even during the COVID-19 pandemic. Be ready to get your flu shots soon. http://bit.ly/2XtnUZf #BocaRaton #BoyntonBeach,1
1290650767389528065,"In view of the increasing challenges that State Transport (ST) is facing due to Corona crisis, a decision to provide ₹550 crore to the ST Corporation has been taken which shall definitely help in alleviating the financial difficulties faced by the ST Corporation.",1
1290650454427410432,"Pls tell me whr to give evidence to shw wilful delay n malpractice of corruption by your officers? Im ready to give and be fair to admit n take actions, how can simple edu loan be kept pending for such a long time? Corona came in Mar22, but it is pending since 2019. @PMOIndia",1
1290675795157909504,"The Corona Canon can become a safety charm that the workspaces can be equipped with, since it would keep them safe from the deadly virus thus, making them completely operational and fit for use.",0
1290677733165608960,Did you hear about the drop in premature births worldwide during COVID? Reduction is air pollution is a leading correlation. If you only tried harder there would be so many benefits.,0
1290675865840484352,We are excited to partner with French magazine @laviedesidees @booksandideas to exchange a series of essays about COVID-19 in a global frame. First up: examining the conditions under which some continued to work in Wuhan during weeks of confinement: ,0
1290661343750754317,It is always a joke that Chinese government spokesman standing there talking nonsense! People never know it is the CCP made the corona virus and caused such a evil thing of pandemic!,1
1290645278895333378,she tells us to use the mask the whole day(when you're only supposed to use it for 4 hours) because masks are expensive bro what do u wanna get corona and die or smthg???,1
1290635718331633666,The reason you’re there is how corona is spread? Worthwhile cause. Lol Thanks for announcing to the world your ignorance on the matter. Good day to you.,1
1290675508850515968,They have vaccines for the flu. Would have had one for this Covid had this administration acted sooner! FAIL!!,0
1290655380746502146,"Trump still hasn't taken responsibility for the ""great ""job he says he's done with corona",0
