Tweet id,Tweet text,Tweet label
1290673782387085312,"Don't be scared, we expected this. Some bad news: COVID will likely impact the economy and our daily lives for the rest of the year. The good news: we can plan and find ways to protect what we have and allow for potential growth! Let’s find out what this can look like for YOU!",0
1290672343522529281,"Hey folks, Have been Tested positive for COVID-19 yesterday. Seems like Corona is this alien trying to invade all of humanity. Rest, I m fit n fine n in isolation. Those been close to me n anybody having any symptoms pls get tested, its important to break the chain!",1
1290677572506976259,"Trump isn’t mentally ill; he’s just so stupid it comes off that way. Personality defects, sure but I want him to stand trial with no excuses to take it easy on him. My mom is part of those he has killed with his lies on covid. She deserved better; We All deserve better. No mercy!",0
1290640438622388226,"I hope once we get to the bottom of all these Ellen show allegations, we can finally figure out who let the corona virus kill 150,000 Americans.",0
1290676144245809159,"His muslim ban failed but because of his covid response, has gotten the US banned from Europe. I want to throw in the many bankrupties he has had. The GDP is the lowest it has ever reached in the US under Trump.",0
1290674405471903744,He is probably hoping for a school shooting to take the focus off of Covid. Nothing he does makes sense.,0
1290646890850258945,"Corona viruses have been airborne in droplets since God was a boy, it's how they work. The only difference between this corona virus and all the others in history, is the govt propaganda machine.",1
1290674686339231744,I honestly don’t understand that poverty statistics. How does poverty raise the likelihood of someone CONTRACTING covid. I can understand if they are more likely to not receive the treatment or have the resources to be treated but how is covid saying “I chose you cuz you’re poor”,0
1290655657042092037,"Keep up the good work! Tell the mainstream media the democrats to stop politicizing this Wu Han Chinese Corona virus! Hydroxychloroquine saves lifes, safe, and cheap 896,000 M .",0
1290673652057419776,"RT MercuryMakesPix: RT parkermillsap: Hey senschumer Please get the RESTART act included in the next COVID relief bill! If Congress doesn’t help the small venues, live music will collapse, and musicians will have nowhere to play or make money for a very long time. Please #sa…",0
1290674065666179073,"All of this and hardly anyone, but a few people without brain damage from all the news narrative, are seeing that this is civil war. I'm not going to tell anyone to wake up, it's passed that, so stay asleep. Covid is real, but so is liberty. Wear a mask or don't......",0
1290677350552571905,True words @anirudhofficial ! Love towards u is like COVID 19 Increasing day by day!!! With love #anirudhians Let's go crazy ,1
1290676641878773760,And wants 357 million to re-do the West Wing to make it look like a casino....with COVID relief funds meant to help the starving and our if work ppl,0
1290674035106308096,Months of lockdown & we just had our first teenager with UNDERLYING conditions die due to COVID related illness. How many kids have died due to suicide or drug overdose during this same time period? Unbelievable how some of you have such zeal about keeping the kids locked down,1
1290646754149490689,"Harsh judgment though, corona is a whole new level for a business man.",0
1290662630814896136,Allow please. People are going to clubs in Poland and many countries already. Corona is not going away. Let’s live with it and let corona live. Live and let’s live. ,1
1290677249067192322,"As GOI had decided to reopen all businesses except few keeping in view to provide relief to the people of India for their livelihood. So, if these are allowed why test is not possible by taking all precautions as per the Covid-19 Pandemic guidelines of GOI. Please think. Regards",0
1290673303821189125,I voted 2022. I already had anxiety with crowds since 2 years ago but Corona activated a new kind and so I can wait,0
1290674963582799873,"I hope they're able to go without a bubble. But when I see the Covid success numbers of leagues in a bubble like the NBA/NHL, and then what happens with leagues not in a bubble like MLB, it really makes me question if non-bubble is doable.",0
1290675427795783680,"People are not happy that you are still in the White House. People are not happy that over 155,000 are dead and over 4 million have Covid 19. People are not happy that millions have lost their jobs and are being evicted. November 3rd can not get here fast enough. ",0
1290651220751912962,"#Polen #Warsaw #Coronavirus Poland has registered more new corona cases than ever since the pandemic started. The authorities recorded 680 new infections within 24 hours, according to the Ministry of Health in Warsaw.",1
1290677527816667136,Caution: tocilizumab does not work for COVID and only serves to rip people off as well as harm with side effects. ,0
1290644039298158592,"Protective measures against Covid is only for educational places. These people have close friendship with Corona Virus, it will not infect them. Or may there is no more Corona virus.",0
1290675449958465537,So Branson tried to get government help for covid-19 for his staff and now he's flying to space next year. Definitely everything ok about this,1
1290674771831775232,Speaker Pelosi is still holding up this entire package over bizarre unrelated things like carveouts for the marijuana industry. She even claimed to the press that pot is a proven COVID-19 therapy! I hope she’s shared this breakthrough with Dr. Fauci. Can we get serious yet? ,0
1290676909483995136,Measures to contain COVID-19 led to @KendraScott's retail stores being shut down w/ its primary distribution center reduced to minimum basic ops. See how we helped them to quickly implement #ShipFromStore + #ContactlessPickup capabilities. #PushPossible https://bit.ly/383kYGU,1
1290676590171447296,"stop calling yourself a human if you will discriminate those people who are still in fight against COVID or already recovered. BE A HUMAN, NOT A VIRUS!",1
1290675538328133632,The dead in Nursing Homes have no voice. Gov.Cuomo’s actions took their lives. The nation learned that Cuomo’s decision to admit COVID cases to Nursing Homes led to thousands of deaths of vulnerable Nursing Home Residents. ,0
1290675171083378692,"Hold up, our city is cancelling pandemic leave at the end of August but you still have to miss work while you wait for test results after having any possible COVID symptoms? Ummm.....",0
1290646961553645568,How did Google become such a horrible search engine? It can’t find me a single news item in English that doesn’t mention Trump or corona virus or pandemic? Other searches are just terrible also. Most searches not news related in the regular search come up with news items. ,0
1290675441141981184," rigghhhtttt...and I never get a vaccine for anything nor will I with Covid, but nice effort though",1
1290673811327680513,I wonder how many of these families are going to be regretting the choice they made to send their kids into an infected cesspool of Covid?,1
1290675592464080898,Was this the county that on the first day a child had tested positive for covid19 and was walking the halls and had been in several classes. sorry but for some parents this is like signing your child’s death certificate. With covid ur kid maybe among the deaths not worth it,0
1290656644326723591,"""Hunger may kill us before Corona Virus does"" exclaimed the daily wage earners of our country. Let us get stronger to provide for the plight of these unsung heroes of our nation. #AACovidWarrior Become a Volunteer: https://forms.gle/SeL5WGch7bvZFZYu6",1
1290639843777753088,TELL THAT TO THE GOP CONGRESSMEN WHO HAVE TESTED POSITIVE FOR CORONA VIRUS; the one from Texas went to his office to tell his staff that he tested positive. They now have to be tested. THOSE CONGRESSMEN CHOSE NOT TO WEAR MASKS. ITS THERE FAULT.,1
1290676121885958144,Follow the link below where you can view our brief guide to restrictive practice and ways to reduce its use during the COVID-19 Pandemic and beyond: ,0
1290676882682322944,"Clearly pushed, this is a strategy to get chiwenga out of hiding. Watch the space! Another ""covid"" death in motion!",1
1290648569372958722,"TOMORROW WILL BE THE GOLDEN DAY FOR EVERY HINDUS . THE AYODYA RAMA TEMPLE IS TO BE BUILT SOON. LET US ALL PRAY FOR THE BEST THINGS TO COME IN THE FUTURE , THE ONLY PRAYER WHICH ALL PRAY IS TO GET RID FROM THE DEADLY VIRUS CORONA , LET US ALL PRAY FOR THAT",1
1290674193500196864,Broh you'll get yourself into trouble . That video is from way back. You know how this guys are sensitive about Covid 19 issues,1
1290674326501457921,"This Axios interview with Trump is just... like... y’all reallly put this man in office like this for the past four years?!?! 150,000 people have died of covid. 30,000 are predicted to DIE in the next three weeks. But Trump doesn’t see the problem. VOTE HIM OUT IN NOVEMBER!",1
1290676120879271938,Also @SecPompeo @TravelGov the K1 is not a threat to jobs and health as we can safely enact policies to prevent the spread of covid. I work in a hospital and can give you guidelines on what to do if you will let me. Please hear me out and listen to our side of the conversation,1
1290655959300308993,How many new country songs will have the words Covid or Corona in them? Probably all of them! ,0
1290674620719411206,Health Ministry Says Covid-19 Recovered Cases Double The Active Patients; Fatality Rate Lowest Since First Lockdown ,0
1290677609714470912,@melissadderosa @NYGovCuomo Murderers always try to blame others for their crimes. That simple. His mandate KILLED close to 7000 elderly/frail. He cannot run from it. He left at least 3 sites unused while mandating Covid + into nursing homes.,1
1290675276511432705,"Since the start of the COVID-19 outbreak, @witfacilities employees have been working hard on campus, sanitizing and reconfiguring spaces, establishing social distancing parameters and making upgrades to several areas https://bit.ly/2BWVfnU",1
1290650454561619972,"seen odds of 18/1 for the raptors.....been really good since corona, might of dropped by now.",0
1290675463774511104,@PlanetFitness can I get a refund of my yearly fee if I want to cancel bc if COVID? I was just charged today but feel no where safe enough to go to a gym.,1
1290675435324358661,"it's a virtual performance, theres no way they're going to risk themselves and go to a country with 4M covid cases",0
1290676623545643009,"I believe he's the one who demanded that post, he's said to be against the appointment of DJ Biscuit (Obadiah Moyo) in the first place and reports say he wanted to head the Corona virus taskforce.",0
1290675399119314951,...his administration instead of actual small businesses. There' s the constant lying. There's the fact that the US is 25% of Covid deaths worldwide. He's against the free market and doesn't understand the first thing about leadership...,0
1290660125984817153,Isn’t it nice to be able to save a whole country by going there on a corona vacation?,0
1290653208797499393,"Girl idk, I have more than one condition so I feel like the risk is too high for me. With my luck, the minute I accidentally touch a surface with my pinky, BOOM corona ",1
1290674309325819904,"I think its really lame from UEFA to put that weight on the clubs. Not even making an effort to adapt to the new “corona times”, just throwing the responsibility on someone else’s shoulder. I’m angry (but not surprised).",0
1290675858718457858,"“When I took over, we didn’t even have a test” - the United States president talking about tests for covid-19",0
1290655979533750276,"How is the ground breaking ceremony even allowed at the moment? Corona doesn't differentiate between religions, BJP does. Obviously you know who the bigger virus is",0
1290675651775799296,"No Step, No KD, No Klay, No Kyrie. Season was already iffy before COVID, big names not playing. I want to see the best of the best go at it. Lakers lost key pieces. Its just a diminished season period. You all have a right to enjoy the product they scraped together.",0
1290675391103930375,"Ministers are meeting around now, to decide if all pubs can re-open on Monday. The Cabinet will consider advice from the National Public Health Emergency Team, which is concerned at an increase in Covid-19 cases over the past week. ",0
1290676481920774144,7) No one said masks will solve covid-19 but they are part of the solution to slow the spread. Are you aware that the US has 4% of the world population yet 25% of the cases of covid-19 and of covid-19 related deaths? Literally every other country has handled this pandemic better.,0
1290674985665728512,Fortunately it looks like you probably can't get covid over and over again for now.,0
1290652093049638921,So you saying the Corona virus doesn't exist? God said his in Word that my people perish from the lack knowledge. I know people who have died from this and I myself is a Corona survivor. Sir you are wrong and you need to reexamine your moral compass and the Word God.,0
1290642830377881600,funny cause the us had massive bread lines and food lines in response to corona virus because of how unprepared we were and because of how faulty a system like capitalism is,1
1290676412257652742,I’m so sorry for your loss. I know it was rough before Covid-19 but navigating the health care system—and daily living—with a child with cancer during this pandemic has multiplied the terror. What makes it much worse is knowing it didn’t have to be like this. Peace to your family,1
1290673886472724480,Stupid indeed. I’m apolitical and I want people to think about something. How are these people so concerned with the spread of COVID but they’ve allowed these protests all over these Dem run cities? We’re those conditions not ripe for spreading. But we had no concern for them ,1
1290676829389492225,"Oh, @realDonaldTrump. People are not happy about the COVID infection, hospitalization and death rates, either. Maybe you could give that a little attention. Just a thought.",1
1290654269335572489,"Marco would you care to address important things like ,oh I don't know say Corona deaths, voter suppression, Russian bounties, or maybe even Trumps Manhattan DA investigation. Instead you're worried about tik tok. You 5hinknyou could do something for the people of Florida.",1
1290673662094274561,"If they had the ability to reason, they'd recognize their behavior will cause an extreme spike in health care costs as the insurance companies recoup their COVID losses. But, of course, they'll blame the Democrats for that too. Personal responsibility? Not on their menus.",0
1290674070980136960,"If he gets reelected, it won't be four more years. At that point, we will be on the downward slope to Nazi Germany circa 1944. I'll go to the polling place to vote if necessary. I'll risk Covid. It's that important this year.",0
1290676563806162945,55% of Covid-19 hosp admissions show increased rate of psychiatric disorders. &amp; thats not taking into account the huge psychological impact Covid has had on general population. The mental health pandemic is yet to peak! ,0
1290676540116807680,"I’ve been to his office for years, before Covid, asking for a town hall. Given this teletown hall BS. In his own hometown. Wonder why folks are mad. Daines doesn’t listen. To 40-45% of Montana’s who are Democrats. Good Republicans know that’s not right. ",0
1290676760447787009,I'm just here pointing out facts. You have repeatedly stated that NY is the worst state in every respect of covid. That is a lie. There's enough misinformation flying around without having your ignorant lies splashed around everywhere. Do a bit of research it's not that hard.,1
1290675555151618049,"Our fall from Grace as a country may be permanent. The last thing I care about is debates rn. We know who these 2 men are. If you are still with 45 after all of the open corruption and 10s of 1,000s of unnecessary Covid deaths, a strong debate performance is not going to move you",0
1290675004552523776,6 months of continuous attacks on Asian people across the world bc of Corona and what we get is more is this self-hating bs lol. It's okay to be Asian.,0
1290638506537168897,"Delhi Health Bulletin 4th August 674 New Corona Cases TOTAL- 1,39,156 cases 972 Recovered today TOTAL Recovered- 125,226 12 Deaths today Total deaths- 4033 Active cases is 9,897 9,295 Tests done today 5461 Home Isolation 3762 Hospitalized Patients Recovery Rate 89.98%",0
1290675488491536384,It’s certainly an improvement compared to the last few months. Few more weeks I reckon before I can stop taking them. GP has been on the ball and v helpful with tests/diagnosis/treatments as know not all GP are aware of long covid,0
1290651008834641925,U see why you fool? You didnt know we in corona era! your own polling station should be a walking distance cause you live around bus people! Are they all one family! Think nigga think,1
1290675655647072256,Absolute nonsense. This govt screwed on covid-19. Son is self testifying govt did gr8 job. Lot of points unanswered by the govt &amp; police on late actors death Son is self testifying nothing suspicious found. Present govt is extremely dangerous this case should be hand over to CBI,1
1290676187833008131,Got my first covid test yesterday. Everyone in my house hasn’t even had cough since pandemic started to be honest. Watch the bullshit come outta no where tho,1
1290674163343142914,"MAKE COVID TESTING FOR ALL STUDENTS, TEACHERS, ADMINISTRATORS &amp; STAFF MANDATORY B4 THE OPENING OF A SCHOOL ANYWHERE IN AMERICA! That's the first thing to do.. The EARLIEST schools are already having covid infected people STARTING school!",1
1290674159241121794,Have over 150 hours of leave and no where to go. Never had a leave balance like this. Boo COVID boo! ,0
1290654706898018306,"Compare only active cases, UP is among the last 5 states on all corona parameters. ",0
1290674985258725376,"Business Assistance Grants for Small Businesses affected by COVID-19 Available Now! The City of South El Monte is awarding Business Assistance Grants in the amount of $5,000 to local businesses affected by the COVID-19 Pandemic. For info., (626) 652-6800 or visit City website ",0
1290666246535614465,American Exceptionalism is me feeling like I have to take out a dementedly huge loan to live on campus just so I don’t give my mother the corona virus which would kill her,0
1290666313858375688,#HRDMinistry #RameshPokhriyalNishank our home minister #AmitShah also got covid +ve inspite of taking so much safety and ordinary people cannot take that much precaution then how can they will be safe from corona. Cancel compartment #cancelcompartment #AnuragTyagiClasses #cbse,1
1290677756515295232,"At the Washington Post, Lena Sun on what happens after a vaccine for Covid-19 is approved. Given the Trump administration's record in these pandemic months, I suspect chaos will follow -- as Sun more or less suggests today. ",0
1290654401762406402,As if Corona virus is not enough &amp; taking care of ourselves is not enough.,0
1290676050947604485,"Hi Gregg, we've currently paused operations up until 15th October. If you're travelling after this date, we're monitoring the situation caused by COVID-19 closely but the cruise is scheduled to go ahead. If any further amendments need to be made, we'll be in touch with guests.",0
1290653261385654272,Please Promote All the students @cbseindia29 #cancelcompartment #cancelcompartmentexam2020 As because all students are depressed due to Corona Virus So we all students request you to Promote All the students @PMOIndia @HRDMinistry @PrakashJavdekar @AmitShah @DrRPNishank,1
1290642089232027650,"Mam,second para is the truth, there won't b one time vaccine, few vaccines r already available like Pneumococcal nd others, this is all market Gimmick. Only Self Hygiene and Social Distancing can avoid Corona. ",1
1290676512677482496,i hope bighit won't let BTS go in here!! that would be dangerous to travel since there are covid-19!! ,1
1290661300775919617,"He died from a heart attack dude. He was saying he couldn’t breathe before he was on the ground and before Chauvin was even there. He had a near lethal dose of fentanyl, as well as meth in his system. His arteries were almost completely closed and he had corona to top it off.",0
1290638077669584899,the way this is my last real summer break and i don't really meet up w/ ppl bc of corona and there are ppl out partying and going on vacations in different countries... i-,1
1290651280306769924,"As soon as Corona is done having HER moment, I’m running straight to church!",1
1290675665986097155,"On March 25th, New York health commissioner Howard Zucker ordered nursing homes to take back COVID-19 patients from hospitals. Months later, Zucker stands by his decision. But several members of the State Legislature say it resulted in unnecessary deaths.",0
1290663346879049741,"Why not same principle apply through out the Maharashtra, it is injustice towards Konkanwasi, Government should be treat all citizen equally, but this decision is against equality of human being, Outside state people coming without Corona Test. Disgusting decision Mr.Parab.",0
1290641653208932367,China is very desperate to have relationship in this time the whole world point the finger towards Chine accusing by spreading the corona Virus to the rest of the world and this accusations lead China economic to go down and most of the African accused China target African people,1
1290674494109974529,"This is my 7yo’s new normal. He adjusted great to wearing a mask all day at school. He told me even though it’s uncomfortable he wanted to protect his friends and teachers. If he can do it, so can you. #MaskUpIdaho #Covid_19",1
1290660327873552385,"It’s sad, is scarey for our country, but it’s extremely illuminating to how trump thinks. He says that we are handling Corona well because he is taking the total number of dead Americans and dividing by the total tests. Ignorance topped off with a complete lack of empathy #MAGA",0
1290641338606792705,A life without Corona. Maybe? ,0
1290674459012104194,"You do? What gives you that impression? Not trying to be facetious, I'm genuinely curious as to what anyone on the left would admire about the current government. Brexit has been a disaster, income inequality is worsening, and we have more COVID deaths than any other EU nation.",0
1290655206238191617,"Population of Bihar is :12 crores But Testing per day only 15k-20k. In the small no of testing there is huge no of corona positive cases come i.e. 2500-3000. If govt will increase testing, positive cases will much higher. But cm is self quarantine. #बिहार_बीमार_नीतीश_फरार",1
1290637197817843715,"While the rest of the world is distracted by Corona virus and our own internal fights, Russia is quietly taking over the world. These developments will haunt us for decades to come. ",1
1290667321879535622,"When the world was building a hospital during the Corona period, the anti-human people of India are engaged in building the temple. #5_अगस्त_काला_दिन",1
1290657207286145026,the way she is covering her mouth with her hand ???? LMFAOOO she thought corona gonna just see her hand and take a U turn,1
1290650810020507648,Contd...I was on board when my CDC expired. Stuck on ship due to corona .Please help me out to know my application status and please sort out this issue.Thank you,0
1290640348050534402,"If you are in a New England state where the Democratic governors are our enemies, we couldn’t care less what happens to you. You should have gotten the message with our nonexistent Corona Virrus reponse. Love, Christian Mike",0
1290671087517401089,"Depending on who gets elected. Trump wins, dems keep corona; dems win, corona goes away to be replaced by communism. Id rather we had an actual real disease instead of communism.",1
1290674321451618304,It stopped for a little while during 1st COVID #lockdown but they came back. #USA #UK Increases Respiratory illnesses &amp; more All those streaky clouds are #chemtrails The place is being poisoned. 'See What In The World Are They Spraying? https://youtu.be/rEUg8uLoZNY. #Geoengineering,1
1290676692873248768,So proud to work for Med-Call Staffing! Businesses working to implement COVID-19 screening as people return on-site ,0
1290673827387781121,"Hi Lesley, I'm very sorry to hear that she's had that experience. We do take into consideration factors such as financial difficulty and COVID when a payment is missed, if she would like to get in touch herself we can discuss her options in more detail - Maggie",0
1290665655197286400,"Vivo is a miniscule game. Attention diverter. See bigger picture and find out what the #ModiAndAmit duo are hiding. Actual state of Corona, Indian fin health, fin bankruptcies, Rafale kickbacks, who is profiting in race to buy arms spree etc. LQQk beyond Delhi fog. LQQK 4 truth.",1
1290677424364101632,I hope they dont. Its actually really insensitive to have such a huge event while people are still dying and being diagnosed with covid. America is crazy. I swear putting hundreds of people in danger. For what? ,0
1290674993089646598,"the wildlife seems to be thriving, and a much-needed mental break from COVID fears and political/media intensity...every day is an eternity",1
1290676095491203073,"You do whatever. You want school buildings to open physically and safely, certain things need to happen. There’s no magic Covid wand.",0
