Tweet id,Tweet text,Tweet label
1290655939046014985,"hello, good morning, i would like to share a real-life example of the epitome of selfishness regarding this pandemic: an engineer of mine is constantly yelled at to wear his mask correctly. he's had multiple corona scares -once with symptoms, twice in a week bc of exposure risk",1
1290674807374315521,"i feel absolutely horrible physically, am i getting covid it is it just the week before my period?? love my immune response falling apart ",1
1290673756122370052,"I’ve honestly given up watching/ giving any attention to media outlets re COVID 19. I systematically check @ProfKarolSikora on twitter every few hours. No political slant, uses figures to demonstrate a point and is so much more informative! #thankyouKarol",1
1290650373573804032,Am realised corona is boring. Next year we want different something like vampires zombies . #justkidding #allahraham ,1
1290675344085782528,I wonder how many jobs will move back up north after the southern states debilitate all of their workers because of not paying heed to COVID-19.,0
1290674085291319296,"This academic year was difficult for most of us, particularly in the UK. We faced industrial action twice in a row which caused distress among students who had less contact and teaching time with faculty. Covid-19 then hit us all, causing significant disruption. (1/2)",0
1290675590446686208,He's used the covid crisis to make a large land grab. Almost as tho it's preplanned to me. He must have dimwitted left wing advisors.,1
1290676344238608384,Tonight! Meet with your local ward councillors and share your experiences of the COVID-19 pandemic at the first ever virtual #CommunityConversation in @lbrut on 4 August. Register to attend here https://bit.ly/2Oih3Nt and have your say about what matters most to you.,1
1290676824813568004,"Southwestern Public Health confirmed another 12 active cases of COVID-19 today. We currently have 79 active cases in the region, with 15 in Oxford County. ",0
1290674052965662720,"What day is it!! Lmk if you wanna do something in game, or if you have a wishlist or things you're looking for? Y'all helped me have a nice bday weekend despite Covid times and I'd love to return the love! ",1
1290671589554626561,mm i really don't know if i want them to go honestly ://// like usa is the country with the highest number of corona cases ,1
1290676432570548226,like maybe if the situation was better but considering how the us is at in terms of covid... nah you would not catch me setting a foot there no matter where i was from tbh,1
1290659437099782148,@cbseindia29 #cancelcompartment Sir please give us average numbers because the corona cases are increasingly day by day in huge amount and to give exams in that situations is not possible and it is not good for us and for our family. #cancelcompartment,0
1290673727605096448,My best friend and I tested positive for covid-19. She was lonely and tired of staying home and decided to go out. It only took one night for her to get sick. She passed it onto me without knowing she was even sick. The first few days were the most excruitiating for us.,0
1290676398944735233,... in a country with the highest numbers of cases and deaths in the world for COVID-19.... in one of the state that has the highest number of cases and deaths... they still haven’t slowed down nor flattened the curve and thinks wearing a mask to prevent the virus is myth.... ,0
1290674540146819072,"Not really. I know that Africa has a much younger population than in the West where our populations have been aging for a while. At the same time they have fewer resources, including in Zimbabwe where officials stole the Covid $$. It may be a wash.",1
1290661041773346818,"#Arraed_News On Tuesday, the National Oil Corporation renewed its call to lift the forced closure of its oil facilities; So that its international partners can provide more support to counter the spread of the Corona virus. #Libya",0
1290676144493166593,Sorrento therapeutics is going to cure Covid and will also have a hand in opening the country back up. Mark this post! Forget Novavax and Moderna two companies never released a drug in their career,0
1290676413029392385,the covid situation in Thailand is really good there hasn’t been a death in months and cases are only rising by 5 or less a day on average but yeah I get u haha,1
1290645715392376832,"I still don't understand why our government is still letting these corona petri dishes in out country. They don't realize the only reason they're coming here is to escape corona in there country, not for vacation. ",0
1290675464906964992,"We are tired here. My coteacher saw this book (upside down) and said ""I thought that said A Cough Day"". Well in Corona times Send help ",1
1290672386589642753,Someone wrote a script for movie but due to corona no director accepted the plot but BJP leaders found it perfect on the backdrop of Bihar elections! Replaced the characters of the plot with deceased persons &amp; circulated the third grade movie story via brainless leaders - trolls!,1
1290665397117759490,"China don't spare its citizen whoever they might be, and this small eyed country is talking of cultural superiority and another thing we don't convert the religion of minorities like Chinese corona king xing ting ping",1
1290676022258491393,"@realDonaldTrump Why should someone that has a job get a stimulus check, that is not really fair in my opinion? Us that have lost our jobs because of COVID-19 need money now! I am appalled at the fact congress (both democrats and republicans) cant agree on unemployment aid!!!",1
1290671541638832128,"Me watching #RawUnderground roasting the shit out of it AND still loving every second of it...bc I’m surrounded by corona virus, climate change and the election and I might as well die HAPPY. ",1
1290671793984897025,"Still raging I took my 13 year old cousin to the Hancock during the day and its 18+ even during the day. Students have gone, pubs empty cos of corona.. youd think they'd change the rules a bit. The £1 pint days have loooong gone",1
1290675676714917889,"Well I did not think the gops could be so cruel, And I'd never send our kids to COVID school ",1
1290676081524191234,"Logic 1 - If we test more, & more ppl have COVID-19 then our #’s will b high but if ppl don’t have it, and we still test the most the results would indicate less pos results Logic 2 if we have more deaths/pop than oth countries then we r the worst country related 2 COVID deaths!",1
1290676932909117440,"And that's why @JusticeCanadaEN and @ONAttorneyGen need to let the judges, Crowns and defence lawyers on the front lines find solutions to the problems caused by COVID, and not take away their discretion with arbitrary new measures like they did with prelims and jury selection ",1
1290675567348420608,Stop sabotaging the Census. Give organizations the times they need to accurately count their communities. Congress can address this impending disaster including the necessary extension and Census funding in any COVID-19 relief legislation. ,0
1290662928061018119,"Really sick of realtors from CT betraying the rest of us and specifically aiming to have city people move in up here. Thanks for causing the second wave of corona in this area, you’re a cunt",0
1290638383635734528,Are you guys serious... lol you can’t put all death under corona and talk about death in regards to population. It’s not rocket science many just don’t analyze I guess ,1
1290670146906988549,Wait if its live In New York does that mean BTS goes to New York cause honestly I would be very wary especially with corona and now this hurricane I would kinda want them to stay in Korea I know it’s might decísion but like it’s my opinion if they do need it come here.,1
1290663678220668930,"It is scary to watch this. Anyone on the fence should view this. It is astonishing to know that this moron is at the helm. Sitting with his 3 photocopied pages, trying to deny the critical situation with Corona in America? ",0
1290673103870205952,"Doesn't Corona virus spread from surfaces coming in contact with the infected person, to others? How are they planning to sanitize these files now?",1
1290675780813492225,today I get to decide between having to be exposed by twelve people to covid for the next week or not getting to see my brothers until they're adults,0
1290675587028258818,It’s honestly so embarrassing. I feel like the US will be stuck in a loop of Covid-19 for a while bc even our president doesn’t care and thinks it’ll magically go away. So frustrating ,0
1290675313308033024,"How many people have lost loved ones who died alone in hospitals because of COVID-19? Does he wish them well, too? Is that a big deal?",0
1290642564023017475,"@arnab5222 @republic @MumbaiPolice @RajThackeray @Dev_Fadnavis Such a dirty politics is going in this critical situation, Mumbai now in control of corona cases that's why opposition and paid media channels like republic tv making personal allegations on CM .#SaveMumbai",1
1290675971339689985,"People are not happy that 157,000 Americans have died because of Covid-19, which your administration handled poorly from the start.",0
1290639973343993857,"After this corona, let's support them in numbers. This resort really does care for its community. I will definitely aim to visit the Eastern Cape shortly. ",1
1290661999672725504,"Do we understand how serious Corona is yet, this virus is worse than before the shut down. People started listening to Trump's bull and let down their guards as if corona had a cure. Corona is worse than cancer, people are dying like okay this week, dead next week. I'm staying in",0
1290675480371384320,"There is also a bunch of GOOD DATA/Information about the virus too! So, shall we not talk about this either? The only bad data comes from tRUMPTURD! I’ve battled Covid! 1 case, 1 death is too many! Stop peddling the bull !!!!",1
1290667307128168448,Get ready for it .....that's not Covid 19 and this may come as a shock to you ....what works on one type of Corona virus doesn't necessarily work on others. Hence the ...actually I can't be bothered you obviously like being lied to.,0
1290676445782695938,"Collective book «Legal studies on the COVID-19 pandemic and the State of Alarm Decree» (https://bit.ly/31aA5ve) of @acienpol, with my paper on «COVID-19 and tax assessment». Thanks to professors @arbrewercarias and @hromeromuci for their kind invitation.",0
1290668604543778816,"It's big jok made by baby penguin ha ha dirty politics see who is saying that bmc, palghr, jiaa, disha, corona, lots of thing gvnt failed everywhere exposed day by day",1
1290676602993430528,Someone has said I tried to break into their car for some type of revenge like? I don’t care about you enough to do that over catching corona ,0
1290664076192952322,"There is nothing that I need outside my home that will be worth dying for from corona, I'm shutting it down my damn self, no one is coming to my home. call, e-mail or text. I cant' do it. Trumps leadership is again tested, Gov't financial assistance, schools re-opening, election.",0
1290661087201955851,Mikel knows we can't take risks in attack cause our defence is ass once we get 2 CMs and go 4-3-3 FT we will be more attacking like we were pre corona ,1
1290674307052589056,"This is good news.. Thank you As an aside. Why can't this be done on #Insulin ??????????? Many many many people have to pick insulin or pay monthly food,gas,and rent bills USA TODAY: States: Lower cost, boost supply of COVID drug ",1
1290677587203600386,"I was working with a leading bollywood magazine, it was on hold due to covid but I pledge not to work for any bollywood relatd industry now on. B'wood you disappointed me. I was a BIG fan. #SushantCoverup #CBICantBeDeniedForSSR #CBIForSushant @republic @BeingSalmanKhan",1
1290656172329111552,then maybe get corona under control ,1
1290674667854979077,like i said covid if that’s you go away,1
1290676830555516930,"Between budgetary challenges, our housing crisis, COVID, our infrastructure deficit and a looming recession/depression, anyone considering asking upper levels of government for $1b for games should be ashamed and embarrassed. We have many bigger problems. #HamOnt",0
1290674587378675718,"For those who somehow don’t know, Trump is a driveling moron. We aren’t doing well. By virtually EVERY metric, we’ve had the worst response to COVID-19 in the WORLD. And he’s the person who bears greatest responsibility. Period. #TrumpIsAColossalFuckUp",0
1290674684095275011,It's the people wearing the masks that just 'don't get it'. Take a look at the real risk Covid 19 poses (not the government and media propaganda) and try and find any justification for any of this madness.,1
1290659501268500483,"@ncdirindia Efficacy of Favipiravir in sobering ferocity of corona in mild, moderate, asymptomatic patients is known 2 months ago and Glenmark, Hetero, Sun Pharma are making it. Can govt now go armed with these drugs to red zones, even treat asymptomatics?",1
1290677646360219649,No PPEs No Work Forward with Covid 19 Risk Allowance Forward! #SAMWU wish Worker's a Happy #Women's Month! Let's Wash our stay at keep social distance wear your mask always. ,0
1290677184458379266,"There are two I read recently one by Pentagon, the other U.K. based. I’ll try and find them for you. Note I said Coronavirus, not Covid-19. That data won’t come along for a while.",0
1290673962419195909,"Trump 1,000 Americans dying from COVID-19 a day: “It is what it is” Trump on being confronted with statistical data of U.S COVID-19 deaths per capita compared to other countries: “You can’t do that” Block me if you still think this a person worthy of the office of President. ",0
1290677769387548672,"Christina thanks. Therefore,due to Govt and NHS Covid restrictions 4452 patients were removed from the waiting list (379 via transplants) between Feb 20 and 30 June and only 379 transplants in first quarter this year which would normally average 1028 transplants a quarter.",1
1290674113141448704,"In line for a Covid test and the lady behind me looks like death. If the wind was blowing the other way, I’d go home.",0
1290674599986958341,"Every since COVID has rained down on us, I’ve been slowly waking up later and later. Some people would find that to be cool.",0
1290646690479972364,Guys this is corona medication...my friend recovered in 5days by using this course..share to everyone in needy #staysafe #sarkaruvaaripaata #VakeelSaab,1
1290675711812960274,"Average age 81. Most would of died anyway, 25k die each year from flu and that is with a vaccine. Destroying an economy for covid will kill more people via poverty and depression. Protect the vulnerable everyone else go back to work and normality. You can stay under the bed.",0
1290676394897416192,"We’re thrilled to share Franklin University’s Leadership Center is hosting its first FREE webinar on HR Realities During COVID-19, tomorrow! There’s still time to join in! Register today: https://bit.ly/2Eaa9bf #FranklinMakesItPossible",1
1290675077202284545,"Public services were not in fit state to respond to Covid-19 after austerity, study finds ",0
1290674250039414784,"State news who said Covid was a hoax! It wasnt &amp; it didn't magically disappear, trump doesn't have it under control. He doesn't care about anyone except himself. 156,000+ dead but ""It is what it is."" If Pence grieved he'd have done something! 1000+ dying daily Covid widespread.",0
1290660320780980227,"After all these years, finally this day has come and because of corona, us devotees couldn't go there and witness this historical moment ",1
1290677292218425345,"Yes it did. I live in the third largest city in the state of Georgia.On March 1st we had had 15 deaths, 13 from one nursing home all over age of 78. As of today...still only 15 dead. Keisha Bottoms, Mayor of Atlanta had Covid and felt fine. We did learn a lot from June.",0
1290666638711427074,Which Maharashtra achievement is he talking about? Corona is worst in Maharashtra..No one is jealous because you have done nothing to be jealous of. But yes everyone hates you and you know the reason very well.. stop hiding behind the words dirty politics.,1
1290666748379791363,My dear friends .. Plz take note of this report that deficiency of Vitamin D in the body increases the risk of getting infected by COVID-19 or Corona Virus ! So to boost immunity plz ensure intake of Vitamin D. Plz share it with all ! ,1
1290673778779799554,"First time listened to show since Edm/Winnipeg game back in market Pre Covid, good show today , sports back",1
1290677254335365120,"The challenges our state is facing are daunting. We need real solutions in this moment. We need to learn the lessons of COVID and listen to scientists before it’s too late. Join us Tomorrow night, August 5th, at 7pm ET for our virtual campaign kick-off! https://bit.ly/stimulus-kickoff",1
1290675093039874049,"No you are not. Texas has overtaken California in number of COVID-19 cases. You had months to get ready and you F’d it up. Hard-working Texans don’t like dying, Corny",0
1290642141589450752,May the good Lord save us in this case called corona virus,1
1290675931393200128,Take care. I might do the same for a few weeks. Due to Corona I got the feeling Twitter got even more vile.,0
1290676369131806721,Got paid off from my old job yesterday because of this corona shit and have got another job today! Absolutely buzzing for a fresh start ,1
1290675947713236997,"@lululemon Shipping Fail. I ordered team gifts on 7/20 with Rush. Stuck in customs since 7/22. Covid delays, I get it. Customer Service says it'll take 10-15 days for them to follow up with Fedex, and if I reorder, can't ship another way. Will miss deadline for gifts now.",0
1290674319157231623,"Really sorry to hear that Sarah, did you complete the booking directly with Vueling or with one of our other partners? That'll be who handles the refund here, but they are generally taking much longer right now due to COVID -Sean",0
1290677116036624384,"Texas is bad right now covid 19 and its still up it hasnt gone down, I do not want to send my kid to school, my son end up having the covid 19, he just got over it thank God, no school sorry Trump I don't agree with you at all it won't be smart to send kids back to school",1
1290676283584778245,"Our number one priority is safety – for the people who fundraise on our behalf, and for the fantastic Great British public who are so generous in their support for deaf children. Find out how we’re fundraising during COVID-19 on our webpage https://bit.ly/30AwWEO (2/2)",0
1290652098691031045,Remember in March when people said corona would be a 6-12 month journey? Do you believe them now?,1
1290676901439254528,"What I'd really like is a sequel to True Lies. All the leads are still working, covid aside. Lets get more Arnie less Avatar.",0
1290677038299283456,"(2/2) That gives you a certain sense of security and confidence and I think it's very important that people feel comfortable approaching the correct authority if they think they've contracted COVID-19. The most progressive and functional govt in NE, for sure! ",1
1290647379516043264,"I don’t understand how in long term this will affect more China than USA/EU as this will naturally push them to digitalization and modernize rapidly.. plus if nobody buys the crap from China, their economy is gonna tank and corona will be least of their worries...",1
1290639923138232322,This is why #CorruptGOP are holding up the Corona Virus Relief You’re continued support for the Party of Death is in direct conflict with your lives Get smart #VoteBlueToEndThisNightmare,1
1290674993106493445,Escott says there is concerning news out of Florida regarding school-aged children that have died due to COVID. He says we need to pay attention to data when we consider responses in our area.,1
1290675753777070080,And for mandating that elderly be accepted into nursing homes with a positive covid result as well as mandating that nursing homes are not allowed to test new incoming residents. Not allowed!! Then took down the mandate from the state web site after you came under attack.,0
1290676923765383168,How Face Masks Can Help Prevent the Spread of COVID-19 https://www.the-scientist.com/news-opinion/how-face-masks-can-help-prevent-the-spread-of-covid-19-67646#.XymD0fiIIbg.twitter Pay attention to how NOT to wear a mask. Gaps around the sides and leaving your nose exposed renders them ineffective. Please take care!,1
1290656667743465472,Cut money supply to #BollywoodMafia and they would lose their clout soon. 1. Corona is already making them lose money; 2. SSR controversy will do a big reputation loss &amp; loss of advertising revenue; 3. Let CBI / ED do an in depth investigation of Bollywood mafia and link to ISI,1
1290638213254729729,"Listen let’s cut the crap and do a virus to virus, pandemic to pandemic handling: Ebola response vs Covid response. Use facts not fiction: In common = WHO & Fauci Difference = response Results: Ebola = 2 dead in US Corona = 154,000 dead in US",0
1290674248462131201,"@SaraDaviesCC is doing something awesome during Covid and helping out companies in the north east by sharing content to try and promote their business. We are a north east, Mobile App development business called Mobile Rocket More details in the video by @JacobIreson :) ",1
1290675185977368577,"Can you provide the scientific evidence that masks prevent, stop or cure COVID-19? I don't want you, or anyone else's opinion, I am asking for scientific evidence",0
1290650594672283648,"He added: ""The 'Corona' crisis has caused havoc across the country. Even the government of Maharashtra is trying its best to defeat the virus. Maybe, those who are envious of the success and popularity of Maharashtra Government have started politicising the death.""",0
1290676661092904960,In the prevailing circumstances it will be difficult for so many students to travel.Covid is also rising.Consider everyone’s problem.#postponeclat2020 @ProfFMustafa @NLSIUofficial,0
1290675458225377282,Does covid 19 really exist or is the test bogus? Why do so many people test positive with no symptoms.,0
1290675385588424704,"When the COVID vaccine is announced in the distant future, the first people we’ll tell will be the construction workers at Broadway Park next door.",0
1290672479703379969,if they drag bts all the way to new york while the situation with corona is so bad i will throw hands,0
1290674817985896449,"They’ll give you the straight facts. COVID is a hoax, Trump never lies, Russian election interference made up, Trump has done more for black people than any other president, Trump works while he golfs, no child separations, no cages, no secret police, no kidnappings, no grabbing.",0
1290647360088006663,Maybe they only voted based on post corona form because before corona cr7 was so clear even infront of immobilie,0
1290675770126405634,"Noted and thanks, we will vote for Biden.. If you want more COVID bodies lined up, more police Brutality, A DICTATOR , A scammer, A Man whose name should end with Bankruptcy , then Vote for #TrumpVirus #KKKTrump",1
1290675075788808198,At the cusp of when Covid started I was fortunate enough to wed my Bestie in the privacy of our home. Just getting around to officially changing my name &amp; now making it “social media official” :). Always a Gonzalez now hello Mrs.McCraw! ,1
1290674526498500610,"Join COVID-19 modeling experts Nigel Goldenfeld and Sergei Maslov at 11:30 a.m. Thursday. They will discuss their modeling, how it's influencing the #ILLINOIS campus testing, and how the university is using these models in decision-making. https://bit.ly/3kd6zgP",0
1290669437666959362,"If corona doesn’t eradicate (and it wont so easily), does it mean we are going to complete our whole university online?? Because apparently no one responsible for our education is giving a shit about it right now. #EndEducationalLockdown #smartlyreopenLUMS #LUMS",1
1290646148152201225,i am 99% sure that a 1D reunion would’ve happened if corona wouldn’t have came,0
1290677515376193536,The federal government’s strategy is to let Covid roll through dem states per Jared Kushner’s plan. Congress must take Covid out of trumps hands. Emergency act through court or thru a law. This has gone too far.,0
1290676775782092800,imagine being so selfish to not wear a mask in a public place. It literally puts everyone at an even greater risk than we already are. We've been down people all week at work because of covid and we were also slammed with people coming in :),0
1290674620324954112,"can't we really make this world a better place to stay? I mean, yes, there's a pandemic going on, a shitty government and no concrete plan to lessen the cases of covid. but really?? we only have this platform to have fun and escape that fucked up world for the mean time ++",1
1290664171986718723,my aunty was forced to reduce the guest list for her wedding next month due to corona &amp; instead of mfs being understanding about the shit my cousin got mad and blocked the whole bridal party ,0
1290666293696372737,"fuck off. schools would become a corona virus hotspot. students and teachers getting infected left and right, the older staff being at an extreme risk. all you care about is money, not the lives of the people. do you not realize the harm of this? do you have any morals? ",1
1290663279229112322,so he gonna pretend like that kid who came back to school didn’t just get tested positive for the corona and he wants to open schools? i- ok,1
