Tweet id,Tweet text,True/False?
1290674028458516480,"Many essential workers who face the highest COVID-19 risks also have the fewest labor protections and face the biggest barriers to speaking up about safety, Reindel said. Black workers were twice as likely as white workers to report that they or a fellow employee ",0
1290668754330943488,This corona virus ain’t no joke and some people acting like the don’t care if they get it ,1
1290672153499582465,Just had a random thought that #Corona isn't necessarily what spreads but rather a byproduct that latches itself onto other dormant infections pre-existing within the body.,1
1290674793671426049,"That jacket can transmit covid, see how dirty it is looking. Please they should be charged already since they are still alive.",0
1290676917239242754,"Also risk accumulates with exposure. With COVID, the more you are exposed to others, the higher your risk of getting it. You’re already at risk going to the grocery store, going out more adds more risk.",0
1290638735374049281,Us wearing masks for flu seasons going forward really isn't the craziest thing. Maybe not to the extent of corona masking but in retrospect it's odd that we haven't seen more people masking when they had a cold or whatnot in the last few years.,0
1290673764913618946,"Moving forward into the 'new normal' working world, a robust employee recognition strategy could help employees adapt post-COVID. ",0
1290655187883954182,It's OK but be care about viral fever and also Corona. Stay safely ,1
1290674191717425158,Only problem with that statement is the death rate for children is 0%. It hasn't even been proven that asymptomatic people can transmit covid to others,0
1290659410847686661,You better wake up corona is a part of the society now ,1
1290654081829285894,Updated ways of love-making in corona days ,0
1290674635969908736,If not having had Covid stops people from travelling then people will go out and get it on purpose,0
1290677279962664962,"The workers wore masks & I tried to stay as far away as I could. But they did not wear gloves & touched so many things. We cleaned with FDA #COVID approved cleaners. But you can only clean so well, they were all over, &amp; I caught one wear his mask below his nose as he left. ",0
1290647713751629826,Sir if you want to make delhi corona free please stop testing than all peoples recovered than again delhi become corona . Atleast you can say that we don't do testing in delhi,1
1290676492108800006,"You obviously don’t or you wouldn’t be spreading misinformation. Link your studies o wizened scholar of COVID, particularly the ones that show mask wearing is not effective.",1
1290637588391440385,Corona virus should not create social distance between you and your customers. Let me bring you closer to your customers with a dashing website #blueatomsmedia #justicefornipost #tuesdaymood #dontleavemechallenge #resultsday2020 #DigitalMarketing #BBNaija,1
1290675677503590401,"Parents and grandparents that are high risk need to make that decision for themselves. My kids’ grandparents will not be coming to the games, and have kept to themselves during this situation. Teenagers with unlimited free time is a way bigger risk than COVID-19 is to them.",0
1290675623812370435,i think bighit knows better then to send them to where covid cases are still skyrocketing soooo fingers crossed ,1
1290640858006650882,Was it scientific temper that made @INCKerala leaders like Muraleedharan to make statements like “corona won’t survive in 30 degree Celsius” ,1
1290652981134790656,All human body is not the same ....few may overcome but many may not overcome corona.....if we appear for neet .....then finally if something happens .....will our souls attend college ?,1
1290672910005350400,"""It's kind of like being in solitary confinement, but I haven't done anything wrong"" - the #mentalhealth challenges compounded by Corona are likely to last much longer than the virus ",1
1290647721616039936,"Thank you so much Jogi sir, corona scare is not letting it make my best one though ",1
1290675283796930560,"covid test finally came in the mail today, antibodies are negative now we wait for the results for the active virus",0
1290675766200602624,"So we're going to wear masks for ever then? Cause covid isn't going anywhere, just like the flu or common cold.",1
1290670329719709696,Can corona virus take more than 15 days to show symptoms? ,1
1290654145234571264,"Grt8, Delhi Government has successfully controlled the spread of corona. Good that other states need to follow the technique. Hope all the states also reduce the numbers so that people can come out freely.",1
1290676793050005505,"Visiting Nurse needs cloth masks! With COVID sticking around for the foreseeable future, we are hoping our generous supporters can again donate cloth face masks to our agency. These masks will be used by family members, volunteers and staff. Call (260) 435-3222 to help. ",0
1290663103751950344,"You can prevent covid-19 by not becoming infected with corona virus, I understand. For this, it would be good to contain the spread of the virus as much as possible.",0
1290677426033496066,The COVID-19 era is (counter inuatively) germ-freak heaven. This is because in normal times their strange behaviour to avoid germs stands out &amp; makes us giggle at them. But now we’re not giggling but doing the same things so they fit in &amp; don’t stand out thus happy times for them,1
1290675135624515585,"My takeaway from today's #covid19ab update is that when a political agenda rubs against health directives, the result is mixed messaging. Masks and physical distancing are crucial... but not when kids are packed into a classroom, because Covid only travels in one direction?",1
1290639813037690881,Can you still get like regular sick or is everything considered Corona? Just trying to find out if I'm dying or got a normal cold.,0
1290662439177146368,"Strong and effective measures! Corona will be simply too scared to infect people in the AM and will be naturally unable to infect them in the PM. 5-2-5 was just the start. But this? it will end corona, this. ",0
1290675217157828609,"Covid isn’t going anywhere anytime soon, best to adjust to what’s going on and continue living your life as planned",0
1290668219196305408,Testing is reduced so cases are down . It's a great way to get corona free . Thanks to the government,0
1290656176896712705,Corona is second worst thing to humanity Online classes are still the first,0
1290676763450912768,I have serious problems w/ this explanation. My kid has no less than 5 masks that fit perfectly. And she listens to her teacher better than she does to me. Compliance shouldn't be any bigger an issue with little kids than it is w/ older kids whose parents deny COVID even exists. ,1
1290647583703080961,Staying with my kids they were masks and frequently wash their hands. They know of Corona and are strick on that but older beings We are assuming let's be like kids very keen at following orders,1
1290675553230393345,"If that was not possible enough, at least some precautions taken ! Nothing can save us now , is this how we combat against a deadly invisible virus ? Educated and elite folks are considered to be frontline soldiers to combat Covid-19.",0
1290660382198116355,Ministry of Health Infection Control: Corona transmission through air and fans has not proven the most dangerous means of ventilation ,1
1290676743028834305,"Honest question, do you believe without fentanyl + other drugs and without having covid-19, the neck compression kills him or is even there in the first place if he isn’t resisting?",0
1290675273545981953,"For the record, lockdown is not necessary to control Covid. The data from the UK showed voluntary measures made a bigger impact. The way to prevent deaths is to protect old people, particularly in care homes. That doesn't require authoritarian controls on the healthy young.",0
1290675714811998217,It’s also important to keep in mind there is about a two week lag with most things related to COVID-19. It can take up to two weeks for those infected to feel sick and get tested. It takes about two weeks for the most sick to die. So the first impact of mask wearing also lags,0
1290651768838332416,"Ion know who need to hear this, but go get tested. That Corona test a breeze. Ain get a brain poke. Places like Wal Greens on Terry let you swab yourself. UMC administers the swab but it’s not bad.",1
1290658776731787264,Corona would never have happened ,0
1290660627929849856,"It is more of ""Peace for Mind"" than of actual any use. 80% cases are asymptomatic. So even if you have corona you can lie in normal range. ",0
1290665779113803776,"doesn't matter what your political views are, wearing a mask is a selfless act that ensure you aren't the one spreading corona to others - his actions were totally irresponsible",0
1290670011002970113,"Scientist James Lovelock, Gaia theory creator, feels Corona is a product of evolution. May be when the population grows so fast, and when so many suffer, there needs to be some self regulating mechanism to keep the earth going.",1
1290676982187847682,"i really hope so, face to face can’t be happening since the result for covid hasn’t improved that much yey",1
1290640579404148736,"I have an appointment this morning.I am required to wear a mask into the building. But once I get to my appointment, I’m allowed to take off my mask But masks save lives? I can only catch corona at the entrance?",0
1290677721157079040,"Calm yo asses down , stress causes your immune system to not work as good so you have more chances to catch the virus, please stay calm and know that if you are healthy and calm, you wear a mask and wash you’ll be ok. And if you get Covid try to stay calm and you will get thru it",1
1290676859038883841,"Don’t make it a “thing” Just do it. Wear your Mask in public If you seriously have difficulty breathing when wearing a mask, you are high risk for covid &amp; should be staying indoors.",0
1290656234186645506,"If I had three wishes from a genie I would use them to become good at skateboard tricks, be able to do a shakira impression that would kill at parties, and get rid of corona virus so I could show it off",0
1290661247541809156,I agree kneeling on neck is not good. But there is no damage to his neck. The officer's were trying to keep his head turned away from them since he was saying he had ccp chinese corona virus. The next video will show him banging his head against the glass.,1
1290648747932876800,Just walked by two people without a mask on and heard one of them say “we don’t need to wear one right now corona isn’t awake yet”,0
1290653377999835138,Oh my god. Please stop guessing at things and posting immediately. Stop trying to cause problems. Influenza is not a corona virus. ,1
